{
  "generated_at": "2026-02-24 14:13:26",
  "period": "1 Bulan",
  "days": 30,
  "stocks": {
    "ANTM": {
      "code": "ANTM",
      "date_start": "2026-01-05",
      "date_end": "2026-02-18",
      "summary": {
        "whale_buy": 10427.269999999999,
        "retail_buy": 12962.14,
        "whale_sell": 10187.69,
        "retail_sell": 12455.899999999996,
        "whale_net": 239.5799999999981,
        "retail_net": 506.2400000000034,
        "total_buy": 23389.409999999996,
        "total_sell": 22643.589999999997,
        "whale_cum_buy_lot": 0,
        "whale_cum_sell_lot": 0,
        "retail_cum_buy_lot": 0,
        "retail_cum_sell_lot": 0,
        "whale_net_lot": 0,
        "retail_net_lot": 0,
        "whale_buyavg": 4052.14,
        "whale_sellavg": 4088.03,
        "retail_buyavg": 4067.85,
        "retail_sellavg": 4045.48
      },
      "brokers": [],
      "daily": [
        {
          "day": 86,
          "date": "2026-01-05",
          "date_display": "05/01/2026",
          "date_end": "2026-01-05",
          "whale_buy": 279.19,
          "retail_buy": 210.16,
          "whale_sell": 221.53,
          "retail_sell": 230.86,
          "whale_buyavg": 3330.39,
          "whale_sellavg": 3330.75,
          "retail_buyavg": 3333.88,
          "retail_sellavg": 3333.89,
          "whale_cum_buy": 14270.83,
          "retail_cum_buy": 18161.51,
          "whale_cum_sell": 13886.31,
          "retail_cum_sell": 19076.82,
          "whale_net": 57.66,
          "retail_net": -20.71,
          "whale_cum_net": 384.52,
          "retail_cum_net": -915.31,
          "whale_cum_buy_lot": 43800110,
          "whale_cum_sell_lot": 42540182,
          "retail_cum_buy_lot": 55977637,
          "retail_cum_sell_lot": 58900928,
          "whale_net_lot": 1259928,
          "retail_net_lot": -2923291
        },
        {
          "day": 87,
          "date": "2026-01-06",
          "date_display": "06/01/2026",
          "date_end": "2026-01-06",
          "whale_buy": 155.63,
          "retail_buy": 252.88,
          "whale_sell": 162.27,
          "retail_sell": 236.1,
          "whale_buyavg": 3423.9,
          "whale_sellavg": 3423.74,
          "retail_buyavg": 3424.7,
          "retail_sellavg": 3426.74,
          "whale_cum_buy": 14426.45,
          "retail_cum_buy": 18414.4,
          "whale_cum_sell": 14048.58,
          "retail_cum_sell": 19312.92,
          "whale_net": -6.65,
          "retail_net": 16.79,
          "whale_cum_net": 377.88,
          "retail_cum_net": -898.52,
          "whale_cum_buy_lot": 44239337,
          "whale_cum_sell_lot": 42997919,
          "retail_cum_buy_lot": 56714590,
          "retail_cum_sell_lot": 59716577,
          "whale_net_lot": 1241418,
          "retail_net_lot": -3001987
        },
        {
          "day": 88,
          "date": "2026-01-07",
          "date_display": "07/01/2026",
          "date_end": "2026-01-07",
          "whale_buy": 900.69,
          "retail_buy": 849.15,
          "whale_sell": 754.24,
          "retail_sell": 973.21,
          "whale_buyavg": 3764.5,
          "whale_sellavg": 3770.67,
          "retail_buyavg": 3781.08,
          "retail_sellavg": 3771.85,
          "whale_cum_buy": 15327.15,
          "retail_cum_buy": 19263.55,
          "whale_cum_sell": 14802.82,
          "retail_cum_sell": 20286.13,
          "whale_net": 146.45,
          "retail_net": -124.06,
          "whale_cum_net": 524.33,
          "retail_cum_net": -1022.58,
          "whale_cum_buy_lot": 46553334,
          "whale_cum_sell_lot": 44904755,
          "retail_cum_buy_lot": 58892164,
          "retail_cum_sell_lot": 62236653,
          "whale_net_lot": 1648579,
          "retail_net_lot": -3344489
        },
        {
          "day": 89,
          "date": "2026-01-08",
          "date_display": "08/01/2026",
          "date_end": "2026-01-08",
          "whale_buy": 345.35,
          "retail_buy": 611.9,
          "whale_sell": 291.3,
          "retail_sell": 682.17,
          "whale_buyavg": 3618.98,
          "whale_sellavg": 3595.73,
          "retail_buyavg": 3610.27,
          "retail_sellavg": 3616.1,
          "whale_cum_buy": 15672.49,
          "retail_cum_buy": 19875.45,
          "whale_cum_sell": 15094.12,
          "retail_cum_sell": 20968.3,
          "whale_net": 54.05,
          "retail_net": -70.27,
          "whale_cum_net": 578.37,
          "retail_cum_net": -1092.85,
          "whale_cum_buy_lot": 47442612,
          "whale_cum_sell_lot": 45719425,
          "retail_cum_buy_lot": 60622619,
          "retail_cum_sell_lot": 63840772,
          "whale_net_lot": 1723187,
          "retail_net_lot": -3218153
        },
        {
          "day": 90,
          "date": "2026-01-09",
          "date_display": "09/01/2026",
          "date_end": "2026-01-09",
          "whale_buy": 280.95,
          "retail_buy": 557.47,
          "whale_sell": 238.69,
          "retail_sell": 533.27,
          "whale_buyavg": 3564.29,
          "whale_sellavg": 3550.67,
          "retail_buyavg": 3559.74,
          "retail_sellavg": 3565.51,
          "whale_cum_buy": 15953.44,
          "retail_cum_buy": 20432.92,
          "whale_cum_sell": 15332.81,
          "retail_cum_sell": 21501.57,
          "whale_net": 42.26,
          "retail_net": 24.2,
          "whale_cum_net": 620.64,
          "retail_cum_net": -1068.66,
          "whale_cum_buy_lot": 48235445,
          "whale_cum_sell_lot": 46397691,
          "retail_cum_buy_lot": 62189707,
          "retail_cum_sell_lot": 65336897,
          "whale_net_lot": 1837754,
          "retail_net_lot": -3147190
        },
        {
          "day": 91,
          "date": "2026-01-12",
          "date_display": "12/01/2026",
          "date_end": "2026-01-12",
          "whale_buy": 360.45,
          "retail_buy": 726.38,
          "whale_sell": 344.68,
          "retail_sell": 657.43,
          "whale_buyavg": 3835.35,
          "whale_sellavg": 3847.33,
          "retail_buyavg": 3848.43,
          "retail_sellavg": 3841.11,
          "whale_cum_buy": 16313.9,
          "retail_cum_buy": 21159.3,
          "whale_cum_sell": 15677.49,
          "retail_cum_sell": 22159.0,
          "whale_net": 15.77,
          "retail_net": 68.96,
          "whale_cum_net": 636.41,
          "retail_cum_net": -999.7,
          "whale_cum_buy_lot": 49108219,
          "whale_cum_sell_lot": 47213136,
          "retail_cum_buy_lot": 64018610,
          "retail_cum_sell_lot": 66967000,
          "whale_net_lot": 1895083,
          "retail_net_lot": -2948390
        },
        {
          "day": 92,
          "date": "2026-01-13",
          "date_display": "13/01/2026",
          "date_end": "2026-01-13",
          "whale_buy": 306.35,
          "retail_buy": 395.48,
          "whale_sell": 350.21,
          "retail_sell": 446.74,
          "whale_buyavg": 3875.07,
          "whale_sellavg": 3875.01,
          "retail_buyavg": 3874.79,
          "retail_sellavg": 3874.75,
          "whale_cum_buy": 16620.25,
          "retail_cum_buy": 21554.78,
          "whale_cum_sell": 16027.7,
          "retail_cum_sell": 22605.74,
          "whale_net": -43.86,
          "retail_net": -51.26,
          "whale_cum_net": 592.54,
          "retail_cum_net": -1050.96,
          "whale_cum_buy_lot": 49894969,
          "whale_cum_sell_lot": 48116761,
          "retail_cum_buy_lot": 65038900,
          "retail_cum_sell_lot": 68151696,
          "whale_net_lot": 1778208,
          "retail_net_lot": -3112796
        },
        {
          "day": 93,
          "date": "2026-01-14",
          "date_display": "14/01/2026",
          "date_end": "2026-01-14",
          "whale_buy": 364.8,
          "retail_buy": 337.84,
          "whale_sell": 231.38,
          "retail_sell": 400.63,
          "whale_buyavg": 4078.14,
          "whale_sellavg": 4080.11,
          "retail_buyavg": 4081.06,
          "retail_sellavg": 4080.22,
          "whale_cum_buy": 16985.05,
          "retail_cum_buy": 21892.62,
          "whale_cum_sell": 16259.09,
          "retail_cum_sell": 23006.37,
          "whale_net": 133.42,
          "retail_net": -62.79,
          "whale_cum_net": 725.96,
          "retail_cum_net": -1113.76,
          "whale_cum_buy_lot": 50768639,
          "whale_cum_sell_lot": 48645142,
          "retail_cum_buy_lot": 65835066,
          "retail_cum_sell_lot": 69110808,
          "whale_net_lot": 2123497,
          "retail_net_lot": -3275742
        },
        {
          "day": 94,
          "date": "2026-01-15",
          "date_display": "15/01/2026",
          "date_end": "2026-01-15",
          "whale_buy": 291.4,
          "retail_buy": 252.22,
          "whale_sell": 303.73,
          "retail_sell": 280.34,
          "whale_buyavg": 4075.38,
          "whale_sellavg": 4080.4,
          "retail_buyavg": 4093.64,
          "retail_sellavg": 4082.94,
          "whale_cum_buy": 17276.45,
          "retail_cum_buy": 22144.84,
          "whale_cum_sell": 16562.82,
          "retail_cum_sell": 23286.72,
          "whale_net": -12.33,
          "retail_net": -28.12,
          "whale_cum_net": 713.63,
          "retail_cum_net": -1141.88,
          "whale_cum_buy_lot": 51483739,
          "whale_cum_sell_lot": 49389533,
          "retail_cum_buy_lot": 66450975,
          "retail_cum_sell_lot": 69797191,
          "whale_net_lot": 2094206,
          "retail_net_lot": -3346216
        },
        {
          "day": 95,
          "date": "2026-01-19",
          "date_display": "19/01/2026",
          "date_end": "2026-01-19",
          "whale_buy": 146.97,
          "retail_buy": 240.32,
          "whale_sell": 295.73,
          "retail_sell": 230.04,
          "whale_buyavg": 4018.94,
          "whale_sellavg": 4018.23,
          "retail_buyavg": 4011.17,
          "retail_sellavg": 4019.31,
          "whale_cum_buy": 17423.42,
          "retail_cum_buy": 22385.16,
          "whale_cum_sell": 16858.55,
          "retail_cum_sell": 23516.76,
          "whale_net": -148.76,
          "retail_net": 10.28,
          "whale_cum_net": 564.87,
          "retail_cum_net": -1131.6,
          "whale_cum_buy_lot": 51819925,
          "whale_cum_sell_lot": 50128924,
          "retail_cum_buy_lot": 66919349,
          "retail_cum_sell_lot": 70308907,
          "whale_net_lot": 1691001,
          "retail_net_lot": -3389558
        },
        {
          "day": 96,
          "date": "2026-01-20",
          "date_display": "20/01/2026",
          "date_end": "2026-01-20",
          "whale_buy": 176.72,
          "retail_buy": 338.65,
          "whale_sell": 154.1,
          "retail_sell": 290.89,
          "whale_buyavg": 4034.78,
          "whale_sellavg": 4052.03,
          "retail_buyavg": 4051.51,
          "retail_sellavg": 4042.9,
          "whale_cum_buy": 17600.14,
          "retail_cum_buy": 22723.81,
          "whale_cum_sell": 17012.65,
          "retail_cum_sell": 23807.64,
          "whale_net": 22.62,
          "retail_net": 47.77,
          "whale_cum_net": 587.49,
          "retail_cum_net": -1083.83,
          "whale_cum_buy_lot": 52256290,
          "whale_cum_sell_lot": 50507882,
          "retail_cum_buy_lot": 67754728,
          "retail_cum_sell_lot": 71026423,
          "whale_net_lot": 1748408,
          "retail_net_lot": -3271695
        },
        {
          "day": 97,
          "date": "2026-01-21",
          "date_display": "21/01/2026",
          "date_end": "2026-01-21",
          "whale_buy": 306.31,
          "retail_buy": 513.77,
          "whale_sell": 406.94,
          "retail_sell": 490.89,
          "whale_buyavg": 4219.35,
          "whale_sellavg": 4222.48,
          "retail_buyavg": 4225.97,
          "retail_sellavg": 4225.76,
          "whale_cum_buy": 17906.46,
          "retail_cum_buy": 23237.58,
          "whale_cum_sell": 17419.59,
          "retail_cum_sell": 24298.53,
          "whale_net": -100.63,
          "retail_net": 22.88,
          "whale_cum_net": 486.87,
          "retail_cum_net": -1060.95,
          "whale_cum_buy_lot": 52950910,
          "whale_cum_sell_lot": 51451180,
          "retail_cum_buy_lot": 68941755,
          "retail_cum_sell_lot": 72158774,
          "whale_net_lot": 1499730,
          "retail_net_lot": -3217019
        },
        {
          "day": 98,
          "date": "2026-01-22",
          "date_display": "22/01/2026",
          "date_end": "2026-01-22",
          "whale_buy": 352.02,
          "retail_buy": 320.71,
          "whale_sell": 433.69,
          "retail_sell": 280.74,
          "whale_buyavg": 4187.29,
          "whale_sellavg": 4179.92,
          "retail_buyavg": 4180.71,
          "retail_sellavg": 4192.24,
          "whale_cum_buy": 18258.47,
          "retail_cum_buy": 23558.29,
          "whale_cum_sell": 17853.28,
          "retail_cum_sell": 24579.26,
          "whale_net": -81.67,
          "retail_net": 39.97,
          "whale_cum_net": 405.19,
          "retail_cum_net": -1020.97,
          "whale_cum_buy_lot": 53792822,
          "whale_cum_sell_lot": 52489389,
          "retail_cum_buy_lot": 69709302,
          "retail_cum_sell_lot": 72829121,
          "whale_net_lot": 1303433,
          "retail_net_lot": -3119819
        },
        {
          "day": 99,
          "date": "2026-01-23",
          "date_display": "23/01/2026",
          "date_end": "2026-01-23",
          "whale_buy": 256.17,
          "retail_buy": 243.23,
          "whale_sell": 217.71,
          "retail_sell": 224.89,
          "whale_buyavg": 4328.96,
          "whale_sellavg": 4334.47,
          "retail_buyavg": 4332.64,
          "retail_sellavg": 4332.72,
          "whale_cum_buy": 18514.65,
          "retail_cum_buy": 23801.52,
          "whale_cum_sell": 18070.99,
          "retail_cum_sell": 24804.15,
          "whale_net": 38.46,
          "retail_net": 18.35,
          "whale_cum_net": 443.66,
          "retail_cum_net": -1002.63,
          "whale_cum_buy_lot": 54371640,
          "whale_cum_sell_lot": 52975837,
          "retail_cum_buy_lot": 70385778,
          "retail_cum_sell_lot": 73327609,
          "whale_net_lot": 1395803,
          "retail_net_lot": -2941831
        },
        {
          "day": 100,
          "date": "2026-01-26",
          "date_display": "26/01/2026",
          "date_end": "2026-01-26",
          "whale_buy": 637.97,
          "retail_buy": 1081.13,
          "whale_sell": 728.25,
          "retail_sell": 952.12,
          "whale_buyavg": 4735.74,
          "whale_sellavg": 4760.01,
          "retail_buyavg": 4736.69,
          "retail_sellavg": 4723.53,
          "whale_cum_buy": 19152.62,
          "retail_cum_buy": 24882.65,
          "whale_cum_sell": 18799.24,
          "retail_cum_sell": 25756.26,
          "whale_net": -90.28,
          "retail_net": 129.01,
          "whale_cum_net": 353.38,
          "retail_cum_net": -873.62,
          "whale_cum_buy_lot": 55656686,
          "whale_cum_sell_lot": 54432968,
          "retail_cum_buy_lot": 72607343,
          "retail_cum_sell_lot": 75280791,
          "whale_net_lot": 1223718,
          "retail_net_lot": -2673448
        },
        {
          "day": 101,
          "date": "2026-01-27",
          "date_display": "27/01/2026",
          "date_end": "2026-01-27",
          "whale_buy": 313.39,
          "retail_buy": 715.49,
          "whale_sell": 274.78,
          "retail_sell": 672.83,
          "whale_buyavg": 4616.47,
          "whale_sellavg": 4623.26,
          "retail_buyavg": 4624.61,
          "retail_sellavg": 4622.8,
          "whale_cum_buy": 19466.01,
          "retail_cum_buy": 25598.14,
          "whale_cum_sell": 19074.01,
          "retail_cum_sell": 26429.1,
          "whale_net": 38.62,
          "retail_net": 42.66,
          "whale_cum_net": 392.0,
          "retail_cum_net": -830.96,
          "whale_cum_buy_lot": 56290841,
          "whale_cum_sell_lot": 55027305,
          "retail_cum_buy_lot": 74198483,
          "retail_cum_sell_lot": 76742926,
          "whale_net_lot": 1263536,
          "retail_net_lot": -2544443
        },
        {
          "day": 102,
          "date": "2026-01-28",
          "date_display": "28/01/2026",
          "date_end": "2026-01-28",
          "whale_buy": 1026.62,
          "retail_buy": 883.74,
          "whale_sell": 1383.5,
          "retail_sell": 585.91,
          "whale_buyavg": 4404.5,
          "whale_sellavg": 4432.43,
          "retail_buyavg": 4446.12,
          "retail_sellavg": 4415.51,
          "whale_cum_buy": 20492.63,
          "retail_cum_buy": 26481.88,
          "whale_cum_sell": 20457.51,
          "retail_cum_sell": 27015.01,
          "whale_net": -356.88,
          "retail_net": 297.83,
          "whale_cum_net": 35.12,
          "retail_cum_net": -533.13,
          "whale_cum_buy_lot": 58652013,
          "whale_cum_sell_lot": 58174770,
          "retail_cum_buy_lot": 75983164,
          "retail_cum_sell_lot": 78108241,
          "whale_net_lot": 477243,
          "retail_net_lot": -2125077
        },
        {
          "day": 103,
          "date": "2026-01-29",
          "date_display": "29/01/2026",
          "date_end": "2026-01-29",
          "whale_buy": 955.33,
          "retail_buy": 795.88,
          "whale_sell": 680.64,
          "retail_sell": 774.72,
          "whale_buyavg": 4180.91,
          "whale_sellavg": 4158.94,
          "retail_buyavg": 4193.78,
          "retail_sellavg": 4165.09,
          "whale_cum_buy": 21447.96,
          "retail_cum_buy": 27277.76,
          "whale_cum_sell": 21138.15,
          "retail_cum_sell": 27789.73,
          "whale_net": 274.69,
          "retail_net": 21.17,
          "whale_cum_net": 309.81,
          "retail_cum_net": -511.96,
          "whale_cum_buy_lot": 60535878,
          "whale_cum_sell_lot": 59976470,
          "retail_cum_buy_lot": 78036803,
          "retail_cum_sell_lot": 79955748,
          "whale_net_lot": 559408,
          "retail_net_lot": -1918945
        },
        {
          "day": 104,
          "date": "2026-01-30",
          "date_display": "30/01/2026",
          "date_end": "2026-01-30",
          "whale_buy": 422.4,
          "retail_buy": 419.82,
          "whale_sell": 484.75,
          "retail_sell": 593.31,
          "whale_buyavg": 4222.67,
          "whale_sellavg": 4217.69,
          "retail_buyavg": 4219.74,
          "retail_sellavg": 4220.97,
          "whale_cum_buy": 21870.36,
          "retail_cum_buy": 27697.58,
          "whale_cum_sell": 21622.9,
          "retail_cum_sell": 28383.04,
          "whale_net": -62.35,
          "retail_net": -173.49,
          "whale_cum_net": 247.45,
          "retail_cum_net": -685.46,
          "whale_cum_buy_lot": 61534947,
          "whale_cum_sell_lot": 61125178,
          "retail_cum_buy_lot": 79033804,
          "retail_cum_sell_lot": 81361471,
          "whale_net_lot": 409769,
          "retail_net_lot": -2327667
        },
        {
          "day": 105,
          "date": "2026-02-02",
          "date_display": "02/02/2026",
          "date_end": "2026-02-02",
          "whale_buy": 373.12,
          "retail_buy": 520.56,
          "whale_sell": 348.31,
          "retail_sell": 441.13,
          "whale_buyavg": 3738.98,
          "whale_sellavg": 3742.34,
          "retail_buyavg": 3740.57,
          "retail_sellavg": 3745.47,
          "whale_cum_buy": 22243.48,
          "retail_cum_buy": 28218.14,
          "whale_cum_sell": 21971.21,
          "retail_cum_sell": 28824.17,
          "whale_net": 24.82,
          "retail_net": 79.42,
          "whale_cum_net": 272.27,
          "retail_cum_net": -606.03,
          "whale_cum_buy_lot": 62617328,
          "whale_cum_sell_lot": 62143095,
          "retail_cum_buy_lot": 80519349,
          "retail_cum_sell_lot": 82648882,
          "whale_net_lot": 474233,
          "retail_net_lot": -2129533
        },
        {
          "day": 106,
          "date": "2026-02-03",
          "date_display": "03/02/2026",
          "date_end": "2026-02-03",
          "whale_buy": 305.93,
          "retail_buy": 412.0,
          "whale_sell": 273.61,
          "retail_sell": 234.21,
          "whale_buyavg": 3921.84,
          "whale_sellavg": 3925.77,
          "retail_buyavg": 3933.95,
          "retail_sellavg": 3932.68,
          "whale_cum_buy": 22549.41,
          "retail_cum_buy": 28630.15,
          "whale_cum_sell": 22244.82,
          "retail_cum_sell": 29058.38,
          "whale_net": 32.32,
          "retail_net": 177.79,
          "whale_cum_net": 304.59,
          "retail_cum_net": -428.24,
          "whale_cum_buy_lot": 63396331,
          "whale_cum_sell_lot": 62827079,
          "retail_cum_buy_lot": 81557209,
          "retail_cum_sell_lot": 83217509,
          "whale_net_lot": 569252,
          "retail_net_lot": -1660300
        },
        {
          "day": 107,
          "date": "2026-02-04",
          "date_display": "04/02/2026",
          "date_end": "2026-02-04",
          "whale_buy": 219.11,
          "retail_buy": 339.85,
          "whale_sell": 281.28,
          "retail_sell": 308.1,
          "whale_buyavg": 4026.16,
          "whale_sellavg": 4026.16,
          "retail_buyavg": 4026.21,
          "retail_sellavg": 4023.21,
          "whale_cum_buy": 22768.53,
          "retail_cum_buy": 28970.0,
          "whale_cum_sell": 22526.1,
          "retail_cum_sell": 29366.49,
          "whale_net": -62.17,
          "retail_net": 31.75,
          "whale_cum_net": 242.42,
          "retail_cum_net": -396.49,
          "whale_cum_buy_lot": 63974872,
          "whale_cum_sell_lot": 63517333,
          "retail_cum_buy_lot": 82399532,
          "retail_cum_sell_lot": 84048132,
          "whale_net_lot": 457539,
          "retail_net_lot": -1648600
        },
        {
          "day": 108,
          "date": "2026-02-05",
          "date_display": "05/02/2026",
          "date_end": "2026-02-05",
          "whale_buy": 273.24,
          "retail_buy": 228.62,
          "whale_sell": 304.45,
          "retail_sell": 231.85,
          "whale_buyavg": 3873.54,
          "whale_sellavg": 3866.95,
          "retail_buyavg": 3868.88,
          "retail_sellavg": 3872.24,
          "whale_cum_buy": 23041.76,
          "retail_cum_buy": 29198.62,
          "whale_cum_sell": 22830.55,
          "retail_cum_sell": 29598.34,
          "whale_net": -31.21,
          "retail_net": -3.23,
          "whale_cum_net": 211.21,
          "retail_cum_net": -399.72,
          "whale_cum_buy_lot": 64689184,
          "whale_cum_sell_lot": 64312503,
          "retail_cum_buy_lot": 83008962,
          "retail_cum_sell_lot": 84662930,
          "whale_net_lot": 376681,
          "retail_net_lot": -1653968
        },
        {
          "day": 109,
          "date": "2026-02-06",
          "date_display": "06/02/2026",
          "date_end": "2026-02-06",
          "whale_buy": 254.88,
          "retail_buy": 236.85,
          "whale_sell": 224.0,
          "retail_sell": 209.46,
          "whale_buyavg": 3736.3,
          "whale_sellavg": 3735.2,
          "retail_buyavg": 3745.95,
          "retail_sellavg": 3747.36,
          "whale_cum_buy": 23296.64,
          "retail_cum_buy": 29435.46,
          "whale_cum_sell": 23054.55,
          "retail_cum_sell": 29807.8,
          "whale_net": 30.88,
          "retail_net": 27.39,
          "whale_cum_net": 242.09,
          "retail_cum_net": -372.34,
          "whale_cum_buy_lot": 65385500,
          "whale_cum_sell_lot": 64922897,
          "retail_cum_buy_lot": 83644681,
          "retail_cum_sell_lot": 85219077,
          "whale_net_lot": 462603,
          "retail_net_lot": -1574396
        },
        {
          "day": 110,
          "date": "2026-02-09",
          "date_display": "09/02/2026",
          "date_end": "2026-02-09",
          "whale_buy": 224.09,
          "retail_buy": 209.33,
          "whale_sell": 117.73,
          "retail_sell": 236.8,
          "whale_buyavg": 3848.58,
          "whale_sellavg": 3855.7,
          "retail_buyavg": 3855.94,
          "retail_sellavg": 3852.18,
          "whale_cum_buy": 23520.73,
          "retail_cum_buy": 29644.79,
          "whale_cum_sell": 23172.28,
          "retail_cum_sell": 30044.6,
          "whale_net": 106.36,
          "retail_net": -27.47,
          "whale_cum_net": 348.45,
          "retail_cum_net": -399.81,
          "whale_cum_buy_lot": 65959702,
          "whale_cum_sell_lot": 65423829,
          "retail_cum_buy_lot": 84184346,
          "retail_cum_sell_lot": 85830083,
          "whale_net_lot": 535873,
          "retail_net_lot": -1645737
        },
        {
          "day": 111,
          "date": "2026-02-10",
          "date_display": "10/02/2026",
          "date_end": "2026-02-10",
          "whale_buy": 132.17,
          "retail_buy": 185.09,
          "whale_sell": 81.96,
          "retail_sell": 137.98,
          "whale_buyavg": 3916.79,
          "whale_sellavg": 3921.28,
          "retail_buyavg": 3917.47,
          "retail_sellavg": 3919.09,
          "whale_cum_buy": 23652.9,
          "retail_cum_buy": 29829.88,
          "whale_cum_sell": 23254.24,
          "retail_cum_sell": 30182.58,
          "whale_net": 50.21,
          "retail_net": 47.1,
          "whale_cum_net": 398.66,
          "retail_cum_net": -352.71,
          "whale_cum_buy_lot": 66296085,
          "whale_cum_sell_lot": 65630324,
          "retail_cum_buy_lot": 84652814,
          "retail_cum_sell_lot": 86175684,
          "whale_net_lot": 665761,
          "retail_net_lot": -1522870
        },
        {
          "day": 112,
          "date": "2026-02-11",
          "date_display": "11/02/2026",
          "date_end": "2026-02-11",
          "whale_buy": 266.22,
          "retail_buy": 175.51,
          "whale_sell": 190.81,
          "retail_sell": 280.9,
          "whale_buyavg": 3960.1,
          "whale_sellavg": 3960.31,
          "retail_buyavg": 3960.23,
          "retail_sellavg": 3961.85,
          "whale_cum_buy": 23919.12,
          "retail_cum_buy": 30005.39,
          "whale_cum_sell": 23445.05,
          "retail_cum_sell": 30463.48,
          "whale_net": 75.41,
          "retail_net": -105.39,
          "whale_cum_net": 474.07,
          "retail_cum_net": -458.1,
          "whale_cum_buy_lot": 66965383,
          "whale_cum_sell_lot": 66110743,
          "retail_cum_buy_lot": 85094745,
          "retail_cum_sell_lot": 86883606,
          "whale_net_lot": 854640,
          "retail_net_lot": -1788861
        },
        {
          "day": 113,
          "date": "2026-02-12",
          "date_display": "12/02/2026",
          "date_end": "2026-02-12",
          "whale_buy": 204.15,
          "retail_buy": 471.53,
          "whale_sell": 147.41,
          "retail_sell": 410.21,
          "whale_buyavg": 4100.1,
          "whale_sellavg": 4125.01,
          "retail_buyavg": 4118.85,
          "retail_sellavg": 4111.68,
          "whale_cum_buy": 24123.26,
          "retail_cum_buy": 30476.92,
          "whale_cum_sell": 23592.46,
          "retail_cum_sell": 30873.69,
          "whale_net": 56.73,
          "retail_net": 61.32,
          "whale_cum_net": 530.8,
          "retail_cum_net": -396.78,
          "whale_cum_buy_lot": 67454040,
          "whale_cum_sell_lot": 66452601,
          "retail_cum_buy_lot": 86224380,
          "retail_cum_sell_lot": 87892568,
          "whale_net_lot": 1001439,
          "retail_net_lot": -1668188
        },
        {
          "day": 114,
          "date": "2026-02-13",
          "date_display": "13/02/2026",
          "date_end": "2026-02-13",
          "whale_buy": 174.16,
          "retail_buy": 302.1,
          "whale_sell": 187.75,
          "retail_sell": 283.97,
          "whale_buyavg": 4062.45,
          "whale_sellavg": 4059.52,
          "retail_buyavg": 4062.36,
          "retail_sellavg": 4063.85,
          "whale_cum_buy": 24297.43,
          "retail_cum_buy": 30779.02,
          "whale_cum_sell": 23780.21,
          "retail_cum_sell": 31157.66,
          "whale_net": -13.58,
          "retail_net": 18.13,
          "whale_cum_net": 517.22,
          "retail_cum_net": -378.64,
          "whale_cum_buy_lot": 67883117,
          "whale_cum_sell_lot": 66915782,
          "retail_cum_buy_lot": 86969101,
          "retail_cum_sell_lot": 88593012,
          "whale_net_lot": 967335,
          "retail_net_lot": -1623911
        },
        {
          "day": 115,
          "date": "2026-02-18",
          "date_display": "18/02/2026",
          "date_end": "2026-02-18",
          "whale_buy": 121.49,
          "retail_buy": 134.48,
          "whale_sell": 72.26,
          "retail_sell": 144.2,
          "whale_buyavg": 4033.57,
          "whale_sellavg": 4033.71,
          "retail_buyavg": 4038.88,
          "retail_sellavg": 4040.12,
          "whale_cum_buy": 24418.92,
          "retail_cum_buy": 30913.5,
          "whale_cum_sell": 23852.47,
          "retail_cum_sell": 31301.86,
          "whale_net": 49.23,
          "retail_net": -9.72,
          "whale_cum_net": 566.45,
          "retail_cum_net": -388.36,
          "whale_cum_buy_lot": 68184439,
          "whale_cum_sell_lot": 67095621,
          "retail_cum_buy_lot": 87302205,
          "retail_cum_sell_lot": 88950655,
          "whale_net_lot": 1088818,
          "retail_net_lot": -1648450
        }
      ],
      "volatilityTrend": {
        "volatilityFactor": 0.3521,
        "trendDirection": "UPTREND",
        "trendStrength": 2.63,
        "minWhaleBuy": 3330.39,
        "maxWhaleBuy": 4735.74,
        "avgWhaleBuy": 3991.13,
        "avgWhaleSell": 3993.53,
        "lastWhaleBuyPrice": 4033.57
      },
      "recommendation": {
        "score": 1,
        "signals": [
          "Status whale: Normal",
          "Whale sedang akumulasi kuat",
          "Retail euforia/akumulasi berlebih (tanda top)",
          "Tren harga stabil/sideways"
        ],
        "whaleSignal": "bullish",
        "retailSignal": "bearish",
        "retailBullishReason": "",
        "retailBearishReason": "euforia",
        "priceTrend": "neutral",
        "strength": "weak",
        "recommendation": "BUY",
        "isWhaleTrapped": false,
        "whaleTrapLevel": "none",
        "isDistributingToRetail": false,
        "lastPrice": 4033.57,
        "avgWhaleBuy": 4052.14,
        "avgRetailBuy": 4067.85
      },
      "priceRecommendation": {
        "buyZone": 3830.0,
        "targetPrice": 4000.0,
        "sellZone": 4980.0,
        "stopLoss": 3715.0,
        "rrRatio": 1.48,
        "displayRR": 1.5,
        "potentialProfit": 4.4,
        "potentialLoss": 3.0,
        "discountPercent": 0.06,
        "isWhaleTrapped": false,
        "isDistributingToRetail": false,
        "whaleTrapLevel": "none",
        "lastPrice": 4034.0,
        "avgWhaleBuy": 3991.0,
        "avgRetailBuy": 4068.0,
        "buyTick": 10,
        "targetTick": 10,
        "sellTick": 10,
        "stopTick": 10,
        "lowestRecentBuy": 3910.0,
        "strongResistance": 4300.0,
        "minWhaleBuyTick": 3330.0,
        "maxWhaleBuyTick": 4740.0
      },
      "confidence": {
        "confidenceScore": 25,
        "confidenceLevel": "RENDAH",
        "confidenceFactors": [
          "Akumulasi Whale kuat",
          "Trend naik, align dengan BUY",
          "R:RR kurang ideal (1.5:1)",
          "Volatilitas tinggi (risky)"
        ]
      },
      "insights": {
        "whaleInsight": "Whale melakukan <span class=\"highlight\">AKUMULASI</span> sebesar <span class=\"highlight\">Rp 239.6 Miliar</span> dalam 30 hari transaksi. Institusi sedang membeli saham ini.",
        "retailInsight": "Retail melakukan <span class=\"highlight\">AKUMULASI</span> sebesar <span class=\"highlight\">Rp 506.2 Miliar</span> dalam 30 hari transaksi. Puncak akumulasi di hari ke-111 (+-352.7 M). Ini menunjukkan minat beli yang kuat dari investor retail.",
        "whalePeak": 725.96,
        "whalePeakDay": 93,
        "retailPeak": -352.71,
        "retailPeakDay": 111
      }
    },
    "BBTN": {
      "code": "BBTN",
      "date_start": "2026-01-05",
      "date_end": "2026-02-18",
      "summary": {
        "whale_buy": 698.3700000000001,
        "retail_buy": 875.3199999999999,
        "whale_sell": 651.2800000000001,
        "retail_sell": 911.1099999999998,
        "whale_net": 47.09000000000003,
        "retail_net": -35.78999999999985,
        "total_buy": 1573.69,
        "total_sell": 1562.3899999999999,
        "whale_cum_buy_lot": 0,
        "whale_cum_sell_lot": 0,
        "retail_cum_buy_lot": 0,
        "retail_cum_sell_lot": 0,
        "whale_net_lot": 0,
        "retail_net_lot": 0,
        "whale_buyavg": 1263.83,
        "whale_sellavg": 1259.78,
        "retail_buyavg": 1254.51,
        "retail_sellavg": 1257.08
      },
      "brokers": [],
      "daily": [
        {
          "day": 42,
          "date": "2026-01-05",
          "date_display": "05/01/2026",
          "date_end": "2026-01-05",
          "whale_buy": 14.42,
          "retail_buy": 9.62,
          "whale_sell": 16.09,
          "retail_sell": 7.02,
          "whale_buyavg": 1159.28,
          "whale_sellavg": 1157.72,
          "retail_buyavg": 1155.16,
          "retail_sellavg": 1157.93,
          "whale_cum_buy": 431.36,
          "retail_cum_buy": 572.18,
          "whale_cum_sell": 427.72,
          "retail_cum_sell": 598.65,
          "whale_net": -1.68,
          "retail_net": 2.6,
          "whale_cum_net": 3.64,
          "retail_cum_net": -26.47,
          "whale_cum_buy_lot": 3668202,
          "whale_cum_sell_lot": 3666509,
          "retail_cum_buy_lot": 4840528,
          "retail_cum_sell_lot": 5083416,
          "whale_net_lot": 1693,
          "retail_net_lot": -242888
        },
        {
          "day": 43,
          "date": "2026-01-06",
          "date_display": "06/01/2026",
          "date_end": "2026-01-06",
          "whale_buy": 5.7,
          "retail_buy": 4.28,
          "whale_sell": 6.46,
          "retail_sell": 5.15,
          "whale_buyavg": 1164.73,
          "whale_sellavg": 1165.17,
          "retail_buyavg": 1164.62,
          "retail_sellavg": 1164.65,
          "whale_cum_buy": 437.06,
          "retail_cum_buy": 576.46,
          "whale_cum_sell": 434.19,
          "retail_cum_sell": 603.8,
          "whale_net": -0.77,
          "retail_net": -0.87,
          "whale_cum_net": 2.87,
          "retail_cum_net": -27.34,
          "whale_cum_buy_lot": 3716963,
          "whale_cum_sell_lot": 3721775,
          "retail_cum_buy_lot": 4877039,
          "retail_cum_sell_lot": 5127570,
          "whale_net_lot": -4812,
          "retail_net_lot": -250531
        },
        {
          "day": 44,
          "date": "2026-01-07",
          "date_display": "07/01/2026",
          "date_end": "2026-01-07",
          "whale_buy": 8.42,
          "retail_buy": 10.45,
          "whale_sell": 12.16,
          "retail_sell": 10.45,
          "whale_buyavg": 1174.26,
          "whale_sellavg": 1175.43,
          "retail_buyavg": 1180.1,
          "retail_sellavg": 1179.37,
          "whale_cum_buy": 445.48,
          "retail_cum_buy": 586.91,
          "whale_cum_sell": 446.35,
          "retail_cum_sell": 614.25,
          "whale_net": -3.74,
          "retail_net": -0.0,
          "whale_cum_net": -0.87,
          "retail_cum_net": -27.34,
          "whale_cum_buy_lot": 3788169,
          "whale_cum_sell_lot": 3825059,
          "retail_cum_buy_lot": 4965223,
          "retail_cum_sell_lot": 5215855,
          "whale_net_lot": -36890,
          "retail_net_lot": -250632
        },
        {
          "day": 45,
          "date": "2026-01-08",
          "date_display": "08/01/2026",
          "date_end": "2026-01-08",
          "whale_buy": 8.69,
          "retail_buy": 8.58,
          "whale_sell": 11.53,
          "retail_sell": 6.98,
          "whale_buyavg": 1173.34,
          "whale_sellavg": 1170.2,
          "retail_buyavg": 1171.65,
          "retail_sellavg": 1174.33,
          "whale_cum_buy": 454.18,
          "retail_cum_buy": 595.49,
          "whale_cum_sell": 457.88,
          "retail_cum_sell": 621.23,
          "whale_net": -2.83,
          "retail_net": 1.6,
          "whale_cum_net": -3.7,
          "retail_cum_net": -25.74,
          "whale_cum_buy_lot": 3862398,
          "whale_cum_sell_lot": 3923899,
          "retail_cum_buy_lot": 5038475,
          "retail_cum_sell_lot": 5275303,
          "whale_net_lot": -61501,
          "retail_net_lot": -236828
        },
        {
          "day": 46,
          "date": "2026-01-09",
          "date_display": "09/01/2026",
          "date_end": "2026-01-09",
          "whale_buy": 3.12,
          "retail_buy": 10.89,
          "whale_sell": 3.32,
          "retail_sell": 7.98,
          "whale_buyavg": 1162.5,
          "whale_sellavg": 1164.02,
          "retail_buyavg": 1163.54,
          "retail_sellavg": 1163.08,
          "whale_cum_buy": 457.3,
          "retail_cum_buy": 606.38,
          "whale_cum_sell": 461.2,
          "retail_cum_sell": 629.21,
          "whale_net": -0.2,
          "retail_net": 2.91,
          "whale_cum_net": -3.9,
          "retail_cum_net": -22.83,
          "whale_cum_buy_lot": 3889239,
          "whale_cum_sell_lot": 3952452,
          "retail_cum_buy_lot": 5132101,
          "retail_cum_sell_lot": 5344158,
          "whale_net_lot": -63213,
          "retail_net_lot": -212057
        },
        {
          "day": 47,
          "date": "2026-01-12",
          "date_display": "12/01/2026",
          "date_end": "2026-01-12",
          "whale_buy": 10.57,
          "retail_buy": 4.7,
          "whale_sell": 8.38,
          "retail_sell": 5.34,
          "whale_buyavg": 1163.13,
          "whale_sellavg": 1162.79,
          "retail_buyavg": 1161.56,
          "retail_sellavg": 1162.11,
          "whale_cum_buy": 467.87,
          "retail_cum_buy": 611.08,
          "whale_cum_sell": 469.58,
          "retail_cum_sell": 634.55,
          "whale_net": 2.19,
          "retail_net": -0.64,
          "whale_cum_net": -1.71,
          "retail_cum_net": -23.47,
          "whale_cum_buy_lot": 3980083,
          "whale_cum_sell_lot": 4024535,
          "retail_cum_buy_lot": 5172572,
          "retail_cum_sell_lot": 5390112,
          "whale_net_lot": -44452,
          "retail_net_lot": -217540
        },
        {
          "day": 48,
          "date": "2026-01-13",
          "date_display": "13/01/2026",
          "date_end": "2026-01-13",
          "whale_buy": 8.1,
          "retail_buy": 5.72,
          "whale_sell": 7.21,
          "retail_sell": 8.11,
          "whale_buyavg": 1170.41,
          "whale_sellavg": 1170.19,
          "retail_buyavg": 1169.21,
          "retail_sellavg": 1170.45,
          "whale_cum_buy": 475.97,
          "retail_cum_buy": 616.8,
          "whale_cum_sell": 476.78,
          "retail_cum_sell": 642.66,
          "whale_net": 0.9,
          "retail_net": -2.39,
          "whale_cum_net": -0.81,
          "retail_cum_net": -25.86,
          "whale_cum_buy_lot": 4048800,
          "whale_cum_sell_lot": 4085617,
          "retail_cum_buy_lot": 5221383,
          "retail_cum_sell_lot": 5459306,
          "whale_net_lot": -36817,
          "retail_net_lot": -237923
        },
        {
          "day": 49,
          "date": "2026-01-14",
          "date_display": "14/01/2026",
          "date_end": "2026-01-14",
          "whale_buy": 31.72,
          "retail_buy": 62.44,
          "whale_sell": 37.18,
          "retail_sell": 55.5,
          "whale_buyavg": 1197.86,
          "whale_sellavg": 1198.71,
          "retail_buyavg": 1198.84,
          "retail_sellavg": 1198.15,
          "whale_cum_buy": 507.69,
          "retail_cum_buy": 679.24,
          "whale_cum_sell": 513.96,
          "retail_cum_sell": 698.16,
          "whale_net": -5.46,
          "retail_net": 6.94,
          "whale_cum_net": -6.27,
          "retail_cum_net": -18.92,
          "whale_cum_buy_lot": 4311341,
          "whale_cum_sell_lot": 4414096,
          "retail_cum_buy_lot": 5740968,
          "retail_cum_sell_lot": 5921289,
          "whale_net_lot": -102755,
          "retail_net_lot": -180321
        },
        {
          "day": 50,
          "date": "2026-01-15",
          "date_display": "15/01/2026",
          "date_end": "2026-01-15",
          "whale_buy": 23.78,
          "retail_buy": 47.51,
          "whale_sell": 24.28,
          "retail_sell": 48.85,
          "whale_buyavg": 1219.79,
          "whale_sellavg": 1222.34,
          "retail_buyavg": 1224.49,
          "retail_sellavg": 1223.38,
          "whale_cum_buy": 531.47,
          "retail_cum_buy": 726.75,
          "whale_cum_sell": 538.24,
          "retail_cum_sell": 747.01,
          "whale_net": -0.49,
          "retail_net": -1.34,
          "whale_cum_net": -6.76,
          "retail_cum_net": -20.25,
          "whale_cum_buy_lot": 4505149,
          "whale_cum_sell_lot": 4611837,
          "retail_cum_buy_lot": 6127014,
          "retail_cum_sell_lot": 6324450,
          "whale_net_lot": -106688,
          "retail_net_lot": -197436
        },
        {
          "day": 51,
          "date": "2026-01-19",
          "date_display": "19/01/2026",
          "date_end": "2026-01-19",
          "whale_buy": 12.28,
          "retail_buy": 36.88,
          "whale_sell": 14.06,
          "retail_sell": 34.35,
          "whale_buyavg": 1220.48,
          "whale_sellavg": 1222.01,
          "retail_buyavg": 1222.28,
          "retail_sellavg": 1221.63,
          "whale_cum_buy": 543.76,
          "retail_cum_buy": 763.64,
          "whale_cum_sell": 552.3,
          "retail_cum_sell": 781.35,
          "whale_net": -1.78,
          "retail_net": 2.53,
          "whale_cum_net": -8.54,
          "retail_cum_net": -17.72,
          "whale_cum_buy_lot": 4605843,
          "whale_cum_sell_lot": 4727194,
          "retail_cum_buy_lot": 6428721,
          "retail_cum_sell_lot": 6605657,
          "whale_net_lot": -121351,
          "retail_net_lot": -176936
        },
        {
          "day": 52,
          "date": "2026-01-20",
          "date_display": "20/01/2026",
          "date_end": "2026-01-20",
          "whale_buy": 7.64,
          "retail_buy": 22.82,
          "whale_sell": 9.52,
          "retail_sell": 21.91,
          "whale_buyavg": 1225.65,
          "whale_sellavg": 1225.46,
          "retail_buyavg": 1224.38,
          "retail_sellavg": 1225.09,
          "whale_cum_buy": 551.39,
          "retail_cum_buy": 786.45,
          "whale_cum_sell": 561.81,
          "retail_cum_sell": 803.27,
          "whale_net": -1.88,
          "retail_net": 0.9,
          "whale_cum_net": -10.42,
          "retail_cum_net": -16.82,
          "whale_cum_buy_lot": 4667834,
          "whale_cum_sell_lot": 4804681,
          "retail_cum_buy_lot": 6615081,
          "retail_cum_sell_lot": 6784495,
          "whale_net_lot": -136847,
          "retail_net_lot": -169414
        },
        {
          "day": 53,
          "date": "2026-01-21",
          "date_display": "21/01/2026",
          "date_end": "2026-01-21",
          "whale_buy": 11.33,
          "retail_buy": 21.36,
          "whale_sell": 16.59,
          "retail_sell": 20.08,
          "whale_buyavg": 1210.93,
          "whale_sellavg": 1211.7,
          "retail_buyavg": 1209.98,
          "retail_sellavg": 1209.72,
          "whale_cum_buy": 562.72,
          "retail_cum_buy": 807.81,
          "whale_cum_sell": 578.4,
          "retail_cum_sell": 823.35,
          "whale_net": -5.26,
          "retail_net": 1.28,
          "whale_cum_net": -15.68,
          "retail_cum_net": -15.54,
          "whale_cum_buy_lot": 4762232,
          "whale_cum_sell_lot": 4941828,
          "retail_cum_buy_lot": 6791969,
          "retail_cum_sell_lot": 6951120,
          "whale_net_lot": -179596,
          "retail_net_lot": -159151
        },
        {
          "day": 54,
          "date": "2026-01-22",
          "date_display": "22/01/2026",
          "date_end": "2026-01-22",
          "whale_buy": 13.59,
          "retail_buy": 15.77,
          "whale_sell": 8.93,
          "retail_sell": 17.18,
          "whale_buyavg": 1224.26,
          "whale_sellavg": 1224.65,
          "retail_buyavg": 1225.23,
          "retail_sellavg": 1225.58,
          "whale_cum_buy": 576.31,
          "retail_cum_buy": 823.58,
          "whale_cum_sell": 587.33,
          "retail_cum_sell": 840.53,
          "whale_net": 4.66,
          "retail_net": -1.4,
          "whale_cum_net": -11.02,
          "retail_cum_net": -16.94,
          "whale_cum_buy_lot": 4872543,
          "whale_cum_sell_lot": 5013719,
          "retail_cum_buy_lot": 6919754,
          "retail_cum_sell_lot": 7090656,
          "whale_net_lot": -141176,
          "retail_net_lot": -170902
        },
        {
          "day": 55,
          "date": "2026-01-23",
          "date_display": "23/01/2026",
          "date_end": "2026-01-23",
          "whale_buy": 17.9,
          "retail_buy": 17.36,
          "whale_sell": 20.4,
          "retail_sell": 15.19,
          "whale_buyavg": 1218.37,
          "whale_sellavg": 1221.76,
          "retail_buyavg": 1226.32,
          "retail_sellavg": 1222.59,
          "whale_cum_buy": 594.21,
          "retail_cum_buy": 840.94,
          "whale_cum_sell": 607.72,
          "retail_cum_sell": 855.71,
          "whale_net": -2.5,
          "retail_net": 2.17,
          "whale_cum_net": -13.51,
          "retail_cum_net": -14.77,
          "whale_cum_buy_lot": 5019507,
          "whale_cum_sell_lot": 5180691,
          "retail_cum_buy_lot": 7061406,
          "retail_cum_sell_lot": 7215048,
          "whale_net_lot": -161184,
          "retail_net_lot": -153642
        },
        {
          "day": 56,
          "date": "2026-01-26",
          "date_display": "26/01/2026",
          "date_end": "2026-01-26",
          "whale_buy": 15.7,
          "retail_buy": 12.58,
          "whale_sell": 10.61,
          "retail_sell": 14.49,
          "whale_buyavg": 1219.79,
          "whale_sellavg": 1218.11,
          "retail_buyavg": 1224.17,
          "retail_sellavg": 1225.66,
          "whale_cum_buy": 609.91,
          "retail_cum_buy": 853.52,
          "whale_cum_sell": 618.33,
          "retail_cum_sell": 870.2,
          "whale_net": 5.09,
          "retail_net": -1.91,
          "whale_cum_net": -8.42,
          "retail_cum_net": -16.68,
          "whale_cum_buy_lot": 5148138,
          "whale_cum_sell_lot": 5268063,
          "retail_cum_buy_lot": 7164088,
          "retail_cum_sell_lot": 7333117,
          "whale_net_lot": -119925,
          "retail_net_lot": -169029
        },
        {
          "day": 57,
          "date": "2026-01-27",
          "date_display": "27/01/2026",
          "date_end": "2026-01-27",
          "whale_buy": 19.23,
          "retail_buy": 46.42,
          "whale_sell": 16.5,
          "retail_sell": 49.55,
          "whale_buyavg": 1246.14,
          "whale_sellavg": 1245.52,
          "retail_buyavg": 1245.12,
          "retail_sellavg": 1245.45,
          "whale_cum_buy": 629.14,
          "retail_cum_buy": 899.94,
          "whale_cum_sell": 634.83,
          "retail_cum_sell": 919.75,
          "whale_net": 2.73,
          "retail_net": -3.12,
          "whale_cum_net": -5.69,
          "retail_cum_net": -19.81,
          "whale_cum_buy_lot": 5301643,
          "whale_cum_sell_lot": 5399809,
          "retail_cum_buy_lot": 7535974,
          "retail_cum_sell_lot": 7730193,
          "whale_net_lot": -98166,
          "retail_net_lot": -194219
        },
        {
          "day": 58,
          "date": "2026-01-28",
          "date_display": "28/01/2026",
          "date_end": "2026-01-28",
          "whale_buy": 31.89,
          "retail_buy": 41.09,
          "whale_sell": 32.0,
          "retail_sell": 42.99,
          "whale_buyavg": 1201.61,
          "whale_sellavg": 1205.82,
          "retail_buyavg": 1205.38,
          "retail_sellavg": 1203.3,
          "whale_cum_buy": 661.04,
          "retail_cum_buy": 941.03,
          "whale_cum_sell": 666.83,
          "retail_cum_sell": 962.74,
          "whale_net": -0.1,
          "retail_net": -1.9,
          "whale_cum_net": -5.79,
          "retail_cum_net": -21.71,
          "whale_cum_buy_lot": 5569297,
          "whale_cum_sell_lot": 5666855,
          "retail_cum_buy_lot": 7880641,
          "retail_cum_sell_lot": 8091731,
          "whale_net_lot": -97558,
          "retail_net_lot": -211090
        },
        {
          "day": 59,
          "date": "2026-01-29",
          "date_display": "29/01/2026",
          "date_end": "2026-01-29",
          "whale_buy": 29.96,
          "retail_buy": 31.95,
          "whale_sell": 20.26,
          "retail_sell": 28.92,
          "whale_buyavg": 1153.95,
          "whale_sellavg": 1153.2,
          "retail_buyavg": 1153.86,
          "retail_sellavg": 1152.63,
          "whale_cum_buy": 691.0,
          "retail_cum_buy": 972.98,
          "whale_cum_sell": 687.09,
          "retail_cum_sell": 991.66,
          "whale_net": 9.71,
          "retail_net": 3.03,
          "whale_cum_net": 3.91,
          "retail_cum_net": -18.68,
          "whale_cum_buy_lot": 5686889,
          "whale_cum_sell_lot": 5852387,
          "retail_cum_buy_lot": 8152218,
          "retail_cum_sell_lot": 8340033,
          "whale_net_lot": -165498,
          "retail_net_lot": -187815
        },
        {
          "day": 60,
          "date": "2026-01-30",
          "date_display": "30/01/2026",
          "date_end": "2026-01-30",
          "whale_buy": 25.23,
          "retail_buy": 35.89,
          "whale_sell": 29.03,
          "retail_sell": 43.08,
          "whale_buyavg": 1218.62,
          "whale_sellavg": 1223.54,
          "retail_buyavg": 1218.97,
          "retail_sellavg": 1216.88,
          "whale_cum_buy": 716.23,
          "retail_cum_buy": 1008.87,
          "whale_cum_sell": 716.12,
          "retail_cum_sell": 1034.74,
          "whale_net": -3.8,
          "retail_net": -7.19,
          "whale_cum_net": 0.11,
          "retail_cum_net": -25.88,
          "whale_cum_buy_lot": 5887896,
          "whale_cum_sell_lot": 6087502,
          "retail_cum_buy_lot": 8441600,
          "retail_cum_sell_lot": 8687383,
          "whale_net_lot": -199606,
          "retail_net_lot": -245783
        },
        {
          "day": 61,
          "date": "2026-02-02",
          "date_display": "02/02/2026",
          "date_end": "2026-02-02",
          "whale_buy": 18.13,
          "retail_buy": 31.05,
          "whale_sell": 12.97,
          "retail_sell": 33.34,
          "whale_buyavg": 1216.07,
          "whale_sellavg": 1220.41,
          "retail_buyavg": 1221.36,
          "retail_sellavg": 1220.13,
          "whale_cum_buy": 734.36,
          "retail_cum_buy": 1039.91,
          "whale_cum_sell": 729.08,
          "retail_cum_sell": 1068.08,
          "whale_net": 5.17,
          "retail_net": -2.29,
          "whale_cum_net": 5.28,
          "retail_cum_net": -28.17,
          "whale_cum_buy_lot": 6036988,
          "whale_cum_sell_lot": 6193862,
          "retail_cum_buy_lot": 8695822,
          "retail_cum_sell_lot": 8960314,
          "whale_net_lot": -156874,
          "retail_net_lot": -264492
        },
        {
          "day": 62,
          "date": "2026-02-03",
          "date_display": "03/02/2026",
          "date_end": "2026-02-03",
          "whale_buy": 12.99,
          "retail_buy": 22.88,
          "whale_sell": 13.12,
          "retail_sell": 23.29,
          "whale_buyavg": 1216.09,
          "whale_sellavg": 1222.32,
          "retail_buyavg": 1220.14,
          "retail_sellavg": 1216.38,
          "whale_cum_buy": 747.35,
          "retail_cum_buy": 1062.79,
          "whale_cum_sell": 742.21,
          "retail_cum_sell": 1091.38,
          "whale_net": -0.14,
          "retail_net": -0.41,
          "whale_cum_net": 5.14,
          "retail_cum_net": -28.58,
          "whale_cum_buy_lot": 6143659,
          "whale_cum_sell_lot": 6297095,
          "retail_cum_buy_lot": 8883440,
          "retail_cum_sell_lot": 9151733,
          "whale_net_lot": -153436,
          "retail_net_lot": -268293
        },
        {
          "day": 63,
          "date": "2026-02-04",
          "date_display": "04/02/2026",
          "date_end": "2026-02-04",
          "whale_buy": 107.86,
          "retail_buy": 96.04,
          "whale_sell": 105.21,
          "retail_sell": 106.95,
          "whale_buyavg": 1294.13,
          "whale_sellavg": 1291.12,
          "retail_buyavg": 1291.8,
          "retail_sellavg": 1295.72,
          "whale_cum_buy": 855.2,
          "retail_cum_buy": 1158.84,
          "whale_cum_sell": 847.41,
          "retail_cum_sell": 1198.33,
          "whale_net": 2.65,
          "retail_net": -10.91,
          "whale_cum_net": 7.79,
          "retail_cum_net": -39.49,
          "whale_cum_buy_lot": 6972853,
          "whale_cum_sell_lot": 7108062,
          "retail_cum_buy_lot": 9616312,
          "retail_cum_sell_lot": 9970964,
          "whale_net_lot": -135209,
          "retail_net_lot": -354652
        },
        {
          "day": 64,
          "date": "2026-02-05",
          "date_display": "05/02/2026",
          "date_end": "2026-02-05",
          "whale_buy": 44.38,
          "retail_buy": 55.06,
          "whale_sell": 38.25,
          "retail_sell": 51.54,
          "whale_buyavg": 1325.49,
          "whale_sellavg": 1325.8,
          "retail_buyavg": 1324.34,
          "retail_sellavg": 1323.86,
          "whale_cum_buy": 899.58,
          "retail_cum_buy": 1213.89,
          "whale_cum_sell": 885.66,
          "retail_cum_sell": 1249.87,
          "whale_net": 6.14,
          "retail_net": 3.51,
          "whale_cum_net": 13.92,
          "retail_cum_net": -35.98,
          "whale_cum_buy_lot": 7307115,
          "whale_cum_sell_lot": 7395704,
          "retail_cum_buy_lot": 10029757,
          "retail_cum_sell_lot": 10356412,
          "whale_net_lot": -88589,
          "retail_net_lot": -326655
        },
        {
          "day": 65,
          "date": "2026-02-06",
          "date_display": "06/02/2026",
          "date_end": "2026-02-06",
          "whale_buy": 28.09,
          "retail_buy": 38.65,
          "whale_sell": 31.34,
          "retail_sell": 40.53,
          "whale_buyavg": 1288.0,
          "whale_sellavg": 1289.51,
          "retail_buyavg": 1287.63,
          "retail_sellavg": 1286.55,
          "whale_cum_buy": 927.67,
          "retail_cum_buy": 1252.55,
          "whale_cum_sell": 917.0,
          "retail_cum_sell": 1290.4,
          "whale_net": -3.25,
          "retail_net": -1.88,
          "whale_cum_net": 10.67,
          "retail_cum_net": -37.86,
          "whale_cum_buy_lot": 7528392,
          "whale_cum_sell_lot": 7572137,
          "retail_cum_buy_lot": 10330810,
          "retail_cum_sell_lot": 10672572,
          "whale_net_lot": -43745,
          "retail_net_lot": -341762
        },
        {
          "day": 66,
          "date": "2026-02-09",
          "date_display": "09/02/2026",
          "date_end": "2026-02-09",
          "whale_buy": 17.91,
          "retail_buy": 35.52,
          "whale_sell": 13.97,
          "retail_sell": 43.29,
          "whale_buyavg": 1255.96,
          "whale_sellavg": 1256.58,
          "retail_buyavg": 1259.7,
          "retail_sellavg": 1258.33,
          "whale_cum_buy": 945.59,
          "retail_cum_buy": 1288.07,
          "whale_cum_sell": 930.97,
          "retail_cum_sell": 1333.7,
          "whale_net": 3.95,
          "retail_net": -7.77,
          "whale_cum_net": 14.61,
          "retail_cum_net": -45.63,
          "whale_cum_buy_lot": 7671712,
          "whale_cum_sell_lot": 7683766,
          "retail_cum_buy_lot": 10613198,
          "retail_cum_sell_lot": 11018761,
          "whale_net_lot": -12054,
          "retail_net_lot": -405563
        },
        {
          "day": 67,
          "date": "2026-02-10",
          "date_display": "10/02/2026",
          "date_end": "2026-02-10",
          "whale_buy": 31.59,
          "retail_buy": 26.83,
          "whale_sell": 21.57,
          "retail_sell": 32.89,
          "whale_buyavg": 1289.11,
          "whale_sellavg": 1287.15,
          "retail_buyavg": 1284.9,
          "retail_sellavg": 1286.7,
          "whale_cum_buy": 977.17,
          "retail_cum_buy": 1314.89,
          "whale_cum_sell": 952.54,
          "retail_cum_sell": 1366.59,
          "whale_net": 10.01,
          "retail_net": -6.07,
          "whale_cum_net": 24.63,
          "retail_cum_net": -51.7,
          "whale_cum_buy_lot": 7915052,
          "whale_cum_sell_lot": 7848800,
          "retail_cum_buy_lot": 10820744,
          "retail_cum_sell_lot": 11272866,
          "whale_net_lot": 66252,
          "retail_net_lot": -452122
        },
        {
          "day": 68,
          "date": "2026-02-11",
          "date_display": "11/02/2026",
          "date_end": "2026-02-11",
          "whale_buy": 43.94,
          "retail_buy": 32.69,
          "whale_sell": 27.22,
          "retail_sell": 36.05,
          "whale_buyavg": 1329.1,
          "whale_sellavg": 1327.89,
          "retail_buyavg": 1325.78,
          "retail_sellavg": 1326.97,
          "whale_cum_buy": 1021.11,
          "retail_cum_buy": 1347.58,
          "whale_cum_sell": 979.77,
          "retail_cum_sell": 1402.64,
          "whale_net": 16.71,
          "retail_net": -3.37,
          "whale_cum_net": 41.34,
          "retail_cum_net": -55.06,
          "whale_cum_buy_lot": 8238366,
          "whale_cum_sell_lot": 8047886,
          "retail_cum_buy_lot": 11101287,
          "retail_cum_sell_lot": 11595294,
          "whale_net_lot": 190480,
          "retail_net_lot": -494007
        },
        {
          "day": 69,
          "date": "2026-02-12",
          "date_display": "12/02/2026",
          "date_end": "2026-02-12",
          "whale_buy": 29.05,
          "retail_buy": 36.76,
          "whale_sell": 26.35,
          "retail_sell": 49.93,
          "whale_buyavg": 1361.54,
          "whale_sellavg": 1361.16,
          "retail_buyavg": 1362.33,
          "retail_sellavg": 1363.47,
          "whale_cum_buy": 1050.16,
          "retail_cum_buy": 1384.34,
          "whale_cum_sell": 1006.12,
          "retail_cum_sell": 1452.57,
          "whale_net": 2.7,
          "retail_net": -13.18,
          "whale_cum_net": 44.04,
          "retail_cum_net": -68.24,
          "whale_cum_buy_lot": 8447684,
          "whale_cum_sell_lot": 8238798,
          "retail_cum_buy_lot": 11367309,
          "retail_cum_sell_lot": 11958910,
          "whale_net_lot": 208886,
          "retail_net_lot": -591601
        },
        {
          "day": 70,
          "date": "2026-02-13",
          "date_display": "13/02/2026",
          "date_end": "2026-02-13",
          "whale_buy": 33.72,
          "retail_buy": 33.26,
          "whale_sell": 29.47,
          "retail_sell": 29.28,
          "whale_buyavg": 1371.76,
          "whale_sellavg": 1371.84,
          "retail_buyavg": 1370.72,
          "retail_sellavg": 1369.68,
          "whale_cum_buy": 1083.88,
          "retail_cum_buy": 1417.6,
          "whale_cum_sell": 1035.59,
          "retail_cum_sell": 1481.85,
          "whale_net": 4.25,
          "retail_net": 3.99,
          "whale_cum_net": 48.29,
          "retail_cum_net": -64.25,
          "whale_cum_buy_lot": 8693437,
          "whale_cum_sell_lot": 8453529,
          "retail_cum_buy_lot": 11609877,
          "retail_cum_sell_lot": 12172147,
          "whale_net_lot": 239908,
          "retail_net_lot": -562270
        },
        {
          "day": 71,
          "date": "2026-02-18",
          "date_display": "18/02/2026",
          "date_end": "2026-02-18",
          "whale_buy": 31.44,
          "retail_buy": 20.27,
          "whale_sell": 27.3,
          "retail_sell": 20.9,
          "whale_buyavg": 1388.18,
          "whale_sellavg": 1388.05,
          "retail_buyavg": 1388.12,
          "retail_sellavg": 1387.18,
          "whale_cum_buy": 1115.32,
          "retail_cum_buy": 1437.87,
          "whale_cum_sell": 1062.89,
          "retail_cum_sell": 1502.75,
          "whale_net": 4.14,
          "retail_net": -0.62,
          "whale_cum_net": 52.43,
          "retail_cum_net": -64.88,
          "whale_cum_buy_lot": 8919925,
          "whale_cum_sell_lot": 8649838,
          "retail_cum_buy_lot": 11755701,
          "retail_cum_sell_lot": 12322275,
          "whale_net_lot": 270087,
          "retail_net_lot": -566574
        }
      ],
      "volatilityTrend": {
        "volatilityFactor": 0.1896,
        "trendDirection": "UPTREND",
        "trendStrength": 6.99,
        "minWhaleBuy": 1153.95,
        "maxWhaleBuy": 1388.18,
        "avgWhaleBuy": 1235.35,
        "avgWhaleSell": 1236.01,
        "lastWhaleBuyPrice": 1388.18
      },
      "recommendation": {
        "score": 3.5,
        "signals": [
          "Status whale: Normal",
          "Whale sedang akumulasi kuat",
          "Retail panic selling (kontrarian bullish)",
          "Tren harga naik (5 hari terakhir)"
        ],
        "whaleSignal": "bullish",
        "retailSignal": "bullish",
        "retailBullishReason": "kontrarian",
        "retailBearishReason": "",
        "priceTrend": "up",
        "strength": "strong",
        "recommendation": "BUY",
        "isWhaleTrapped": false,
        "whaleTrapLevel": "none",
        "isDistributingToRetail": false,
        "lastPrice": 1388.18,
        "avgWhaleBuy": 1263.83,
        "avgRetailBuy": 1254.51
      },
      "priceRecommendation": {
        "buyZone": 1260.0,
        "targetPrice": 1240.0,
        "sellZone": 1460.0,
        "stopLoss": 1222.0,
        "rrRatio": -0.53,
        "displayRR": -0.5,
        "potentialProfit": -1.6,
        "potentialLoss": 3.0,
        "discountPercent": 0.06,
        "isWhaleTrapped": false,
        "isDistributingToRetail": false,
        "whaleTrapLevel": "none",
        "lastPrice": 1388.0,
        "avgWhaleBuy": 1235.0,
        "avgRetailBuy": 1255.0,
        "buyTick": 5,
        "targetTick": 5,
        "sellTick": 5,
        "stopTick": 5,
        "lowestRecentBuy": 1285.0,
        "strongResistance": 1335.0,
        "minWhaleBuyTick": 1150.0,
        "maxWhaleBuyTick": 1390.0
      },
      "confidence": {
        "confidenceScore": 25,
        "confidenceLevel": "RENDAH",
        "confidenceFactors": [
          "Akumulasi Whale kuat",
          "Trend naik, align dengan BUY",
          "R:RR kurang ideal (-0.5:1)",
          "Volatilitas tinggi (risky)"
        ]
      },
      "insights": {
        "whaleInsight": "Whale melakukan <span class=\"highlight\">AKUMULASI</span> sebesar <span class=\"highlight\">Rp 47.1 Miliar</span> dalam 30 hari transaksi. Institusi sedang membeli saham ini.",
        "retailInsight": "Retail melakukan <span class=\"highlight\">DISTRIBUSI</span> sebesar <span class=\"highlight\">Rp 35.8 Miliar</span> dalam 30 hari transaksi. Investor retail sedang profit taking.",
        "whalePeak": 52.43,
        "whalePeakDay": 71,
        "retailPeak": -14.77,
        "retailPeakDay": 55
      }
    },
    "BRIS": {
      "code": "BRIS",
      "date_start": "2026-01-02",
      "date_end": "2026-02-18",
      "summary": {
        "whale_buy": 955.6000000000001,
        "retail_buy": 1092.6100000000004,
        "whale_sell": 975.84,
        "retail_sell": 1038.75,
        "whale_net": -20.239999999999895,
        "retail_net": 53.860000000000355,
        "total_buy": 2048.2100000000005,
        "total_sell": 2014.5900000000001,
        "whale_cum_buy_lot": 0,
        "whale_cum_sell_lot": 0,
        "retail_cum_buy_lot": 0,
        "retail_cum_sell_lot": 0,
        "whale_net_lot": 0,
        "retail_net_lot": 0,
        "whale_buyavg": 2262.59,
        "whale_sellavg": 2262.7,
        "retail_buyavg": 2272.63,
        "retail_sellavg": 2276.0
      },
      "brokers": [],
      "daily": [
        {
          "day": 35,
          "date": "2026-01-02",
          "date_display": "02/01/2026",
          "date_end": "2026-01-02",
          "whale_buy": 19.02,
          "retail_buy": 24.18,
          "whale_sell": 20.99,
          "retail_sell": 19.13,
          "whale_buyavg": 2177.8,
          "whale_sellavg": 2180.63,
          "retail_buyavg": 2179.96,
          "retail_sellavg": 2176.55,
          "whale_cum_buy": 459.78,
          "retail_cum_buy": 533.14,
          "whale_cum_sell": 548.87,
          "retail_cum_sell": 511.69,
          "whale_net": -1.97,
          "retail_net": 5.05,
          "whale_cum_net": -89.09,
          "retail_cum_net": 21.45,
          "whale_cum_buy_lot": 1943086,
          "whale_cum_sell_lot": 2332237,
          "retail_cum_buy_lot": 2242516,
          "retail_cum_sell_lot": 2147483,
          "whale_net_lot": -389151,
          "retail_net_lot": 95033
        },
        {
          "day": 36,
          "date": "2026-01-05",
          "date_display": "05/01/2026",
          "date_end": "2026-01-05",
          "whale_buy": 20.15,
          "retail_buy": 21.36,
          "whale_sell": 18.43,
          "retail_sell": 21.07,
          "whale_buyavg": 2163.6,
          "whale_sellavg": 2160.24,
          "retail_buyavg": 2157.68,
          "retail_sellavg": 2163.0,
          "whale_cum_buy": 479.94,
          "retail_cum_buy": 554.5,
          "whale_cum_sell": 567.3,
          "retail_cum_sell": 532.77,
          "whale_net": 1.73,
          "retail_net": 0.29,
          "whale_cum_net": -87.36,
          "retail_cum_net": 21.73,
          "whale_cum_buy_lot": 2036511,
          "whale_cum_sell_lot": 2417967,
          "retail_cum_buy_lot": 2341617,
          "retail_cum_sell_lot": 2244997,
          "whale_net_lot": -381456,
          "retail_net_lot": 96620
        },
        {
          "day": 37,
          "date": "2026-01-06",
          "date_display": "06/01/2026",
          "date_end": "2026-01-06",
          "whale_buy": 27.24,
          "retail_buy": 35.94,
          "whale_sell": 68.01,
          "retail_sell": 20.48,
          "whale_buyavg": 2153.42,
          "whale_sellavg": 2150.46,
          "retail_buyavg": 2156.89,
          "retail_sellavg": 2163.72,
          "whale_cum_buy": 507.18,
          "retail_cum_buy": 590.44,
          "whale_cum_sell": 635.3,
          "retail_cum_sell": 553.24,
          "whale_net": -40.77,
          "retail_net": 15.46,
          "whale_cum_net": -128.13,
          "retail_cum_net": 37.19,
          "whale_cum_buy_lot": 2163583,
          "whale_cum_sell_lot": 2734331,
          "retail_cum_buy_lot": 2508135,
          "retail_cum_sell_lot": 2339321,
          "whale_net_lot": -570748,
          "retail_net_lot": 168814
        },
        {
          "day": 38,
          "date": "2026-01-07",
          "date_display": "07/01/2026",
          "date_end": "2026-01-07",
          "whale_buy": 17.56,
          "retail_buy": 26.66,
          "whale_sell": 18.01,
          "retail_sell": 14.07,
          "whale_buyavg": 2169.74,
          "whale_sellavg": 2169.56,
          "retail_buyavg": 2167.47,
          "retail_sellavg": 2166.59,
          "whale_cum_buy": 524.74,
          "retail_cum_buy": 617.09,
          "whale_cum_sell": 653.31,
          "retail_cum_sell": 567.31,
          "whale_net": -0.44,
          "retail_net": 12.59,
          "whale_cum_net": -128.57,
          "retail_cum_net": 49.78,
          "whale_cum_buy_lot": 2244526,
          "whale_cum_sell_lot": 2817262,
          "retail_cum_buy_lot": 2631116,
          "retail_cum_sell_lot": 2403963,
          "whale_net_lot": -572736,
          "retail_net_lot": 227153
        },
        {
          "day": 39,
          "date": "2026-01-08",
          "date_display": "08/01/2026",
          "date_end": "2026-01-08",
          "whale_buy": 19.07,
          "retail_buy": 29.5,
          "whale_sell": 16.12,
          "retail_sell": 35.78,
          "whale_buyavg": 2159.56,
          "whale_sellavg": 2151.19,
          "retail_buyavg": 2152.59,
          "retail_sellavg": 2156.86,
          "whale_cum_buy": 543.81,
          "retail_cum_buy": 646.59,
          "whale_cum_sell": 669.42,
          "retail_cum_sell": 603.09,
          "whale_net": 2.95,
          "retail_net": -6.28,
          "whale_cum_net": -125.61,
          "retail_cum_net": 43.5,
          "whale_cum_buy_lot": 2333033,
          "whale_cum_sell_lot": 2892303,
          "retail_cum_buy_lot": 2768373,
          "retail_cum_sell_lot": 2570050,
          "whale_net_lot": -559270,
          "retail_net_lot": 198323
        },
        {
          "day": 40,
          "date": "2026-01-09",
          "date_display": "09/01/2026",
          "date_end": "2026-01-09",
          "whale_buy": 20.06,
          "retail_buy": 34.2,
          "whale_sell": 21.91,
          "retail_sell": 46.27,
          "whale_buyavg": 2095.2,
          "whale_sellavg": 2091.82,
          "retail_buyavg": 2094.15,
          "retail_sellavg": 2095.47,
          "whale_cum_buy": 563.87,
          "retail_cum_buy": 680.79,
          "whale_cum_sell": 691.34,
          "retail_cum_sell": 649.36,
          "whale_net": -1.85,
          "retail_net": -12.07,
          "whale_cum_net": -127.46,
          "retail_cum_net": 31.43,
          "whale_cum_buy_lot": 2431409,
          "whale_cum_sell_lot": 2999064,
          "retail_cum_buy_lot": 2935709,
          "retail_cum_sell_lot": 2793924,
          "whale_net_lot": -567655,
          "retail_net_lot": 141785
        },
        {
          "day": 41,
          "date": "2026-01-12",
          "date_display": "12/01/2026",
          "date_end": "2026-01-12",
          "whale_buy": 34.4,
          "retail_buy": 21.52,
          "whale_sell": 34.97,
          "retail_sell": 22.83,
          "whale_buyavg": 2133.53,
          "whale_sellavg": 2133.26,
          "retail_buyavg": 2133.07,
          "retail_sellavg": 2133.4,
          "whale_cum_buy": 598.27,
          "retail_cum_buy": 702.31,
          "whale_cum_sell": 726.3,
          "retail_cum_sell": 672.19,
          "whale_net": -0.57,
          "retail_net": -1.31,
          "whale_cum_net": -128.03,
          "retail_cum_net": 30.12,
          "whale_cum_buy_lot": 2592426,
          "whale_cum_sell_lot": 3162859,
          "retail_cum_buy_lot": 3036434,
          "retail_cum_sell_lot": 2900781,
          "whale_net_lot": -570433,
          "retail_net_lot": 135653
        },
        {
          "day": 42,
          "date": "2026-01-13",
          "date_display": "13/01/2026",
          "date_end": "2026-01-13",
          "whale_buy": 10.39,
          "retail_buy": 13.44,
          "whale_sell": 9.19,
          "retail_sell": 12.03,
          "whale_buyavg": 2126.9,
          "whale_sellavg": 2130.69,
          "retail_buyavg": 2127.3,
          "retail_sellavg": 2125.66,
          "whale_cum_buy": 608.66,
          "retail_cum_buy": 715.75,
          "whale_cum_sell": 735.49,
          "retail_cum_sell": 684.22,
          "whale_net": 1.2,
          "retail_net": 1.41,
          "whale_cum_net": -126.83,
          "retail_cum_net": 31.53,
          "whale_cum_buy_lot": 2641315,
          "whale_cum_sell_lot": 3205978,
          "retail_cum_buy_lot": 3099660,
          "retail_cum_sell_lot": 2957621,
          "whale_net_lot": -564663,
          "retail_net_lot": 142039
        },
        {
          "day": 43,
          "date": "2026-01-14",
          "date_display": "14/01/2026",
          "date_end": "2026-01-14",
          "whale_buy": 81.91,
          "retail_buy": 61.32,
          "whale_sell": 79.39,
          "retail_sell": 57.77,
          "whale_buyavg": 2187.24,
          "whale_sellavg": 2195.65,
          "retail_buyavg": 2210.33,
          "retail_sellavg": 2201.68,
          "whale_cum_buy": 690.57,
          "retail_cum_buy": 777.07,
          "whale_cum_sell": 814.88,
          "retail_cum_sell": 741.99,
          "whale_net": 2.52,
          "retail_net": 3.55,
          "whale_cum_net": -124.32,
          "retail_cum_net": 35.08,
          "whale_cum_buy_lot": 3014521,
          "whale_cum_sell_lot": 3581401,
          "retail_cum_buy_lot": 3375241,
          "retail_cum_sell_lot": 3217632,
          "whale_net_lot": -566880,
          "retail_net_lot": 157609
        },
        {
          "day": 44,
          "date": "2026-01-15",
          "date_display": "15/01/2026",
          "date_end": "2026-01-15",
          "whale_buy": 59.47,
          "retail_buy": 64.04,
          "whale_sell": 66.05,
          "retail_sell": 44.38,
          "whale_buyavg": 2292.36,
          "whale_sellavg": 2294.44,
          "retail_buyavg": 2297.61,
          "retail_sellavg": 2296.9,
          "whale_cum_buy": 750.03,
          "retail_cum_buy": 841.11,
          "whale_cum_sell": 880.93,
          "retail_cum_sell": 786.37,
          "whale_net": -6.58,
          "retail_net": 19.66,
          "whale_cum_net": -130.9,
          "retail_cum_net": 54.74,
          "whale_cum_buy_lot": 3271950,
          "whale_cum_sell_lot": 3866810,
          "retail_cum_buy_lot": 3649026,
          "retail_cum_sell_lot": 3404478,
          "whale_net_lot": -594860,
          "retail_net_lot": 244548
        },
        {
          "day": 45,
          "date": "2026-01-19",
          "date_display": "19/01/2026",
          "date_end": "2026-01-19",
          "whale_buy": 27.19,
          "retail_buy": 30.68,
          "whale_sell": 22.44,
          "retail_sell": 35.18,
          "whale_buyavg": 2281.93,
          "whale_sellavg": 2279.32,
          "retail_buyavg": 2284.53,
          "retail_sellavg": 2285.92,
          "whale_cum_buy": 777.23,
          "retail_cum_buy": 871.79,
          "whale_cum_sell": 903.37,
          "retail_cum_sell": 821.55,
          "whale_net": 4.75,
          "retail_net": -4.5,
          "whale_cum_net": -126.15,
          "retail_cum_net": 50.24,
          "whale_cum_buy_lot": 3391193,
          "whale_cum_sell_lot": 3965315,
          "retail_cum_buy_lot": 3783490,
          "retail_cum_sell_lot": 3558584,
          "whale_net_lot": -574122,
          "retail_net_lot": 224906
        },
        {
          "day": 46,
          "date": "2026-01-20",
          "date_display": "20/01/2026",
          "date_end": "2026-01-20",
          "whale_buy": 50.81,
          "retail_buy": 21.24,
          "whale_sell": 43.76,
          "retail_sell": 18.46,
          "whale_buyavg": 2279.39,
          "whale_sellavg": 2285.69,
          "retail_buyavg": 2245.48,
          "retail_sellavg": 2243.38,
          "whale_cum_buy": 828.03,
          "retail_cum_buy": 893.03,
          "whale_cum_sell": 947.13,
          "retail_cum_sell": 840.0,
          "whale_net": 7.05,
          "retail_net": 2.78,
          "whale_cum_net": -119.1,
          "retail_cum_net": 53.02,
          "whale_cum_buy_lot": 3614087,
          "whale_cum_sell_lot": 4157242,
          "retail_cum_buy_lot": 3878123,
          "retail_cum_sell_lot": 3641013,
          "whale_net_lot": -543155,
          "retail_net_lot": 237110
        },
        {
          "day": 47,
          "date": "2026-01-21",
          "date_display": "21/01/2026",
          "date_end": "2026-01-21",
          "whale_buy": 6.09,
          "retail_buy": 27.63,
          "whale_sell": 5.09,
          "retail_sell": 20.86,
          "whale_buyavg": 2193.24,
          "whale_sellavg": 2196.88,
          "retail_buyavg": 2198.2,
          "retail_sellavg": 2196.66,
          "whale_cum_buy": 834.12,
          "retail_cum_buy": 920.66,
          "whale_cum_sell": 952.22,
          "retail_cum_sell": 860.86,
          "whale_net": 1.0,
          "retail_net": 6.78,
          "whale_cum_net": -118.1,
          "retail_cum_net": 59.8,
          "whale_cum_buy_lot": 3638479,
          "whale_cum_sell_lot": 4181564,
          "retail_cum_buy_lot": 4004143,
          "retail_cum_sell_lot": 3736571,
          "whale_net_lot": -543085,
          "retail_net_lot": 267572
        },
        {
          "day": 48,
          "date": "2026-01-22",
          "date_display": "22/01/2026",
          "date_end": "2026-01-22",
          "whale_buy": 40.85,
          "retail_buy": 18.05,
          "whale_sell": 33.61,
          "retail_sell": 24.71,
          "whale_buyavg": 2234.01,
          "whale_sellavg": 2232.11,
          "retail_buyavg": 2232.79,
          "retail_sellavg": 2234.28,
          "whale_cum_buy": 874.97,
          "retail_cum_buy": 938.71,
          "whale_cum_sell": 985.83,
          "retail_cum_sell": 885.57,
          "whale_net": 7.24,
          "retail_net": -6.66,
          "whale_cum_net": -110.86,
          "retail_cum_net": 53.14,
          "whale_cum_buy_lot": 3820987,
          "whale_cum_sell_lot": 4331658,
          "retail_cum_buy_lot": 4084833,
          "retail_cum_sell_lot": 3847010,
          "whale_net_lot": -510671,
          "retail_net_lot": 237823
        },
        {
          "day": 49,
          "date": "2026-01-23",
          "date_display": "23/01/2026",
          "date_end": "2026-01-23",
          "whale_buy": 15.31,
          "retail_buy": 63.49,
          "whale_sell": 14.91,
          "retail_sell": 47.86,
          "whale_buyavg": 2234.84,
          "whale_sellavg": 2235.9,
          "retail_buyavg": 2236.6,
          "retail_sellavg": 2236.03,
          "whale_cum_buy": 890.28,
          "retail_cum_buy": 1002.2,
          "whale_cum_sell": 1000.74,
          "retail_cum_sell": 933.43,
          "whale_net": 0.4,
          "retail_net": 15.63,
          "whale_cum_net": -110.46,
          "retail_cum_net": 68.77,
          "whale_cum_buy_lot": 3889385,
          "whale_cum_sell_lot": 4398097,
          "retail_cum_buy_lot": 4368654,
          "retail_cum_sell_lot": 4061010,
          "whale_net_lot": -508712,
          "retail_net_lot": 307644
        },
        {
          "day": 50,
          "date": "2026-01-26",
          "date_display": "26/01/2026",
          "date_end": "2026-01-26",
          "whale_buy": 21.61,
          "retail_buy": 56.25,
          "whale_sell": 17.58,
          "retail_sell": 56.26,
          "whale_buyavg": 2233.0,
          "whale_sellavg": 2236.51,
          "retail_buyavg": 2235.41,
          "retail_sellavg": 2232.48,
          "whale_cum_buy": 911.88,
          "retail_cum_buy": 1058.45,
          "whale_cum_sell": 1018.32,
          "retail_cum_sell": 989.69,
          "whale_net": 4.03,
          "retail_net": -0.01,
          "whale_cum_net": -106.43,
          "retail_cum_net": 68.76,
          "whale_cum_buy_lot": 3986246,
          "whale_cum_sell_lot": 4476971,
          "retail_cum_buy_lot": 4620149,
          "retail_cum_sell_lot": 4312835,
          "whale_net_lot": -490725,
          "retail_net_lot": 307314
        },
        {
          "day": 51,
          "date": "2026-01-27",
          "date_display": "27/01/2026",
          "date_end": "2026-01-27",
          "whale_buy": 25.5,
          "retail_buy": 11.28,
          "whale_sell": 17.39,
          "retail_sell": 15.82,
          "whale_buyavg": 2235.56,
          "whale_sellavg": 2236.9,
          "retail_buyavg": 2236.3,
          "retail_sellavg": 2236.35,
          "whale_cum_buy": 937.38,
          "retail_cum_buy": 1069.74,
          "whale_cum_sell": 1035.71,
          "retail_cum_sell": 1005.51,
          "whale_net": 8.11,
          "retail_net": -4.53,
          "whale_cum_net": -98.32,
          "retail_cum_net": 64.23,
          "whale_cum_buy_lot": 4100346,
          "whale_cum_sell_lot": 4554732,
          "retail_cum_buy_lot": 4670552,
          "retail_cum_sell_lot": 4383565,
          "whale_net_lot": -454386,
          "retail_net_lot": 286987
        },
        {
          "day": 52,
          "date": "2026-01-28",
          "date_display": "28/01/2026",
          "date_end": "2026-01-28",
          "whale_buy": 0.0,
          "retail_buy": 0.0,
          "whale_sell": 0.0,
          "retail_sell": 0.0,
          "whale_buyavg": 0,
          "whale_sellavg": 0,
          "retail_buyavg": 0,
          "retail_sellavg": 0,
          "whale_cum_buy": 937.38,
          "retail_cum_buy": 1069.74,
          "whale_cum_sell": 1035.71,
          "retail_cum_sell": 1005.51,
          "whale_net": 0.0,
          "retail_net": 0.0,
          "whale_cum_net": -98.32,
          "retail_cum_net": 64.23,
          "whale_cum_buy_lot": 4100346,
          "whale_cum_sell_lot": 4554732,
          "retail_cum_buy_lot": 4670552,
          "retail_cum_sell_lot": 4383565,
          "whale_net_lot": -454386,
          "retail_net_lot": 286987
        },
        {
          "day": 53,
          "date": "2026-01-29",
          "date_display": "29/01/2026",
          "date_end": "2026-01-29",
          "whale_buy": 61.86,
          "retail_buy": 51.36,
          "whale_sell": 69.02,
          "retail_sell": 37.64,
          "whale_buyavg": 1998.31,
          "whale_sellavg": 2006.91,
          "retail_buyavg": 2023.67,
          "retail_sellavg": 2015.68,
          "whale_cum_buy": 999.24,
          "retail_cum_buy": 1121.1,
          "whale_cum_sell": 1104.72,
          "retail_cum_sell": 1043.14,
          "whale_net": -7.16,
          "retail_net": 13.73,
          "whale_cum_net": -105.48,
          "retail_cum_net": 77.96,
          "whale_cum_buy_lot": 4416177,
          "whale_cum_sell_lot": 4905466,
          "retail_cum_buy_lot": 4927572,
          "retail_cum_sell_lot": 4576478,
          "whale_net_lot": -489289,
          "retail_net_lot": 351094
        },
        {
          "day": 54,
          "date": "2026-01-30",
          "date_display": "30/01/2026",
          "date_end": "2026-01-30",
          "whale_buy": 39.48,
          "retail_buy": 30.33,
          "whale_sell": 24.1,
          "retail_sell": 42.82,
          "whale_buyavg": 2219.41,
          "whale_sellavg": 2205.64,
          "retail_buyavg": 2220.03,
          "retail_sellavg": 2222.77,
          "whale_cum_buy": 1038.72,
          "retail_cum_buy": 1151.43,
          "whale_cum_sell": 1128.83,
          "retail_cum_sell": 1085.96,
          "whale_net": 15.37,
          "retail_net": -12.49,
          "whale_cum_net": -90.11,
          "retail_cum_net": 65.47,
          "whale_cum_buy_lot": 4581013,
          "whale_cum_sell_lot": 5000978,
          "retail_cum_buy_lot": 5084888,
          "retail_cum_sell_lot": 4764431,
          "whale_net_lot": -419965,
          "retail_net_lot": 320457
        },
        {
          "day": 55,
          "date": "2026-02-03",
          "date_display": "03/02/2026",
          "date_end": "2026-02-03",
          "whale_buy": 11.21,
          "retail_buy": 26.72,
          "whale_sell": 14.05,
          "retail_sell": 16.83,
          "whale_buyavg": 2236.81,
          "whale_sellavg": 2241.51,
          "retail_buyavg": 2237.01,
          "retail_sellavg": 2237.55,
          "whale_cum_buy": 1049.93,
          "retail_cum_buy": 1178.14,
          "whale_cum_sell": 1142.88,
          "retail_cum_sell": 1102.78,
          "whale_net": -2.84,
          "retail_net": 9.89,
          "whale_cum_net": -92.95,
          "retail_cum_net": 75.36,
          "whale_cum_buy_lot": 4634040,
          "whale_cum_sell_lot": 5063611,
          "retail_cum_buy_lot": 5203856,
          "retail_cum_sell_lot": 4838862,
          "whale_net_lot": -429571,
          "retail_net_lot": 364994
        },
        {
          "day": 56,
          "date": "2026-02-04",
          "date_display": "04/02/2026",
          "date_end": "2026-02-04",
          "whale_buy": 112.3,
          "retail_buy": 142.6,
          "whale_sell": 97.77,
          "retail_sell": 157.87,
          "whale_buyavg": 2358.65,
          "whale_sellavg": 2365.8,
          "retail_buyavg": 2369.03,
          "retail_sellavg": 2363.52,
          "whale_cum_buy": 1162.23,
          "retail_cum_buy": 1320.74,
          "whale_cum_sell": 1240.64,
          "retail_cum_sell": 1260.65,
          "whale_net": 14.53,
          "retail_net": -15.27,
          "whale_cum_net": -78.42,
          "retail_cum_net": 60.09,
          "whale_cum_buy_lot": 5107097,
          "whale_cum_sell_lot": 5473310,
          "retail_cum_buy_lot": 5798888,
          "retail_cum_sell_lot": 5500528,
          "whale_net_lot": -366213,
          "retail_net_lot": 298360
        },
        {
          "day": 57,
          "date": "2026-02-05",
          "date_display": "05/02/2026",
          "date_end": "2026-02-05",
          "whale_buy": 61.36,
          "retail_buy": 114.82,
          "whale_sell": 104.96,
          "retail_sell": 118.3,
          "whale_buyavg": 2422.28,
          "whale_sellavg": 2423.03,
          "retail_buyavg": 2426.92,
          "retail_sellavg": 2427.14,
          "whale_cum_buy": 1223.59,
          "retail_cum_buy": 1435.56,
          "whale_cum_sell": 1345.6,
          "retail_cum_sell": 1378.95,
          "whale_net": -43.59,
          "retail_net": -3.48,
          "whale_cum_net": -122.01,
          "retail_cum_net": 56.61,
          "whale_cum_buy_lot": 5353547,
          "whale_cum_sell_lot": 5904518,
          "retail_cum_buy_lot": 6267873,
          "retail_cum_sell_lot": 5984251,
          "whale_net_lot": -550971,
          "retail_net_lot": 283622
        },
        {
          "day": 58,
          "date": "2026-02-06",
          "date_display": "06/02/2026",
          "date_end": "2026-02-06",
          "whale_buy": 25.48,
          "retail_buy": 30.18,
          "whale_sell": 25.36,
          "retail_sell": 33.19,
          "whale_buyavg": 2376.65,
          "whale_sellavg": 2369.98,
          "retail_buyavg": 2369.63,
          "retail_sellavg": 2377.62,
          "whale_cum_buy": 1249.07,
          "retail_cum_buy": 1465.74,
          "whale_cum_sell": 1370.96,
          "retail_cum_sell": 1412.15,
          "whale_net": 0.12,
          "retail_net": -3.02,
          "whale_cum_net": -121.89,
          "retail_cum_net": 53.59,
          "whale_cum_buy_lot": 5461702,
          "whale_cum_sell_lot": 6012712,
          "retail_cum_buy_lot": 6395344,
          "retail_cum_sell_lot": 6124100,
          "whale_net_lot": -551010,
          "retail_net_lot": 271244
        },
        {
          "day": 59,
          "date": "2026-02-09",
          "date_display": "09/02/2026",
          "date_end": "2026-02-09",
          "whale_buy": 47.21,
          "retail_buy": 48.32,
          "whale_sell": 36.87,
          "retail_sell": 32.1,
          "whale_buyavg": 2397.77,
          "whale_sellavg": 2399.47,
          "retail_buyavg": 2398.05,
          "retail_sellavg": 2395.12,
          "whale_cum_buy": 1296.28,
          "retail_cum_buy": 1514.06,
          "whale_cum_sell": 1407.83,
          "retail_cum_sell": 1444.25,
          "whale_net": 10.34,
          "retail_net": 16.22,
          "whale_cum_net": -111.56,
          "retail_cum_net": 69.81,
          "whale_cum_buy_lot": 5658551,
          "whale_cum_sell_lot": 6165964,
          "retail_cum_buy_lot": 6596787,
          "retail_cum_sell_lot": 6257513,
          "whale_net_lot": -507413,
          "retail_net_lot": 339274
        },
        {
          "day": 60,
          "date": "2026-02-10",
          "date_display": "10/02/2026",
          "date_end": "2026-02-10",
          "whale_buy": 42.82,
          "retail_buy": 16.52,
          "whale_sell": 40.82,
          "retail_sell": 22.42,
          "whale_buyavg": 2422.08,
          "whale_sellavg": 2419.66,
          "retail_buyavg": 2412.51,
          "retail_sellavg": 2419.99,
          "whale_cum_buy": 1339.1,
          "retail_cum_buy": 1530.58,
          "whale_cum_sell": 1448.66,
          "retail_cum_sell": 1466.67,
          "whale_net": 2.0,
          "retail_net": -5.9,
          "whale_cum_net": -109.56,
          "retail_cum_net": 63.91,
          "whale_cum_buy_lot": 5834877,
          "whale_cum_sell_lot": 6334496,
          "retail_cum_buy_lot": 6665236,
          "retail_cum_sell_lot": 6350141,
          "whale_net_lot": -499619,
          "retail_net_lot": 315095
        },
        {
          "day": 61,
          "date": "2026-02-11",
          "date_display": "11/02/2026",
          "date_end": "2026-02-11",
          "whale_buy": 22.14,
          "retail_buy": 33.16,
          "whale_sell": 19.76,
          "retail_sell": 28.18,
          "whale_buyavg": 2423.26,
          "whale_sellavg": 2423.03,
          "retail_buyavg": 2426.82,
          "retail_sellavg": 2425.38,
          "whale_cum_buy": 1361.24,
          "retail_cum_buy": 1563.74,
          "whale_cum_sell": 1468.42,
          "retail_cum_sell": 1494.86,
          "whale_net": 2.38,
          "retail_net": 4.97,
          "whale_cum_net": -107.18,
          "retail_cum_net": 68.88,
          "whale_cum_buy_lot": 5926095,
          "whale_cum_sell_lot": 6415838,
          "retail_cum_buy_lot": 6801470,
          "retail_cum_sell_lot": 6466083,
          "whale_net_lot": -489743,
          "retail_net_lot": 335387
        },
        {
          "day": 62,
          "date": "2026-02-12",
          "date_display": "12/02/2026",
          "date_end": "2026-02-12",
          "whale_buy": 7.52,
          "retail_buy": 16.19,
          "whale_sell": 8.65,
          "retail_sell": 16.4,
          "whale_buyavg": 2379.1,
          "whale_sellavg": 2382.31,
          "retail_buyavg": 2380.95,
          "retail_sellavg": 2379.2,
          "whale_cum_buy": 1368.76,
          "retail_cum_buy": 1579.93,
          "whale_cum_sell": 1477.07,
          "retail_cum_sell": 1511.25,
          "whale_net": -1.13,
          "retail_net": -0.21,
          "whale_cum_net": -108.3,
          "retail_cum_net": 68.67,
          "whale_cum_buy_lot": 5957799,
          "whale_cum_sell_lot": 6452161,
          "retail_cum_buy_lot": 6869484,
          "retail_cum_sell_lot": 6535007,
          "whale_net_lot": -494362,
          "retail_net_lot": 334477
        },
        {
          "day": 63,
          "date": "2026-02-13",
          "date_display": "13/02/2026",
          "date_end": "2026-02-13",
          "whale_buy": 11.82,
          "retail_buy": 10.98,
          "whale_sell": 11.08,
          "retail_sell": 10.5,
          "whale_buyavg": 2367.03,
          "whale_sellavg": 2361.46,
          "retail_buyavg": 2360.86,
          "retail_sellavg": 2364.59,
          "whale_cum_buy": 1380.59,
          "retail_cum_buy": 1590.91,
          "whale_cum_sell": 1488.15,
          "retail_cum_sell": 1521.75,
          "whale_net": 0.74,
          "retail_net": 0.48,
          "whale_cum_net": -107.56,
          "retail_cum_net": 69.15,
          "whale_cum_buy_lot": 6007884,
          "whale_cum_sell_lot": 6499214,
          "retail_cum_buy_lot": 6913727,
          "retail_cum_sell_lot": 6579640,
          "whale_net_lot": -491330,
          "retail_net_lot": 334087
        },
        {
          "day": 64,
          "date": "2026-02-18",
          "date_display": "18/02/2026",
          "date_end": "2026-02-18",
          "whale_buy": 15.77,
          "retail_buy": 10.65,
          "whale_sell": 15.55,
          "retail_sell": 9.54,
          "whale_buyavg": 2371.71,
          "whale_sellavg": 2370.54,
          "retail_buyavg": 2365.78,
          "retail_sellavg": 2367.43,
          "whale_cum_buy": 1396.35,
          "retail_cum_buy": 1601.56,
          "whale_cum_sell": 1503.7,
          "retail_cum_sell": 1531.29,
          "whale_net": 0.21,
          "retail_net": 1.12,
          "whale_cum_net": -107.35,
          "retail_cum_net": 70.27,
          "whale_cum_buy_lot": 6074349,
          "whale_cum_sell_lot": 6564836,
          "retail_cum_buy_lot": 6958742,
          "retail_cum_sell_lot": 6619904,
          "whale_net_lot": -490487,
          "retail_net_lot": 338838
        }
      ],
      "volatilityTrend": {
        "volatilityFactor": 0.1887,
        "trendDirection": "SIDEWAYS",
        "trendStrength": 1.34,
        "minWhaleBuy": 1998.31,
        "maxWhaleBuy": 2423.26,
        "avgWhaleBuy": 2252.56,
        "avgWhaleSell": 2252.78,
        "lastWhaleBuyPrice": 2371.71
      },
      "recommendation": {
        "score": -2.5,
        "signals": [
          "Status whale: Normal",
          "Whale sedang distribusi kuat",
          "Retail euforia/akumulasi berlebih (tanda top)",
          "Tren harga naik (5 hari terakhir)"
        ],
        "whaleSignal": "bearish",
        "retailSignal": "bearish",
        "retailBullishReason": "",
        "retailBearishReason": "euforia",
        "priceTrend": "up",
        "strength": "moderate",
        "recommendation": "SELL",
        "isWhaleTrapped": false,
        "whaleTrapLevel": "none",
        "isDistributingToRetail": false,
        "lastPrice": 2371.71,
        "avgWhaleBuy": 2262.59,
        "avgRetailBuy": 2272.63
      },
      "priceRecommendation": {
        "buyZone": 2310.0,
        "targetPrice": 2260.0,
        "sellZone": 2550.0,
        "stopLoss": 2241.0,
        "rrRatio": -0.72,
        "displayRR": -0.7,
        "potentialProfit": -2.2,
        "potentialLoss": 3.0,
        "discountPercent": 0.06,
        "isWhaleTrapped": false,
        "isDistributingToRetail": false,
        "whaleTrapLevel": "none",
        "lastPrice": 2372.0,
        "avgWhaleBuy": 2253.0,
        "avgRetailBuy": 2273.0,
        "buyTick": 10,
        "targetTick": 10,
        "sellTick": 10,
        "stopTick": 10,
        "lowestRecentBuy": 2360.0,
        "strongResistance": 2400.0,
        "minWhaleBuyTick": 1995.0,
        "maxWhaleBuyTick": 2430.0
      },
      "confidence": {
        "confidenceScore": 0,
        "confidenceLevel": "RENDAH",
        "confidenceFactors": [
          "Market sideways, waspada",
          "R:RR kurang ideal (-0.7:1)",
          "Volatilitas tinggi (risky)"
        ]
      },
      "insights": {
        "whaleInsight": "Whale melakukan <span class=\"highlight\">DISTRIBUSI</span> sebesar <span class=\"highlight\">Rp 20.2 Miliar</span> dalam 30 hari transaksi. Puncak akumulasi tercapai di hari ke-56 (+-78.4 M), setelah itu mulai distribusi bertahap. Ini mengindikasikan <span class=\"highlight\">take profit</span> oleh institusi besar.",
        "retailInsight": "Retail melakukan <span class=\"highlight\">AKUMULASI</span> sebesar <span class=\"highlight\">Rp 53.9 Miliar</span> dalam 30 hari transaksi. Puncak akumulasi di hari ke-53 (+78.0 M). Ini menunjukkan minat beli yang kuat dari investor retail.",
        "whalePeak": -78.42,
        "whalePeakDay": 56,
        "retailPeak": 77.96,
        "retailPeakDay": 53
      }
    },
    "BUMI": {
      "code": "BUMI",
      "date_start": "2026-01-05",
      "date_end": "2026-02-18",
      "summary": {
        "whale_buy": 16127.620000000003,
        "retail_buy": 43554.850000000006,
        "whale_sell": 16659.149999999998,
        "retail_sell": 43920.72000000001,
        "whale_net": -531.5299999999952,
        "retail_net": -365.8700000000026,
        "total_buy": 59682.47000000001,
        "total_sell": 60579.87000000001,
        "whale_cum_buy_lot": 0,
        "whale_cum_sell_lot": 0,
        "retail_cum_buy_lot": 0,
        "retail_cum_sell_lot": 0,
        "whale_net_lot": 0,
        "retail_net_lot": 0,
        "whale_buyavg": 350.07,
        "whale_sellavg": 354.07,
        "retail_buyavg": 349.91,
        "retail_sellavg": 349.76
      },
      "brokers": [],
      "daily": [
        {
          "day": 22,
          "date": "2026-01-05",
          "date_display": "05/01/2026",
          "date_end": "2026-01-05",
          "whale_buy": 1163.52,
          "retail_buy": 1816.01,
          "whale_sell": 1245.46,
          "retail_sell": 1664.07,
          "whale_buyavg": 453.05,
          "whale_sellavg": 453.78,
          "retail_buyavg": 453.86,
          "retail_sellavg": 452.22,
          "whale_cum_buy": 12731.02,
          "retail_cum_buy": 29332.61,
          "whale_cum_sell": 12683.47,
          "retail_cum_sell": 28089.66,
          "whale_net": -81.94,
          "retail_net": 151.94,
          "whale_cum_net": 47.55,
          "retail_cum_net": 1242.95,
          "whale_cum_buy_lot": 349281370,
          "whale_cum_sell_lot": 351406578,
          "retail_cum_buy_lot": 847643255,
          "retail_cum_sell_lot": 813070730,
          "whale_net_lot": -2125208,
          "retail_net_lot": 34572525
        },
        {
          "day": 23,
          "date": "2026-01-06",
          "date_display": "06/01/2026",
          "date_end": "2026-01-06",
          "whale_buy": 1065.54,
          "retail_buy": 2717.42,
          "whale_sell": 1120.41,
          "retail_sell": 2545.44,
          "whale_buyavg": 463.83,
          "whale_sellavg": 465.18,
          "retail_buyavg": 465.63,
          "retail_sellavg": 465.07,
          "whale_cum_buy": 13796.56,
          "retail_cum_buy": 32050.03,
          "whale_cum_sell": 13803.88,
          "retail_cum_sell": 30635.11,
          "whale_net": -54.87,
          "retail_net": 171.98,
          "whale_cum_net": -7.32,
          "retail_cum_net": 1414.92,
          "whale_cum_buy_lot": 372213638,
          "whale_cum_sell_lot": 375460214,
          "retail_cum_buy_lot": 905891478,
          "retail_cum_sell_lot": 867620212,
          "whale_net_lot": -3246576,
          "retail_net_lot": 38271266
        },
        {
          "day": 24,
          "date": "2026-01-07",
          "date_display": "07/01/2026",
          "date_end": "2026-01-07",
          "whale_buy": 666.54,
          "retail_buy": 1887.33,
          "whale_sell": 534.18,
          "retail_sell": 1458.51,
          "whale_buyavg": 464.5,
          "whale_sellavg": 466.36,
          "retail_buyavg": 464.5,
          "retail_sellavg": 464.11,
          "whale_cum_buy": 14463.1,
          "retail_cum_buy": 33937.36,
          "whale_cum_sell": 14338.06,
          "retail_cum_sell": 32093.62,
          "whale_net": 132.36,
          "retail_net": 428.81,
          "whale_cum_net": 125.04,
          "retail_cum_net": 1843.74,
          "whale_cum_buy_lot": 386568132,
          "whale_cum_sell_lot": 386968840,
          "retail_cum_buy_lot": 946531289,
          "retail_cum_sell_lot": 899063942,
          "whale_net_lot": -400708,
          "retail_net_lot": 47467347
        },
        {
          "day": 25,
          "date": "2026-01-08",
          "date_display": "08/01/2026",
          "date_end": "2026-01-08",
          "whale_buy": 317.52,
          "retail_buy": 1027.63,
          "whale_sell": 454.65,
          "retail_sell": 1055.63,
          "whale_buyavg": 453.14,
          "whale_sellavg": 453.14,
          "retail_buyavg": 453.74,
          "retail_sellavg": 453.72,
          "whale_cum_buy": 14780.62,
          "retail_cum_buy": 34964.99,
          "whale_cum_sell": 14792.71,
          "retail_cum_sell": 33149.25,
          "whale_net": -137.13,
          "retail_net": -28.0,
          "whale_cum_net": -12.09,
          "retail_cum_net": 1815.74,
          "whale_cum_buy_lot": 393718647,
          "whale_cum_sell_lot": 397046301,
          "retail_cum_buy_lot": 969198924,
          "retail_cum_sell_lot": 922352271,
          "whale_net_lot": -3327654,
          "retail_net_lot": 46846653
        },
        {
          "day": 26,
          "date": "2026-01-09",
          "date_display": "09/01/2026",
          "date_end": "2026-01-09",
          "whale_buy": 305.73,
          "retail_buy": 1675.1,
          "whale_sell": 378.64,
          "retail_sell": 1600.7,
          "whale_buyavg": 468.32,
          "whale_sellavg": 467.86,
          "retail_buyavg": 469.0,
          "retail_sellavg": 469.08,
          "whale_cum_buy": 15086.35,
          "retail_cum_buy": 36640.09,
          "whale_cum_sell": 15171.36,
          "retail_cum_sell": 34749.95,
          "whale_net": -72.92,
          "retail_net": 74.4,
          "whale_cum_net": -85.01,
          "retail_cum_net": 1890.14,
          "whale_cum_buy_lot": 399870235,
