{
  "generated_at": "2026-02-13 17:05:56",
  "period": "1 Minggu",
  "days": 7,
  "stocks": {
    "ANTM": {
      "code": "ANTM",
      "date_start": "2026-02-04",
      "date_end": "2026-02-12",
      "summary": {
        "whale_buy": 1573.8600000000001,
        "retail_buy": 1846.78,
        "whale_sell": 1347.64,
        "retail_sell": 1815.3000000000002,
        "whale_net": 226.22000000000003,
        "retail_net": 31.47999999999979,
        "total_buy": 3420.6400000000003,
        "total_sell": 3162.9400000000005,
        "whale_cum_buy_lot": 0,
        "whale_cum_sell_lot": 0,
        "retail_cum_buy_lot": 0,
        "retail_cum_sell_lot": 0,
        "whale_net_lot": 0,
        "retail_net_lot": 0,
        "whale_buyavg": 3916.67,
        "whale_sellavg": 3922.05,
        "retail_buyavg": 3957.97,
        "retail_sellavg": 3952.37
      },
      "brokers": [],
      "daily": [
        {
          "day": 107,
          "date": "2026-02-04",
          "date_display": "04/02/2026",
          "date_end": "2026-02-04",
          "whale_buy": 219.11,
          "retail_buy": 339.85,
          "whale_sell": 281.28,
          "retail_sell": 308.1,
          "whale_buyavg": 4026.16,
          "whale_sellavg": 4026.16,
          "retail_buyavg": 4026.21,
          "retail_sellavg": 4023.21,
          "whale_cum_buy": 22768.53,
          "retail_cum_buy": 28970.0,
          "whale_cum_sell": 22526.1,
          "retail_cum_sell": 29366.49,
          "whale_net": -62.17,
          "retail_net": 31.75,
          "whale_cum_net": 242.42,
          "retail_cum_net": -396.49,
          "whale_cum_buy_lot": 63974872,
          "whale_cum_sell_lot": 63517333,
          "retail_cum_buy_lot": 82399532,
          "retail_cum_sell_lot": 84048132,
          "whale_net_lot": 457539,
          "retail_net_lot": -1648600
        },
        {
          "day": 108,
          "date": "2026-02-05",
          "date_display": "05/02/2026",
          "date_end": "2026-02-05",
          "whale_buy": 273.24,
          "retail_buy": 228.62,
          "whale_sell": 304.45,
          "retail_sell": 231.85,
          "whale_buyavg": 3873.54,
          "whale_sellavg": 3866.95,
          "retail_buyavg": 3868.88,
          "retail_sellavg": 3872.24,
          "whale_cum_buy": 23041.76,
          "retail_cum_buy": 29198.62,
          "whale_cum_sell": 22830.55,
          "retail_cum_sell": 29598.34,
          "whale_net": -31.21,
          "retail_net": -3.23,
          "whale_cum_net": 211.21,
          "retail_cum_net": -399.72,
          "whale_cum_buy_lot": 64689184,
          "whale_cum_sell_lot": 64312503,
          "retail_cum_buy_lot": 83008962,
          "retail_cum_sell_lot": 84662930,
          "whale_net_lot": 376681,
          "retail_net_lot": -1653968
        },
        {
          "day": 109,
          "date": "2026-02-06",
          "date_display": "06/02/2026",
          "date_end": "2026-02-06",
          "whale_buy": 254.88,
          "retail_buy": 236.85,
          "whale_sell": 224.0,
          "retail_sell": 209.46,
          "whale_buyavg": 3736.3,
          "whale_sellavg": 3735.2,
          "retail_buyavg": 3745.95,
          "retail_sellavg": 3747.36,
          "whale_cum_buy": 23296.64,
          "retail_cum_buy": 29435.46,
          "whale_cum_sell": 23054.55,
          "retail_cum_sell": 29807.8,
          "whale_net": 30.88,
          "retail_net": 27.39,
          "whale_cum_net": 242.09,
          "retail_cum_net": -372.34,
          "whale_cum_buy_lot": 65385500,
          "whale_cum_sell_lot": 64922897,
          "retail_cum_buy_lot": 83644681,
          "retail_cum_sell_lot": 85219077,
          "whale_net_lot": 462603,
          "retail_net_lot": -1574396
        },
        {
          "day": 110,
          "date": "2026-02-09",
          "date_display": "09/02/2026",
          "date_end": "2026-02-09",
          "whale_buy": 224.09,
          "retail_buy": 209.33,
          "whale_sell": 117.73,
          "retail_sell": 236.8,
          "whale_buyavg": 3848.58,
          "whale_sellavg": 3855.7,
          "retail_buyavg": 3855.94,
          "retail_sellavg": 3852.18,
          "whale_cum_buy": 23520.73,
          "retail_cum_buy": 29644.79,
          "whale_cum_sell": 23172.28,
          "retail_cum_sell": 30044.6,
          "whale_net": 106.36,
          "retail_net": -27.47,
          "whale_cum_net": 348.45,
          "retail_cum_net": -399.81,
          "whale_cum_buy_lot": 65959702,
          "whale_cum_sell_lot": 65423829,
          "retail_cum_buy_lot": 84184346,
          "retail_cum_sell_lot": 85830083,
          "whale_net_lot": 535873,
          "retail_net_lot": -1645737
        },
        {
          "day": 111,
          "date": "2026-02-10",
          "date_display": "10/02/2026",
          "date_end": "2026-02-10",
          "whale_buy": 132.17,
          "retail_buy": 185.09,
          "whale_sell": 81.96,
          "retail_sell": 137.98,
          "whale_buyavg": 3916.79,
          "whale_sellavg": 3921.28,
          "retail_buyavg": 3917.47,
          "retail_sellavg": 3919.09,
          "whale_cum_buy": 23652.9,
          "retail_cum_buy": 29829.88,
          "whale_cum_sell": 23254.24,
          "retail_cum_sell": 30182.58,
          "whale_net": 50.21,
          "retail_net": 47.1,
          "whale_cum_net": 398.66,
          "retail_cum_net": -352.71,
          "whale_cum_buy_lot": 66296085,
          "whale_cum_sell_lot": 65630324,
          "retail_cum_buy_lot": 84652814,
          "retail_cum_sell_lot": 86175684,
          "whale_net_lot": 665761,
          "retail_net_lot": -1522870
        },
        {
          "day": 112,
          "date": "2026-02-11",
          "date_display": "11/02/2026",
          "date_end": "2026-02-11",
          "whale_buy": 266.22,
          "retail_buy": 175.51,
          "whale_sell": 190.81,
          "retail_sell": 280.9,
          "whale_buyavg": 3960.1,
          "whale_sellavg": 3960.31,
          "retail_buyavg": 3960.23,
          "retail_sellavg": 3961.85,
          "whale_cum_buy": 23919.12,
          "retail_cum_buy": 30005.39,
          "whale_cum_sell": 23445.05,
          "retail_cum_sell": 30463.48,
          "whale_net": 75.41,
          "retail_net": -105.39,
          "whale_cum_net": 474.07,
          "retail_cum_net": -458.1,
          "whale_cum_buy_lot": 66965383,
          "whale_cum_sell_lot": 66110743,
          "retail_cum_buy_lot": 85094745,
          "retail_cum_sell_lot": 86883606,
          "whale_net_lot": 854640,
          "retail_net_lot": -1788861
        },
        {
          "day": 113,
          "date": "2026-02-12",
          "date_display": "12/02/2026",
          "date_end": "2026-02-12",
          "whale_buy": 204.15,
          "retail_buy": 471.53,
          "whale_sell": 147.41,
          "retail_sell": 410.21,
          "whale_buyavg": 4100.1,
          "whale_sellavg": 4125.01,
          "retail_buyavg": 4118.85,
          "retail_sellavg": 4111.68,
          "whale_cum_buy": 24123.26,
          "retail_cum_buy": 30476.92,
          "whale_cum_sell": 23592.46,
          "retail_cum_sell": 30873.69,
          "whale_net": 56.73,
          "retail_net": 61.32,
          "whale_cum_net": 530.8,
          "retail_cum_net": -396.78,
          "whale_cum_buy_lot": 67454040,
          "whale_cum_sell_lot": 66452601,
          "retail_cum_buy_lot": 86224380,
          "retail_cum_sell_lot": 87892568,
          "whale_net_lot": 1001439,
          "retail_net_lot": -1668188
        }
      ],
      "volatilityTrend": {
        "volatilityFactor": 0.0927,
        "trendDirection": "UPTREND",
        "trendStrength": 2.0,
        "minWhaleBuy": 3736.3,
        "maxWhaleBuy": 4100.1,
        "avgWhaleBuy": 3923.08,
        "avgWhaleSell": 3927.23,
        "lastWhaleBuyPrice": 4100.1
      },
      "recommendation": {
        "score": 1,
        "signals": [
          "Status whale: Normal",
          "Whale sedang akumulasi kuat",
          "Retail euforia/akumulasi berlebih (tanda top)",
          "Tren harga stabil/sideways"
        ],
        "whaleSignal": "bullish",
        "retailSignal": "bearish",
        "retailBullishReason": "",
        "retailBearishReason": "euforia",
        "priceTrend": "neutral",
        "strength": "weak",
        "recommendation": "BUY",
        "isWhaleTrapped": false,
        "whaleTrapLevel": "none",
        "isDistributingToRetail": false,
        "lastPrice": 4100.1,
        "avgWhaleBuy": 3916.67,
        "avgRetailBuy": 3957.97
      },
      "priceRecommendation": {
        "buyZone": 3770.0,
        "targetPrice": 3930.0,
        "sellZone": 4310.0,
        "stopLoss": 3657.0,
        "rrRatio": 1.41,
        "displayRR": 1.4,
        "potentialProfit": 4.2,
        "potentialLoss": 3.0,
        "discountPercent": 0.0556,
        "isWhaleTrapped": false,
        "isDistributingToRetail": false,
        "whaleTrapLevel": "none",
        "lastPrice": 4100.0,
        "avgWhaleBuy": 3923.0,
        "avgRetailBuy": 3958.0,
        "buyTick": 10,
        "targetTick": 10,
        "sellTick": 10,
        "stopTick": 10,
        "lowestRecentBuy": 3730.0,
        "strongResistance": 4080.0,
        "minWhaleBuyTick": 3730.0,
        "maxWhaleBuyTick": 4110.0
      },
      "confidence": {
        "confidenceScore": 35,
        "confidenceLevel": "RENDAH",
        "confidenceFactors": [
          "Akumulasi Whale kuat",
          "Trend naik, align dengan BUY",
          "R:RR kurang ideal (1.4:1)"
        ]
      },
      "insights": {
        "whaleInsight": "Whale melakukan <span class=\"highlight\">AKUMULASI</span> sebesar <span class=\"highlight\">Rp 226.2 Miliar</span> dalam 7 hari transaksi. Institusi sedang membeli saham ini.",
        "retailInsight": "Retail melakukan <span class=\"highlight\">AKUMULASI</span> sebesar <span class=\"highlight\">Rp 31.5 Miliar</span> dalam 7 hari transaksi. Puncak akumulasi di hari ke-111 (+-352.7 M). Ini menunjukkan minat beli yang kuat dari investor retail.",
        "whalePeak": 530.8,
        "whalePeakDay": 113,
        "retailPeak": -352.71,
        "retailPeakDay": 111
      }
    },
    "BBTN": {
      "code": "BBTN",
      "date_start": "2026-02-04",
      "date_end": "2026-02-12",
      "summary": {
        "whale_buy": 302.82,
        "retail_buy": 321.55,
        "whale_sell": 263.90999999999997,
        "retail_sell": 361.18,
        "whale_net": 38.910000000000025,
        "retail_net": -39.629999999999995,
        "total_buy": 624.37,
        "total_sell": 625.0899999999999,
        "whale_cum_buy_lot": 0,
        "whale_cum_sell_lot": 0,
        "retail_cum_buy_lot": 0,
        "retail_cum_sell_lot": 0,
        "whale_net_lot": 0,
        "retail_net_lot": 0,
        "whale_buyavg": 1306.92,
        "whale_sellavg": 1304.59,
        "retail_buyavg": 1304.27,
        "retail_sellavg": 1305.89
      },
      "brokers": [],
      "daily": [
        {
          "day": 63,
          "date": "2026-02-04",
          "date_display": "04/02/2026",
          "date_end": "2026-02-04",
          "whale_buy": 107.86,
          "retail_buy": 96.04,
          "whale_sell": 105.21,
          "retail_sell": 106.95,
          "whale_buyavg": 1294.13,
          "whale_sellavg": 1291.12,
          "retail_buyavg": 1291.8,
          "retail_sellavg": 1295.72,
          "whale_cum_buy": 855.2,
          "retail_cum_buy": 1158.84,
          "whale_cum_sell": 847.41,
          "retail_cum_sell": 1198.33,
          "whale_net": 2.65,
          "retail_net": -10.91,
          "whale_cum_net": 7.79,
          "retail_cum_net": -39.49,
          "whale_cum_buy_lot": 6972853,
          "whale_cum_sell_lot": 7108062,
          "retail_cum_buy_lot": 9616312,
          "retail_cum_sell_lot": 9970964,
          "whale_net_lot": -135209,
          "retail_net_lot": -354652
        },
        {
          "day": 64,
          "date": "2026-02-05",
          "date_display": "05/02/2026",
          "date_end": "2026-02-05",
          "whale_buy": 44.38,
          "retail_buy": 55.06,
          "whale_sell": 38.25,
          "retail_sell": 51.54,
          "whale_buyavg": 1325.49,
          "whale_sellavg": 1325.8,
          "retail_buyavg": 1324.34,
          "retail_sellavg": 1323.86,
          "whale_cum_buy": 899.58,
          "retail_cum_buy": 1213.89,
          "whale_cum_sell": 885.66,
          "retail_cum_sell": 1249.87,
          "whale_net": 6.14,
          "retail_net": 3.51,
          "whale_cum_net": 13.92,
          "retail_cum_net": -35.98,
          "whale_cum_buy_lot": 7307115,
          "whale_cum_sell_lot": 7395704,
          "retail_cum_buy_lot": 10029757,
          "retail_cum_sell_lot": 10356412,
          "whale_net_lot": -88589,
          "retail_net_lot": -326655
        },
        {
          "day": 65,
          "date": "2026-02-06",
          "date_display": "06/02/2026",
          "date_end": "2026-02-06",
          "whale_buy": 28.09,
          "retail_buy": 38.65,
          "whale_sell": 31.34,
          "retail_sell": 40.53,
          "whale_buyavg": 1288.0,
          "whale_sellavg": 1289.51,
          "retail_buyavg": 1287.63,
          "retail_sellavg": 1286.55,
          "whale_cum_buy": 927.67,
          "retail_cum_buy": 1252.55,
          "whale_cum_sell": 917.0,
          "retail_cum_sell": 1290.4,
          "whale_net": -3.25,
          "retail_net": -1.88,
          "whale_cum_net": 10.67,
          "retail_cum_net": -37.86,
          "whale_cum_buy_lot": 7528392,
          "whale_cum_sell_lot": 7572137,
          "retail_cum_buy_lot": 10330810,
          "retail_cum_sell_lot": 10672572,
          "whale_net_lot": -43745,
          "retail_net_lot": -341762
        },
        {
          "day": 66,
          "date": "2026-02-09",
          "date_display": "09/02/2026",
          "date_end": "2026-02-09",
          "whale_buy": 17.91,
          "retail_buy": 35.52,
          "whale_sell": 13.97,
          "retail_sell": 43.29,
          "whale_buyavg": 1255.96,
          "whale_sellavg": 1256.58,
          "retail_buyavg": 1259.7,
          "retail_sellavg": 1258.33,
          "whale_cum_buy": 945.59,
          "retail_cum_buy": 1288.07,
          "whale_cum_sell": 930.97,
          "retail_cum_sell": 1333.7,
          "whale_net": 3.95,
          "retail_net": -7.77,
          "whale_cum_net": 14.61,
          "retail_cum_net": -45.63,
          "whale_cum_buy_lot": 7671712,
          "whale_cum_sell_lot": 7683766,
          "retail_cum_buy_lot": 10613198,
          "retail_cum_sell_lot": 11018761,
          "whale_net_lot": -12054,
          "retail_net_lot": -405563
        },
        {
          "day": 67,
          "date": "2026-02-10",
          "date_display": "10/02/2026",
          "date_end": "2026-02-10",
          "whale_buy": 31.59,
          "retail_buy": 26.83,
          "whale_sell": 21.57,
          "retail_sell": 32.89,
          "whale_buyavg": 1289.11,
          "whale_sellavg": 1287.15,
          "retail_buyavg": 1284.9,
          "retail_sellavg": 1286.7,
          "whale_cum_buy": 977.17,
          "retail_cum_buy": 1314.89,
          "whale_cum_sell": 952.54,
          "retail_cum_sell": 1366.59,
          "whale_net": 10.01,
          "retail_net": -6.07,
          "whale_cum_net": 24.63,
          "retail_cum_net": -51.7,
          "whale_cum_buy_lot": 7915052,
          "whale_cum_sell_lot": 7848800,
          "retail_cum_buy_lot": 10820744,
          "retail_cum_sell_lot": 11272866,
          "whale_net_lot": 66252,
          "retail_net_lot": -452122
        },
        {
          "day": 68,
          "date": "2026-02-11",
          "date_display": "11/02/2026",
          "date_end": "2026-02-11",
          "whale_buy": 43.94,
          "retail_buy": 32.69,
          "whale_sell": 27.22,
          "retail_sell": 36.05,
          "whale_buyavg": 1329.1,
          "whale_sellavg": 1327.89,
          "retail_buyavg": 1325.78,
          "retail_sellavg": 1326.97,
          "whale_cum_buy": 1021.11,
          "retail_cum_buy": 1347.58,
          "whale_cum_sell": 979.77,
          "retail_cum_sell": 1402.64,
          "whale_net": 16.71,
          "retail_net": -3.37,
          "whale_cum_net": 41.34,
          "retail_cum_net": -55.06,
          "whale_cum_buy_lot": 8238366,
          "whale_cum_sell_lot": 8047886,
          "retail_cum_buy_lot": 11101287,
          "retail_cum_sell_lot": 11595294,
          "whale_net_lot": 190480,
          "retail_net_lot": -494007
        },
        {
          "day": 69,
          "date": "2026-02-12",
          "date_display": "12/02/2026",
          "date_end": "2026-02-12",
          "whale_buy": 29.05,
          "retail_buy": 36.76,
          "whale_sell": 26.35,
          "retail_sell": 49.93,
          "whale_buyavg": 1361.54,
          "whale_sellavg": 1361.16,
          "retail_buyavg": 1362.33,
          "retail_sellavg": 1363.47,
          "whale_cum_buy": 1050.16,
          "retail_cum_buy": 1384.34,
          "whale_cum_sell": 1006.12,
          "retail_cum_sell": 1452.57,
          "whale_net": 2.7,
          "retail_net": -13.18,
          "whale_cum_net": 44.04,
          "retail_cum_net": -68.24,
          "whale_cum_buy_lot": 8447684,
          "whale_cum_sell_lot": 8238798,
          "retail_cum_buy_lot": 11367309,
          "retail_cum_sell_lot": 11958910,
          "whale_net_lot": 208886,
          "retail_net_lot": -591601
        }
      ],
      "volatilityTrend": {
        "volatilityFactor": 0.0808,
        "trendDirection": "SIDEWAYS",
        "trendStrength": 0.49,
        "minWhaleBuy": 1255.96,
        "maxWhaleBuy": 1361.54,
        "avgWhaleBuy": 1306.19,
        "avgWhaleSell": 1305.6,
        "lastWhaleBuyPrice": 1361.54
      },
      "recommendation": {
        "score": 3,
        "signals": [
          "Status whale: Normal",
          "Whale sedang akumulasi kuat",
          "Retail panic selling (kontrarian bullish)",
          "Tren harga stabil/sideways"
        ],
        "whaleSignal": "bullish",
        "retailSignal": "bullish",
        "retailBullishReason": "kontrarian",
        "retailBearishReason": "",
        "priceTrend": "neutral",
        "strength": "strong",
        "recommendation": "BUY",
        "isWhaleTrapped": false,
        "whaleTrapLevel": "none",
        "isDistributingToRetail": false,
        "lastPrice": 1361.54,
        "avgWhaleBuy": 1306.92,
        "avgRetailBuy": 1304.27
      },
      "priceRecommendation": {
        "buyZone": 1265.0,
        "targetPrice": 1310.0,
        "sellZone": 1430.0,
        "stopLoss": 1227.0,
        "rrRatio": 1.19,
        "displayRR": 1.2,
        "potentialProfit": 3.6,
        "potentialLoss": 3.0,
        "discountPercent": 0.0485,
        "isWhaleTrapped": false,
        "isDistributingToRetail": false,
        "whaleTrapLevel": "none",
        "lastPrice": 1362.0,
        "avgWhaleBuy": 1306.0,
        "avgRetailBuy": 1304.0,
        "buyTick": 5,
        "targetTick": 5,
        "sellTick": 5,
        "stopTick": 5,
        "lowestRecentBuy": 1255.0,
        "strongResistance": 1365.0,
        "minWhaleBuyTick": 1255.0,
        "maxWhaleBuyTick": 1365.0
      },
      "confidence": {
        "confidenceScore": 20,
        "confidenceLevel": "RENDAH",
        "confidenceFactors": [
          "Akumulasi Whale kuat",
          "Market sideways, waspada",
          "R:RR kurang ideal (1.2:1)"
        ]
      },
      "insights": {
        "whaleInsight": "Whale melakukan <span class=\"highlight\">AKUMULASI</span> sebesar <span class=\"highlight\">Rp 38.9 Miliar</span> dalam 7 hari transaksi. Institusi sedang membeli saham ini.",
        "retailInsight": "Retail melakukan <span class=\"highlight\">DISTRIBUSI</span> sebesar <span class=\"highlight\">Rp 39.6 Miliar</span> dalam 7 hari transaksi. Investor retail sedang profit taking.",
        "whalePeak": 44.04,
        "whalePeakDay": 69,
        "retailPeak": -35.98,
        "retailPeakDay": 64
      }
    },
    "BRIS": {
      "code": "BRIS",
      "date_start": "2025-12-10",
      "date_end": "2025-12-18",
      "summary": {
        "whale_buy": 127.03,
        "retail_buy": 126.75,
        "whale_sell": 164.64,
        "retail_sell": 119.73000000000002,
        "whale_net": -37.609999999999985,
        "retail_net": 7.019999999999982,
        "total_buy": 253.78,
        "total_sell": 284.37,
        "whale_cum_buy_lot": 0,
        "whale_cum_sell_lot": 0,
        "retail_cum_buy_lot": 0,
        "retail_cum_sell_lot": 0,
        "whale_net_lot": 0,
        "retail_net_lot": 0,
        "whale_buyavg": 2240.4,
        "whale_sellavg": 2241.21,
        "retail_buyavg": 2251.68,
        "retail_sellavg": 2249.78
      },
      "brokers": [],
      "daily": [
        {
          "day": 28,
          "date": "2025-12-10",
          "date_display": "10/12/2025",
          "date_end": "2025-12-10",
          "whale_buy": 17.04,
          "retail_buy": 16.06,
          "whale_sell": 29.47,
          "retail_sell": 9.56,
          "whale_buyavg": 2261.39,
          "whale_sellavg": 2257.19,
          "retail_buyavg": 2255.65,
          "retail_sellavg": 2260.53,
          "whale_cum_buy": 330.78,
          "retail_cum_buy": 398.27,
          "whale_cum_sell": 392.72,
          "retail_cum_sell": 382.4,
          "whale_net": -12.44,
          "retail_net": 6.5,
          "whale_cum_net": -61.94,
          "retail_cum_net": 15.87,
          "whale_cum_buy_lot": 1363036,
          "whale_cum_sell_lot": 1617911,
          "retail_cum_buy_lot": 1640747,
          "retail_cum_sell_lot": 1570700,
          "whale_net_lot": -254875,
          "retail_net_lot": 70047
        },
        {
          "day": 29,
          "date": "2025-12-11",
          "date_display": "11/12/2025",
          "date_end": "2025-12-11",
          "whale_buy": 8.97,
          "retail_buy": 11.04,
          "whale_sell": 11.88,
          "retail_sell": 11.82,
          "whale_buyavg": 2211.55,
          "whale_sellavg": 2212.53,
          "retail_buyavg": 2215.14,
          "retail_sellavg": 2213.56,
          "whale_cum_buy": 339.75,
          "retail_cum_buy": 409.31,
          "whale_cum_sell": 404.6,
          "retail_cum_sell": 394.22,
          "whale_net": -2.9,
          "retail_net": -0.78,
          "whale_cum_net": -64.84,
          "retail_cum_net": 15.09,
          "whale_cum_buy_lot": 1404534,
          "whale_cum_sell_lot": 1672513,
          "retail_cum_buy_lot": 1691430,
          "retail_cum_sell_lot": 1624738,
          "whale_net_lot": -267979,
          "retail_net_lot": 66692
        },
        {
          "day": 30,
          "date": "2025-12-12",
          "date_display": "12/12/2025",
          "date_end": "2025-12-12",
          "whale_buy": 22.73,
          "retail_buy": 12.53,
          "whale_sell": 24.84,
          "retail_sell": 10.68,
          "whale_buyavg": 2168.05,
          "whale_sellavg": 2167.1,
          "retail_buyavg": 2168.74,
          "retail_sellavg": 2172.68,
          "whale_cum_buy": 362.48,
          "retail_cum_buy": 421.84,
          "whale_cum_sell": 429.44,
          "retail_cum_sell": 404.89,
          "whale_net": -2.11,
          "retail_net": 1.86,
          "whale_cum_net": -66.96,
          "retail_cum_net": 16.95,
          "whale_cum_buy_lot": 1510503,
          "whale_cum_sell_lot": 1788446,
          "retail_cum_buy_lot": 1749809,
          "retail_cum_sell_lot": 1674294,
          "whale_net_lot": -277943,
          "retail_net_lot": 75515
        },
        {
          "day": 31,
          "date": "2025-12-15",
          "date_display": "15/12/2025",
          "date_end": "2025-12-15",
          "whale_buy": 24.41,
          "retail_buy": 31.15,
          "whale_sell": 36.41,
          "retail_sell": 35.27,
          "whale_buyavg": 2235.33,
          "whale_sellavg": 2237.37,
          "retail_buyavg": 2255.93,
          "retail_sellavg": 2248.89,
          "whale_cum_buy": 386.89,
          "retail_cum_buy": 452.99,
          "whale_cum_sell": 465.85,
          "retail_cum_sell": 440.17,
          "whale_net": -12.0,
          "retail_net": -4.13,
          "whale_cum_net": -78.96,
          "retail_cum_net": 12.82,
          "whale_cum_buy_lot": 1616522,
          "whale_cum_sell_lot": 1949872,
          "retail_cum_buy_lot": 1884896,
          "retail_cum_sell_lot": 1828515,
          "whale_net_lot": -333350,
          "retail_net_lot": 56381
        },
        {
          "day": 32,
          "date": "2025-12-16",
          "date_display": "16/12/2025",
          "date_end": "2025-12-16",
          "whale_buy": 28.25,
          "retail_buy": 25.42,
          "whale_sell": 30.26,
          "retail_sell": 26.1,
          "whale_buyavg": 2269.64,
          "whale_sellavg": 2264.34,
          "retail_buyavg": 2266.54,
          "retail_sellavg": 2268.3,
          "whale_cum_buy": 415.14,
          "retail_cum_buy": 478.41,
          "whale_cum_sell": 496.11,
          "retail_cum_sell": 466.27,
          "whale_net": -2.01,
          "retail_net": -0.68,
          "whale_cum_net": -80.97,
          "retail_cum_net": 12.15,
          "whale_cum_buy_lot": 1740682,
          "whale_cum_sell_lot": 2092550,
          "retail_cum_buy_lot": 1996633,
          "retail_cum_sell_lot": 1943031,
          "whale_net_lot": -351868,
          "retail_net_lot": 53602
        },
        {
          "day": 33,
          "date": "2025-12-17",
          "date_display": "17/12/2025",
          "date_end": "2025-12-17",
          "whale_buy": 10.04,
          "retail_buy": 9.2,
          "whale_sell": 10.76,
          "retail_sell": 9.43,
          "whale_buyavg": 2249.78,
          "whale_sellavg": 2250.66,
          "retail_buyavg": 2251.73,
          "retail_sellavg": 2250.62,
          "whale_cum_buy": 425.18,
          "retail_cum_buy": 487.61,
          "whale_cum_sell": 506.87,
          "retail_cum_sell": 475.7,
          "whale_net": -0.72,
          "retail_net": -0.23,
          "whale_cum_net": -81.69,
          "retail_cum_net": 11.91,
          "whale_cum_buy_lot": 1785340,
          "whale_cum_sell_lot": 2140413,
          "retail_cum_buy_lot": 2037484,
          "retail_cum_sell_lot": 1984930,
          "whale_net_lot": -355073,
          "retail_net_lot": 52554
        },
        {
          "day": 34,
          "date": "2025-12-18",
          "date_display": "18/12/2025",
          "date_end": "2025-12-18",
          "whale_buy": 15.59,
          "retail_buy": 21.35,
          "whale_sell": 21.02,
          "retail_sell": 16.87,
          "whale_buyavg": 2288.43,
          "whale_sellavg": 2291.1,
          "retail_buyavg": 2292.34,
          "retail_sellavg": 2290.59,
          "whale_cum_buy": 440.77,
          "retail_cum_buy": 508.96,
          "whale_cum_sell": 527.88,
          "retail_cum_sell": 492.57,
          "whale_net": -5.43,
          "retail_net": 4.48,
          "whale_cum_net": -87.12,
          "retail_cum_net": 16.39,
          "whale_cum_buy_lot": 1853057,
          "whale_cum_sell_lot": 2231843,
          "retail_cum_buy_lot": 2130198,
          "retail_cum_sell_lot": 2058149,
          "whale_net_lot": -378786,
          "retail_net_lot": 72049
        }
      ],
      "volatilityTrend": {
        "volatilityFactor": 0.0537,
        "trendDirection": "UPTREND",
        "trendStrength": 2.13,
        "minWhaleBuy": 2168.05,
        "maxWhaleBuy": 2288.43,
        "avgWhaleBuy": 2240.6,
        "avgWhaleSell": 2240.04,
        "lastWhaleBuyPrice": 2288.43
      },
      "recommendation": {
        "score": -3,
        "signals": [
          "Status whale: Normal",
          "Whale sedang distribusi kuat",
          "Retail euforia/akumulasi berlebih (tanda top)",
          "Tren harga stabil/sideways"
        ],
        "whaleSignal": "bearish",
        "retailSignal": "bearish",
        "retailBullishReason": "",
        "retailBearishReason": "euforia",
        "priceTrend": "neutral",
        "strength": "strong",
        "recommendation": "SELL",
        "isWhaleTrapped": false,
        "whaleTrapLevel": "none",
        "isDistributingToRetail": false,
        "lastPrice": 2288.43,
        "avgWhaleBuy": 2240.4,
        "avgRetailBuy": 2251.68
      },
      "priceRecommendation": {
        "buyZone": 2180.0,
        "targetPrice": 2250.0,
        "sellZone": 2410.0,
        "stopLoss": 2115.0,
        "rrRatio": 1.07,
        "displayRR": 1.1,
        "potentialProfit": 3.2,
        "potentialLoss": 3.0,
        "discountPercent": 0.0322,
        "isWhaleTrapped": false,
        "isDistributingToRetail": false,
        "whaleTrapLevel": "none",
        "lastPrice": 2288.0,
        "avgWhaleBuy": 2241.0,
        "avgRetailBuy": 2252.0,
        "buyTick": 10,
        "targetTick": 10,
        "sellTick": 10,
        "stopTick": 10,
        "lowestRecentBuy": 2160.0,
        "strongResistance": 2300.0,
        "minWhaleBuyTick": 2160.0,
        "maxWhaleBuyTick": 2290.0
      },
      "confidence": {
        "confidenceScore": 0,
        "confidenceLevel": "RENDAH",
        "confidenceFactors": [
          "R:RR kurang ideal (1.1:1)"
        ]
      },
      "insights": {
        "whaleInsight": "Whale melakukan <span class=\"highlight\">DISTRIBUSI</span> sebesar <span class=\"highlight\">Rp 37.6 Miliar</span> dalam 7 hari transaksi. Puncak akumulasi tercapai di hari ke-28 (+-61.9 M), setelah itu mulai distribusi bertahap. Ini mengindikasikan <span class=\"highlight\">take profit</span> oleh institusi besar.",
        "retailInsight": "Retail melakukan <span class=\"highlight\">AKUMULASI</span> sebesar <span class=\"highlight\">Rp 7.0 Miliar</span> dalam 7 hari transaksi. Puncak akumulasi di hari ke-30 (+16.9 M). Ini menunjukkan minat beli yang kuat dari investor retail.",
        "whalePeak": -61.94,
        "whalePeakDay": 28,
        "retailPeak": 16.95,
        "retailPeakDay": 30
      }
    },
    "BUMI": {
      "code": "BUMI",
      "date_start": "2026-02-04",
      "date_end": "2026-02-12",
      "summary": {
        "whale_buy": 2632.15,
        "retail_buy": 7142.48,
        "whale_sell": 2665.14,
        "retail_sell": 7036.889999999999,
        "whale_net": -32.98999999999978,
        "retail_net": 105.59000000000015,
        "total_buy": 9774.63,
        "total_sell": 9702.029999999999,
        "whale_cum_buy_lot": 0,
        "whale_cum_sell_lot": 0,
        "retail_cum_buy_lot": 0,
        "retail_cum_sell_lot": 0,
        "whale_net_lot": 0,
        "retail_net_lot": 0,
        "whale_buyavg": 253.89,
        "whale_sellavg": 253.75,
        "retail_buyavg": 255.9,
        "retail_sellavg": 255.4
      },
      "brokers": [],
      "daily": [
        {
          "day": 43,
          "date": "2026-02-04",
          "date_display": "04/02/2026",
          "date_end": "2026-02-04",
          "whale_buy": 379.19,
          "retail_buy": 1386.77,
          "whale_sell": 498.42,
          "retail_sell": 1241.25,
          "whale_buyavg": 251.44,
          "whale_sellavg": 250.97,
          "retail_buyavg": 250.9,
          "retail_sellavg": 250.72,
          "whale_cum_buy": 24393.49,
          "retail_cum_buy": 63162.94,
          "whale_cum_sell": 25241.79,
          "retail_cum_sell": 62106.47,
          "whale_net": -119.22,
          "retail_net": 145.52,
          "whale_cum_net": -848.3,
          "retail_cum_net": 1056.47,
          "whale_cum_buy_lot": 696735536,
          "whale_cum_sell_lot": 706813192,
          "retail_cum_buy_lot": 1825029806,
          "retail_cum_sell_lot": 1788281612,
          "whale_net_lot": -10077656,
          "retail_net_lot": 36748194
        },
        {
          "day": 44,
          "date": "2026-02-05",
          "date_display": "05/02/2026",
          "date_end": "2026-02-05",
          "whale_buy": 253.89,
          "retail_buy": 705.25,
          "whale_sell": 271.95,
          "retail_sell": 621.21,
          "whale_buyavg": 246.6,
          "whale_sellavg": 245.72,
          "retail_buyavg": 247.99,
          "retail_sellavg": 248.35,
          "whale_cum_buy": 24647.38,
          "retail_cum_buy": 63868.19,
          "whale_cum_sell": 25513.74,
          "retail_cum_sell": 62727.68,
          "whale_net": -18.07,
          "retail_net": 84.04,
          "whale_cum_net": -866.36,
          "retail_cum_net": 1140.51,
          "whale_cum_buy_lot": 707040716,
          "whale_cum_sell_lot": 717883265,
          "retail_cum_buy_lot": 1853462489,
          "retail_cum_sell_lot": 1813357326,
          "whale_net_lot": -10842549,
          "retail_net_lot": 40105163
        },
        {
          "day": 45,
          "date": "2026-02-06",
          "date_display": "06/02/2026",
          "date_end": "2026-02-06",
          "whale_buy": 351.68,
          "retail_buy": 452.94,
          "whale_sell": 271.36,
          "retail_sell": 516.89,
          "whale_buyavg": 228.18,
          "whale_sellavg": 227.71,
          "retail_buyavg": 227.72,
          "retail_sellavg": 227.65,
          "whale_cum_buy": 24999.06,
          "retail_cum_buy": 64321.14,
          "whale_cum_sell": 25785.1,
          "retail_cum_sell": 63244.58,
          "whale_net": 80.32,
          "retail_net": -63.95,
          "whale_cum_net": -786.05,
          "retail_cum_net": 1076.56,
          "whale_cum_buy_lot": 723067154,
          "whale_cum_sell_lot": 730600547,
          "retail_cum_buy_lot": 1874749103,
          "retail_cum_sell_lot": 1837724780,
          "whale_net_lot": -7533393,
          "retail_net_lot": 37024323
        },
        {
          "day": 46,
          "date": "2026-02-09",
          "date_display": "09/02/2026",
          "date_end": "2026-02-09",
          "whale_buy": 253.62,
          "retail_buy": 621.94,
          "whale_sell": 286.62,
          "retail_sell": 760.6,
          "whale_buyavg": 235.76,
          "whale_sellavg": 236.3,
          "retail_buyavg": 236.18,
          "retail_sellavg": 236.18,
          "whale_cum_buy": 25252.68,
          "retail_cum_buy": 64943.07,
          "whale_cum_sell": 26071.73,
          "retail_cum_sell": 64005.18,
          "whale_net": -33.0,
          "retail_net": -138.66,
          "whale_cum_net": -819.05,
          "retail_cum_net": 937.9,
          "whale_cum_buy_lot": 733696066,
          "whale_cum_sell_lot": 742704970,
          "retail_cum_buy_lot": 1900271185,
          "retail_cum_sell_lot": 1869315644,
          "whale_net_lot": -9008904,
          "retail_net_lot": 30955541
        },
        {
          "day": 47,
          "date": "2026-02-10",
          "date_display": "10/02/2026",
          "date_end": "2026-02-10",
          "whale_buy": 331.54,
          "retail_buy": 1095.66,
          "whale_sell": 304.39,
          "retail_sell": 1108.55,
          "whale_buyavg": 252.36,
          "whale_sellavg": 251.77,
          "retail_buyavg": 252.24,
          "retail_sellavg": 252.49,
          "whale_cum_buy": 25584.21,
          "retail_cum_buy": 66038.73,
          "whale_cum_sell": 26376.12,
          "retail_cum_sell": 65113.73,
          "whale_net": 27.14,
          "retail_net": -12.89,
          "whale_cum_net": -791.91,
          "retail_cum_net": 925.0,
          "whale_cum_buy_lot": 746026933,
          "whale_cum_sell_lot": 754069835,
          "retail_cum_buy_lot": 1941573828,
          "retail_cum_sell_lot": 1917003607,
          "whale_net_lot": -8042902,
          "retail_net_lot": 24570221
        },
        {
          "day": 48,
          "date": "2026-02-11",
          "date_display": "11/02/2026",
          "date_end": "2026-02-11",
          "whale_buy": 566.36,
          "retail_buy": 1487.44,
          "whale_sell": 556.83,
          "retail_sell": 1415.81,
          "whale_buyavg": 267.4,
          "whale_sellavg": 266.9,
          "retail_buyavg": 267.69,
          "retail_sellavg": 268.07,
          "whale_cum_buy": 26150.57,
          "retail_cum_buy": 67526.17,
          "whale_cum_sell": 26932.95,
          "retail_cum_sell": 66529.53,
          "whale_net": 9.53,
          "retail_net": 71.63,
          "whale_cum_net": -782.38,
          "retail_cum_net": 996.64,
          "whale_cum_buy_lot": 765908915,
          "whale_cum_sell_lot": 773663985,
          "retail_cum_buy_lot": 1993668180,
          "retail_cum_sell_lot": 1966125611,
          "whale_net_lot": -7755070,
          "retail_net_lot": 27542569
        },
        {
          "day": 49,
          "date": "2026-02-12",
          "date_display": "12/02/2026",
          "date_end": "2026-02-12",
          "whale_buy": 495.87,
          "retail_buy": 1392.48,
          "whale_sell": 475.57,
          "retail_sell": 1372.58,
          "whale_buyavg": 272.59,
          "whale_sellavg": 272.49,
          "retail_buyavg": 273.15,
          "retail_sellavg": 273.18,
          "whale_cum_buy": 26646.44,
          "retail_cum_buy": 68918.65,
          "whale_cum_sell": 27408.52,
          "retail_cum_sell": 67902.11,
          "whale_net": 20.3,
          "retail_net": 19.9,
          "whale_cum_net": -762.08,
          "retail_cum_net": 1016.54,
          "whale_cum_buy_lot": 784097622,
          "whale_cum_sell_lot": 791112601,
          "retail_cum_buy_lot": 2044566468,
          "retail_cum_sell_lot": 2016292890,
          "whale_net_lot": -7014979,
          "retail_net_lot": 28273578
        }
      ],
      "volatilityTrend": {
        "volatilityFactor": 0.1772,
        "trendDirection": "UPTREND",
        "trendStrength": 6.18,
        "minWhaleBuy": 228.18,
        "maxWhaleBuy": 272.59,
        "avgWhaleBuy": 250.62,
        "avgWhaleSell": 250.27,
        "lastWhaleBuyPrice": 272.59
      },
      "recommendation": {
        "score": -3,
        "signals": [
          "Status whale: Normal",
          "Whale sedang distribusi kuat",
          "Retail euforia/akumulasi berlebih (tanda top)",
          "Tren harga stabil/sideways"
        ],
        "whaleSignal": "bearish",
        "retailSignal": "bearish",
        "retailBullishReason": "",
        "retailBearishReason": "euforia",
        "priceTrend": "neutral",
        "strength": "strong",
        "recommendation": "SELL",
        "isWhaleTrapped": false,
        "whaleTrapLevel": "none",
        "isDistributingToRetail": false,
        "lastPrice": 272.59,
        "avgWhaleBuy": 253.89,
        "avgRetailBuy": 255.9
      },
      "priceRecommendation": {
        "buyZone": 238.0,
        "targetPrice": 252.0,
        "sellZone": 288.0,
        "stopLoss": 231.0,
        "rrRatio": 1.96,
        "displayRR": 2.0,
        "potentialProfit": 5.9,
        "potentialLoss": 3.0,
        "discountPercent": 0.06,
        "isWhaleTrapped": false,
        "isDistributingToRetail": false,
        "whaleTrapLevel": "none",
        "lastPrice": 273.0,
        "avgWhaleBuy": 251.0,
        "avgRetailBuy": 256.0,
        "buyTick": 2,
        "targetTick": 2,
        "sellTick": 2,
        "stopTick": 2,
        "lowestRecentBuy": 228.0,
        "strongResistance": 270.0,
        "minWhaleBuyTick": 228.0,
        "maxWhaleBuyTick": 274.0
      },
      "confidence": {
        "confidenceScore": 0,
        "confidenceLevel": "RENDAH",
        "confidenceFactors": [
          "R:RR moderat (2.0:1)",
          "Volatilitas tinggi (risky)"
        ]
      },
      "insights": {
        "whaleInsight": "Whale melakukan <span class=\"highlight\">DISTRIBUSI</span> sebesar <span class=\"highlight\">Rp 33.0 Miliar</span> dalam 7 hari transaksi. Puncak akumulasi tercapai di hari ke-49 (+-762.1 M), setelah itu mulai distribusi bertahap. Ini mengindikasikan <span class=\"highlight\">take profit</span> oleh institusi besar.",
        "retailInsight": "Retail melakukan <span class=\"highlight\">AKUMULASI</span> sebesar <span class=\"highlight\">Rp 105.6 Miliar</span> dalam 7 hari transaksi. Puncak akumulasi di hari ke-44 (+1140.5 M). Ini menunjukkan minat beli yang kuat dari investor retail.",
        "whalePeak": -762.08,
        "whalePeakDay": 49,
        "retailPeak": 1140.51,
        "retailPeakDay": 44
      }
    },
    "CDIA": {
      "code": "CDIA",
      "date_start": "2026-02-04",
      "date_end": "2026-02-12",
      "summary": {
        "whale_buy": 269.35,
        "retail_buy": 556.41,
        "whale_sell": 265.85999999999996,
        "retail_sell": 559.22,
        "whale_net": 3.490000000000066,
        "retail_net": -2.810000000000059,
        "total_buy": 825.76,
        "total_sell": 825.0799999999999,
        "whale_cum_buy_lot": 0,
        "whale_cum_sell_lot": 0,
        "retail_cum_buy_lot": 0,
        "retail_cum_sell_lot": 0,
        "whale_net_lot": 0,
        "retail_net_lot": 0,
        "whale_buyavg": 1120.4,
        "whale_sellavg": 1126.42,
        "retail_buyavg": 1135.71,
        "retail_sellavg": 1133.83
      },
      "brokers": [],
      "daily": [
        {
          "day": 23,
          "date": "2026-02-04",
          "date_display": "04/02/2026",
          "date_end": "2026-02-04",
          "whale_buy": 33.88,
          "retail_buy": 71.75,
          "whale_sell": 36.34,
          "retail_sell": 56.25,
          "whale_buyavg": 1086.84,
          "whale_sellavg": 1088.9,
          "retail_buyavg": 1092.63,
          "retail_sellavg": 1090.33,
          "whale_cum_buy": 1205.51,
          "retail_cum_buy": 2180.92,
          "whale_cum_sell": 1184.87,
          "retail_cum_sell": 2226.01,
          "whale_net": -2.46,
          "retail_net": 15.5,
          "whale_cum_net": 20.64,
          "retail_cum_net": -45.09,
          "whale_cum_buy_lot": 8994537,
          "whale_cum_sell_lot": 8848056,
          "retail_cum_buy_lot": 15127961,
          "retail_cum_sell_lot": 15568089,
          "whale_net_lot": 146481,
          "retail_net_lot": -440128
        },
        {
          "day": 24,
          "date": "2026-02-05",
          "date_display": "05/02/2026",
          "date_end": "2026-02-05",
          "whale_buy": 25.89,
          "retail_buy": 54.0,
          "whale_sell": 27.82,
          "retail_sell": 60.74,
          "whale_buyavg": 1105.57,
          "whale_sellavg": 1104.65,
          "retail_buyavg": 1104.34,
          "retail_sellavg": 1105.0,
          "whale_cum_buy": 1231.4,
          "retail_cum_buy": 2234.92,
          "whale_cum_sell": 1212.69,
          "retail_cum_sell": 2286.76,
          "whale_net": -1.93,
          "retail_net": -6.75,
          "whale_cum_net": 18.71,
          "retail_cum_net": -51.84,
          "whale_cum_buy_lot": 9226265,
          "whale_cum_sell_lot": 9097380,
          "retail_cum_buy_lot": 15614052,
          "retail_cum_sell_lot": 16115576,
          "whale_net_lot": 128885,
          "retail_net_lot": -501524
        },
        {
          "day": 25,
          "date": "2026-02-06",
          "date_display": "06/02/2026",
          "date_end": "2026-02-06",
          "whale_buy": 35.15,
          "retail_buy": 58.79,
          "whale_sell": 23.1,
          "retail_sell": 62.76,
          "whale_buyavg": 1042.61,
          "whale_sellavg": 1037.93,
          "retail_buyavg": 1045.67,
          "retail_sellavg": 1047.83,
          "whale_cum_buy": 1266.55,
          "retail_cum_buy": 2293.71,
          "whale_cum_sell": 1235.79,
          "retail_cum_sell": 2349.51,
          "whale_net": 12.06,
          "retail_net": -3.96,
          "whale_cum_net": 30.77,
          "retail_cum_net": -55.8,
          "whale_cum_buy_lot": 9566870,
          "whale_cum_sell_lot": 9292453,
          "retail_cum_buy_lot": 16198676,
          "retail_cum_sell_lot": 16702243,
          "whale_net_lot": 274417,
          "retail_net_lot": -503567
        },
        {
          "day": 26,
          "date": "2026-02-09",
          "date_display": "09/02/2026",
          "date_end": "2026-02-09",
          "whale_buy": 32.98,
          "retail_buy": 34.27,
          "whale_sell": 23.75,
          "retail_sell": 40.59,
          "whale_buyavg": 1033.91,
          "whale_sellavg": 1032.82,
          "retail_buyavg": 1031.99,
          "retail_sellavg": 1034.39,
          "whale_cum_buy": 1299.53,
          "retail_cum_buy": 2327.98,
          "whale_cum_sell": 1259.54,
          "retail_cum_sell": 2390.1,
          "whale_net": 9.23,
          "retail_net": -6.32,
          "whale_cum_net": 40.0,
          "retail_cum_net": -62.12,
          "whale_cum_buy_lot": 9886805,
          "whale_cum_sell_lot": 9523330,
          "retail_cum_buy_lot": 16531241,
          "retail_cum_sell_lot": 17095266,
          "whale_net_lot": 363475,
          "retail_net_lot": -564025
        },
        {
          "day": 27,
          "date": "2026-02-10",
          "date_display": "10/02/2026",
          "date_end": "2026-02-10",
          "whale_buy": 25.88,
          "retail_buy": 40.09,
          "whale_sell": 32.06,
          "retail_sell": 51.34,
          "whale_buyavg": 1102.58,
          "whale_sellavg": 1099.8,
          "retail_buyavg": 1101.92,
          "retail_sellavg": 1100.44,
          "whale_cum_buy": 1325.42,
          "retail_cum_buy": 2368.07,
          "whale_cum_sell": 1291.6,
          "retail_cum_sell": 2441.44,
          "whale_net": -6.18,
          "retail_net": -11.25,
          "whale_cum_net": 33.82,
          "retail_cum_net": -73.36,
          "whale_cum_buy_lot": 10173671,
          "whale_cum_sell_lot": 9808430,
          "retail_cum_buy_lot": 16876819,
          "retail_cum_sell_lot": 17588860,
          "whale_net_lot": 365241,
          "retail_net_lot": -712041
        },
        {
          "day": 28,
          "date": "2026-02-11",
          "date_display": "11/02/2026",
          "date_end": "2026-02-11",
          "whale_buy": 74.44,
          "retail_buy": 211.71,
          "whale_sell": 91.96,
          "retail_sell": 193.06,
          "whale_buyavg": 1187.18,
          "whale_sellavg": 1183.1,
          "retail_buyavg": 1184.48,
          "retail_sellavg": 1187.1,
          "whale_cum_buy": 1399.86,
          "retail_cum_buy": 2579.78,
          "whale_cum_sell": 1383.55,
          "retail_cum_sell": 2634.5,
          "whale_net": -17.52,
          "retail_net": 18.65,
          "whale_cum_net": 16.31,
          "retail_cum_net": -54.71,
          "whale_cum_buy_lot": 10773134,
          "whale_cum_sell_lot": 10561903,
          "retail_cum_buy_lot": 18618172,
          "retail_cum_sell_lot": 19166228,
          "whale_net_lot": 211231,
          "retail_net_lot": -548056
        },
        {
          "day": 29,
          "date": "2026-02-12",
          "date_display": "12/02/2026",
          "date_end": "2026-02-12",
          "whale_buy": 41.13,
          "retail_buy": 85.8,
          "whale_sell": 30.83,
          "retail_sell": 94.48,
          "whale_buyavg": 1183.59,
          "whale_sellavg": 1187.29,
          "retail_buyavg": 1190.03,
          "retail_sellavg": 1187.4,
          "whale_cum_buy": 1440.99,
          "retail_cum_buy": 2665.59,
          "whale_cum_sell": 1414.39,
          "retail_cum_sell": 2728.97,
          "whale_net": 10.29,
          "retail_net": -8.67,
          "whale_cum_net": 26.6,
          "retail_cum_net": -63.39,
          "whale_cum_buy_lot": 11120672,
          "whale_cum_sell_lot": 10820939,
          "retail_cum_buy_lot": 19339326,
          "retail_cum_sell_lot": 19962418,
          "whale_net_lot": 299733,
          "retail_net_lot": -623092
        }
      ],
      "volatilityTrend": {
        "volatilityFactor": 0.1386,
        "trendDirection": "UPTREND",
        "trendStrength": 4.5,
        "minWhaleBuy": 1033.91,
        "maxWhaleBuy": 1187.18,
        "avgWhaleBuy": 1106.04,
        "avgWhaleSell": 1104.93,
        "lastWhaleBuyPrice": 1183.59
      },
      "recommendation": {
        "score": 0.5,
        "signals": [
          "Status whale: Normal",
          "Whale sedang akumulasi moderat",
          "Retail distribusi",
          "Tren harga stabil/sideways"
        ],
        "whaleSignal": "bullish",
        "retailSignal": "bearish",
        "retailBullishReason": "",
        "retailBearishReason": "distribusi",
        "priceTrend": "neutral",
        "strength": "weak",
        "recommendation": "HOLD",
        "isWhaleTrapped": false,
        "whaleTrapLevel": "none",
        "isDistributingToRetail": false,
        "lastPrice": 1183.59,
        "avgWhaleBuy": 1120.4,
        "avgRetailBuy": 1135.71
      },
      "priceRecommendation": {
        "buyZone": 1050.0,
        "targetPrice": 1105.0,
        "sellZone": 1250.0,
        "stopLoss": 1018.0,
        "rrRatio": 1.75,
        "displayRR": 1.7,
        "potentialProfit": 5.2,
        "potentialLoss": 3.0,
        "discountPercent": 0.06,
        "isWhaleTrapped": false,
        "isDistributingToRetail": false,
        "whaleTrapLevel": "none",
        "lastPrice": 1184.0,
        "avgWhaleBuy": 1106.0,
        "avgRetailBuy": 1136.0,
        "buyTick": 5,
        "targetTick": 5,
        "sellTick": 5,
        "stopTick": 5,
        "lowestRecentBuy": 1030.0,
        "strongResistance": 1190.0,
        "minWhaleBuyTick": 1030.0,
        "maxWhaleBuyTick": 1190.0
      },
      "confidence": {
        "confidenceScore": 25,
        "confidenceLevel": "RENDAH",
        "confidenceFactors": [
          "Akumulasi Whale moderat",
          "R:RR moderat (1.7:1)"
        ]
      },
      "insights": {
        "whaleInsight": "Whale melakukan <span class=\"highlight\">AKUMULASI</span> sebesar <span class=\"highlight\">Rp 3.5 Miliar</span> dalam 7 hari transaksi. Institusi sedang membeli saham ini.",
        "retailInsight": "Retail melakukan <span class=\"highlight\">DISTRIBUSI</span> sebesar <span class=\"highlight\">Rp 2.8 Miliar</span> dalam 7 hari transaksi. Investor retail sedang profit taking.",
        "whalePeak": 40.0,
        "whalePeakDay": 26,
        "retailPeak": -45.09,
        "retailPeakDay": 23
      }
    },
    "CUAN": {
      "code": "CUAN",
      "date_start": "2026-02-04",
      "date_end": "2026-02-12",
      "summary": {
        "whale_buy": 403.53999999999996,
        "retail_buy": 975.8800000000001,
        "whale_sell": 371.99,
        "retail_sell": 913.02,
        "whale_net": 31.549999999999955,
        "retail_net": 62.86000000000013,
        "total_buy": 1379.42,
        "total_sell": 1285.01,
        "whale_cum_buy_lot": 0,
        "whale_cum_sell_lot": 0,
        "retail_cum_buy_lot": 0,
        "retail_cum_sell_lot": 0,
        "whale_net_lot": 0,
        "retail_net_lot": 0,
        "whale_buyavg": 1787.46,
        "whale_sellavg": 1772.12,
        "retail_buyavg": 1818.59,
        "retail_sellavg": 1808.73
      },
      "brokers": [],
      "daily": [
        {
          "day": 63,
          "date": "2026-02-04",
          "date_display": "04/02/2026",
          "date_end": "2026-02-04",
          "whale_buy": 43.19,
          "retail_buy": 90.49,
          "whale_sell": 53.51,
          "retail_sell": 90.95,
          "whale_buyavg": 1710.69,
          "whale_sellavg": 1709.2,
          "retail_buyavg": 1712.04,
          "retail_sellavg": 1713.41,
          "whale_cum_buy": 4456.45,
          "retail_cum_buy": 8833.72,
          "whale_cum_sell": 4385.33,
          "retail_cum_sell": 8799.43,
          "whale_net": -10.32,
          "retail_net": -0.47,
          "whale_cum_net": 71.13,
          "retail_cum_net": 34.3,
          "whale_cum_buy_lot": 20107072,
          "whale_cum_sell_lot": 19939844,
          "retail_cum_buy_lot": 40071920,
          "retail_cum_sell_lot": 39679198,
          "whale_net_lot": 167228,
          "retail_net_lot": 392722
        },
        {
          "day": 64,
          "date": "2026-02-05",
          "date_display": "05/02/2026",
          "date_end": "2026-02-05",
          "whale_buy": 20.95,
          "retail_buy": 43.48,
          "whale_sell": 17.82,
          "retail_sell": 52.74,
          "whale_buyavg": 1748.58,
          "whale_sellavg": 1750.03,
          "retail_buyavg": 1758.12,
          "retail_sellavg": 1759.77,
          "whale_cum_buy": 4477.4,
          "retail_cum_buy": 8877.2,
          "whale_cum_sell": 4403.15,
          "retail_cum_sell": 8852.17,
          "whale_net": 3.13,
          "retail_net": -9.26,
          "whale_cum_net": 74.26,
          "retail_cum_net": 25.04,
          "whale_cum_buy_lot": 20221637,
          "whale_cum_sell_lot": 20034669,
          "retail_cum_buy_lot": 40547396,
          "retail_cum_sell_lot": 39969633,
          "whale_net_lot": 186968,
          "retail_net_lot": 577763
        },
        {
          "day": 65,
          "date": "2026-02-06",
          "date_display": "06/02/2026",
          "date_end": "2026-02-06",
          "whale_buy": 49.05,
          "retail_buy": 70.97,
          "whale_sell": 54.81,
          "retail_sell": 70.19,
          "whale_buyavg": 1659.81,
          "whale_sellavg": 1662.15,
          "retail_buyavg": 1663.73,
          "retail_sellavg": 1661.17,
          "whale_cum_buy": 4526.45,
          "retail_cum_buy": 8948.17,
          "whale_cum_sell": 4457.95,
          "retail_cum_sell": 8922.36,
          "whale_net": -5.76,
          "retail_net": 0.78,
          "whale_cum_net": 68.5,
          "retail_cum_net": 25.82,
          "whale_cum_buy_lot": 20518708,
          "whale_cum_sell_lot": 20365682,
          "retail_cum_buy_lot": 40978471,
          "retail_cum_sell_lot": 40395549,
          "whale_net_lot": 153026,
          "retail_net_lot": 582922
        },
        {
          "day": 66,
          "date": "2026-02-09",
          "date_display": "09/02/2026",
          "date_end": "2026-02-09",
          "whale_buy": 27.07,
          "retail_buy": 38.24,
          "whale_sell": 32.5,
          "retail_sell": 28.37,
          "whale_buyavg": 1641.37,
          "whale_sellavg": 1641.25,
          "retail_buyavg": 1641.93,
          "retail_sellavg": 1642.21,
          "whale_cum_buy": 4553.52,
          "retail_cum_buy": 8986.42,
          "whale_cum_sell": 4490.45,
          "retail_cum_sell": 8950.73,
          "whale_net": -5.43,
          "retail_net": 9.88,
          "whale_cum_net": 63.06,
          "retail_cum_net": 35.69,
          "whale_cum_buy_lot": 20683726,
          "whale_cum_sell_lot": 20563922,
          "retail_cum_buy_lot": 41211427,
          "retail_cum_sell_lot": 40568317,
          "whale_net_lot": 119804,
          "retail_net_lot": 643110
        },
        {
          "day": 67,
          "date": "2026-02-10",
          "date_display": "10/02/2026",
          "date_end": "2026-02-10",
          "whale_buy": 17.93,
          "retail_buy": 27.51,
          "whale_sell": 23.53,
          "retail_sell": 32.78,
          "whale_buyavg": 1659.83,
          "whale_sellavg": 1659.0,
          "retail_buyavg": 1658.71,
          "retail_sellavg": 1658.92,
          "whale_cum_buy": 4571.45,
          "retail_cum_buy": 9013.93,
          "whale_cum_sell": 4513.98,
          "retail_cum_sell": 8983.51,
          "whale_net": -5.6,
          "retail_net": -5.27,
          "whale_cum_net": 57.46,
          "retail_cum_net": 30.42,
          "whale_cum_buy_lot": 20790432,
          "whale_cum_sell_lot": 20704850,
          "retail_cum_buy_lot": 41375367,
          "retail_cum_sell_lot": 40764276,
          "whale_net_lot": 85582,
          "retail_net_lot": 611091
        },
        {
          "day": 68,
          "date": "2026-02-11",
          "date_display": "11/02/2026",
          "date_end": "2026-02-11",
          "whale_buy": 155.26,
          "retail_buy": 387.28,
          "whale_sell": 134.72,
          "retail_sell": 406.77,
          "whale_buyavg": 1827.98,
          "whale_sellavg": 1841.65,
          "retail_buyavg": 1838.49,
          "retail_sellavg": 1832.85,
          "whale_cum_buy": 4726.71,
          "retail_cum_buy": 9401.21,
          "whale_cum_sell": 4648.7,
          "retail_cum_sell": 9390.27,
          "whale_net": 20.54,
          "retail_net": -19.49,
          "whale_cum_net": 78.01,
          "retail_cum_net": 10.93,
          "whale_cum_buy_lot": 21620654,
          "whale_cum_sell_lot": 21414540,
          "retail_cum_buy_lot": 43447887,
          "retail_cum_sell_lot": 42951040,
          "whale_net_lot": 206114,
          "retail_net_lot": 496847
        },
        {
          "day": 69,
          "date": "2026-02-12",
          "date_display": "12/02/2026",
          "date_end": "2026-02-12",
          "whale_buy": 90.09,
          "retail_buy": 317.91,
          "whale_sell": 55.1,
          "retail_sell": 231.22,
          "whale_buyavg": 1902.28,
          "whale_sellavg": 1905.24,
          "retail_buyavg": 1902.6,
          "retail_sellavg": 1901.44,
          "whale_cum_buy": 4816.8,
          "retail_cum_buy": 9719.12,
          "whale_cum_sell": 4703.8,
          "retail_cum_sell": 9621.5,
          "whale_net": 34.99,
          "retail_net": 86.69,
          "whale_cum_net": 113.0,
          "retail_cum_net": 97.62,
          "whale_cum_buy_lot": 22099217,
          "whale_cum_sell_lot": 21939675,
          "retail_cum_buy_lot": 45113353,
          "retail_cum_sell_lot": 44149961,
          "whale_net_lot": 159542,
          "retail_net_lot": 963392
        }
      ],
      "volatilityTrend": {
        "volatilityFactor": 0.1503,
        "trendDirection": "UPTREND",
        "trendStrength": 3.02,
        "minWhaleBuy": 1641.37,
        "maxWhaleBuy": 1902.28,
        "avgWhaleBuy": 1735.79,
        "avgWhaleSell": 1738.36,
        "lastWhaleBuyPrice": 1902.28
      },
      "recommendation": {
        "score": 0.5,
        "signals": [
          "Status whale: Normal",
          "Whale sedang akumulasi kuat",
          "Retail euforia/akumulasi berlebih (tanda top)",
          "Tren harga turun (5 hari terakhir)"
        ],
        "whaleSignal": "bullish",
        "retailSignal": "bearish",
        "retailBullishReason": "",
        "retailBearishReason": "euforia",
        "priceTrend": "down",
        "strength": "weak",
        "recommendation": "HOLD",
        "isWhaleTrapped": false,
        "whaleTrapLevel": "none",
        "isDistributingToRetail": false,
        "lastPrice": 1902.28,
        "avgWhaleBuy": 1787.46,
        "avgRetailBuy": 1818.59
      },
      "priceRecommendation": {
        "buyZone": 1680.0,
        "targetPrice": 1740.0,
        "sellZone": 2000.0,
        "stopLoss": 1630.0,
        "rrRatio": 1.19,
        "displayRR": 1.2,
        "potentialProfit": 3.6,
        "potentialLoss": 3.0,
        "discountPercent": 0.06,
        "isWhaleTrapped": false,
        "isDistributingToRetail": false,
        "whaleTrapLevel": "none",
        "lastPrice": 1902.0,
        "avgWhaleBuy": 1736.0,
        "avgRetailBuy": 1819.0,
        "buyTick": 5,
        "targetTick": 5,
        "sellTick": 5,
        "stopTick": 5,
        "lowestRecentBuy": 1640.0,
        "strongResistance": 1875.0,
        "minWhaleBuyTick": 1640.0,
        "maxWhaleBuyTick": 1905.0
      },
      "confidence": {
        "confidenceScore": 5,
        "confidenceLevel": "RENDAH",
        "confidenceFactors": [
          "Akumulasi Whale kuat",
          "R:RR kurang ideal (1.2:1)",
          "Volatilitas tinggi (risky)"
        ]
      },
      "insights": {
        "whaleInsight": "Whale melakukan <span class=\"highlight\">AKUMULASI</span> sebesar <span class=\"highlight\">Rp 31.5 Miliar</span> dalam 7 hari transaksi. Institusi sedang membeli saham ini.",
        "retailInsight": "Retail melakukan <span class=\"highlight\">AKUMULASI</span> sebesar <span class=\"highlight\">Rp 62.9 Miliar</span> dalam 7 hari transaksi. Puncak akumulasi di hari ke-69 (+97.6 M). Ini menunjukkan minat beli yang kuat dari investor retail.",
        "whalePeak": 113.0,
        "whalePeakDay": 69,
        "retailPeak": 97.62,
        "retailPeakDay": 69
      }
    },
    "INET": {
      "code": "INET",
      "date_start": "2026-02-04",
      "date_end": "2026-02-12",
      "summary": {
        "whale_buy": 273.65999999999997,
        "retail_buy": 750.11,
        "whale_sell": 292.25,
        "retail_sell": 694.7199999999999,
        "whale_net": -18.590000000000032,
        "retail_net": 55.3900000000001,
        "total_buy": 1023.77,
        "total_sell": 986.9699999999999,
        "whale_cum_buy_lot": 0,
        "whale_cum_sell_lot": 0,
        "retail_cum_buy_lot": 0,
        "retail_cum_sell_lot": 0,
        "whale_net_lot": 0,
        "retail_net_lot": 0,
        "whale_buyavg": 364.52,
        "whale_sellavg": 367.94,
        "retail_buyavg": 368.91,
        "retail_sellavg": 367.47
      },
      "brokers": [],
      "daily": [
        {
          "day": 58,
          "date": "2026-02-04",
          "date_display": "04/02/2026",
          "date_end": "2026-02-04",
          "whale_buy": 60.46,
          "retail_buy": 189.94,
          "whale_sell": 72.57,
          "retail_sell": 159.94,
          "whale_buyavg": 376.81,
          "whale_sellavg": 379.86,
          "retail_buyavg": 379.79,
          "retail_sellavg": 378.95,
          "whale_cum_buy": 4535.98,
          "retail_cum_buy": 13022.27,
          "whale_cum_sell": 4399.88,
          "retail_cum_sell": 13137.17,
          "whale_net": -12.11,
          "retail_net": 30.0,
          "whale_cum_net": 136.1,
          "retail_cum_net": -114.9,
          "whale_cum_buy_lot": 88244316,
          "whale_cum_sell_lot": 84436013,
          "retail_cum_buy_lot": 233924826,
          "retail_cum_sell_lot": 238961419,
          "whale_net_lot": 3808303,
          "retail_net_lot": -5036593
        },
        {
          "day": 59,
          "date": "2026-02-05",
          "date_display": "05/02/2026",
          "date_end": "2026-02-05",
          "whale_buy": 26.76,
          "retail_buy": 67.61,
          "whale_sell": 23.75,
          "retail_sell": 70.8,
          "whale_buyavg": 370.57,
          "whale_sellavg": 370.33,
          "retail_buyavg": 370.82,
          "retail_sellavg": 370.8,
          "whale_cum_buy": 4562.74,
          "retail_cum_buy": 13089.88,
          "whale_cum_sell": 4423.63,
          "retail_cum_sell": 13207.98,
          "whale_net": 3.01,
          "retail_net": -3.2,
          "whale_cum_net": 139.11,
          "retail_cum_net": -118.1,
          "whale_cum_buy_lot": 88966802,
          "whale_cum_sell_lot": 85077233,
          "retail_cum_buy_lot": 235749807,
          "retail_cum_sell_lot": 240845642,
          "whale_net_lot": 3889569,
          "retail_net_lot": -5095835
        },
        {
          "day": 60,
          "date": "2026-02-06",
          "date_display": "06/02/2026",
          "date_end": "2026-02-06",
          "whale_buy": 28.33,
          "retail_buy": 34.84,
          "whale_sell": 20.39,
          "retail_sell": 41.57,
          "whale_buyavg": 331.75,
          "whale_sellavg": 331.13,
          "retail_buyavg": 332.14,
          "retail_sellavg": 333.14,
          "whale_cum_buy": 4591.07,
          "retail_cum_buy": 13124.71,
          "whale_cum_sell": 4444.02,
          "retail_cum_sell": 13249.55,
          "whale_net": 7.94,
          "retail_net": -6.73,
          "whale_cum_net": 147.05,
          "retail_cum_net": -124.83,
          "whale_cum_buy_lot": 89902129,
          "whale_cum_sell_lot": 85768813,
          "retail_cum_buy_lot": 236878165,
          "retail_cum_sell_lot": 242220108,
          "whale_net_lot": 4133316,
          "retail_net_lot": -5341943
        },
        {
          "day": 61,
          "date": "2026-02-09",
          "date_display": "09/02/2026",
          "date_end": "2026-02-09",
          "whale_buy": 30.27,
          "retail_buy": 70.49,
          "whale_sell": 26.87,
          "retail_sell": 72.86,
          "whale_buyavg": 326.39,
          "whale_sellavg": 325.73,
          "retail_buyavg": 327.98,
          "retail_sellavg": 328.25,
          "whale_cum_buy": 4621.35,
          "retail_cum_buy": 13195.2,
          "whale_cum_sell": 4470.89,
          "retail_cum_sell": 13322.41,
          "whale_net": 3.4,
          "retail_net": -2.38,
          "whale_cum_net": 150.45,
          "retail_cum_net": -127.21,
          "whale_cum_buy_lot": 90840900,
          "whale_cum_sell_lot": 86602539,
          "retail_cum_buy_lot": 239051518,
          "retail_cum_sell_lot": 244464757,
          "whale_net_lot": 4238361,
          "retail_net_lot": -5413239
        },
        {
          "day": 62,
          "date": "2026-02-10",
          "date_display": "10/02/2026",
          "date_end": "2026-02-10",
          "whale_buy": 24.76,
          "retail_buy": 75.22,
          "whale_sell": 28.02,
          "retail_sell": 67.47,
          "whale_buyavg": 346.04,
          "whale_sellavg": 346.19,
          "retail_buyavg": 346.15,
          "retail_sellavg": 346.29,
          "whale_cum_buy": 4646.1,
          "retail_cum_buy": 13270.42,
          "whale_cum_sell": 4498.92,
          "retail_cum_sell": 13389.88,
          "whale_net": -3.27,
          "retail_net": 7.75,
          "whale_cum_net": 147.19,
          "retail_cum_net": -119.46,
          "whale_cum_buy_lot": 91564553,
          "whale_cum_sell_lot": 87404213,
          "retail_cum_buy_lot": 241188546,
          "retail_cum_sell_lot": 246614871,
          "whale_net_lot": 4160340,
          "retail_net_lot": -5426325
        },
        {
          "day": 63,
          "date": "2026-02-11",
          "date_display": "11/02/2026",
          "date_end": "2026-02-11",
          "whale_buy": 64.72,
          "retail_buy": 178.52,
          "whale_sell": 73.02,
          "retail_sell": 160.45,
          "whale_buyavg": 379.3,
          "whale_sellavg": 378.69,
          "retail_buyavg": 378.85,
          "retail_sellavg": 378.93,
          "whale_cum_buy": 4710.82,
          "retail_cum_buy": 13448.93,
          "whale_cum_sell": 4571.94,
          "retail_cum_sell": 13550.33,
          "whale_net": -8.3,
          "retail_net": 18.07,
          "whale_cum_net": 138.88,
          "retail_cum_net": -101.39,
          "whale_cum_buy_lot": 93177964,
          "whale_cum_sell_lot": 89261109,
          "retail_cum_buy_lot": 245701770,
          "retail_cum_sell_lot": 250761861,
          "whale_net_lot": 3916855,
          "retail_net_lot": -5060091
        },
        {
          "day": 64,
          "date": "2026-02-12",
          "date_display": "12/02/2026",
          "date_end": "2026-02-12",
          "whale_buy": 38.36,
          "retail_buy": 133.49,
          "whale_sell": 47.63,
          "retail_sell": 121.63,
          "whale_buyavg": 382.24,
          "whale_sellavg": 384.46,
          "retail_buyavg": 383.22,
          "retail_sellavg": 382.28,
          "whale_cum_buy": 4749.18,
          "retail_cum_buy": 13582.42,
          "whale_cum_sell": 4619.57,
          "retail_cum_sell": 13671.96,
          "whale_net": -9.27,
          "retail_net": 11.86,
          "whale_cum_net": 129.62,
          "retail_cum_net": -89.54,
          "whale_cum_buy_lot": 94181340,
          "whale_cum_sell_lot": 90497866,
          "retail_cum_buy_lot": 249182346,
          "retail_cum_sell_lot": 253941831,
          "whale_net_lot": 3683474,
          "retail_net_lot": -4759485
        }
      ],
      "volatilityTrend": {
        "volatilityFactor": 0.1556,
        "trendDirection": "SIDEWAYS",
        "trendStrength": 0.34,
        "minWhaleBuy": 326.39,
        "maxWhaleBuy": 382.24,
        "avgWhaleBuy": 359.01,
        "avgWhaleSell": 359.48,
        "lastWhaleBuyPrice": 382.24
      },
      "recommendation": {
        "score": -3.5,
        "signals": [
          "Status whale: Normal",
          "Whale sedang distribusi kuat",
          "Retail euforia/akumulasi berlebih (tanda top)",
          "Tren harga turun (5 hari terakhir)"
        ],
        "whaleSignal": "bearish",
        "retailSignal": "bearish",
        "retailBullishReason": "",
        "retailBearishReason": "euforia",
        "priceTrend": "down",
        "strength": "strong",
        "recommendation": "SELL",
        "isWhaleTrapped": false,
        "whaleTrapLevel": "none",
        "isDistributingToRetail": false,
        "lastPrice": 382.24,
        "avgWhaleBuy": 364.52,
        "avgRetailBuy": 368.91
      },
      "priceRecommendation": {
        "buyZone": 342.0,
        "targetPrice": 360.0,
        "sellZone": 402.0,
        "stopLoss": 332.0,
        "rrRatio": 1.75,
        "displayRR": 1.8,
        "potentialProfit": 5.3,
        "potentialLoss": 3.0,
        "discountPercent": 0.06,
        "isWhaleTrapped": false,
        "isDistributingToRetail": false,
        "whaleTrapLevel": "none",
        "lastPrice": 382.0,
        "avgWhaleBuy": 359.0,
        "avgRetailBuy": 369.0,
        "buyTick": 2,
        "targetTick": 2,
        "sellTick": 2,
        "stopTick": 2,
        "lowestRecentBuy": 326.0,
        "strongResistance": 380.0,
        "minWhaleBuyTick": 326.0,
        "maxWhaleBuyTick": 384.0
      },
      "confidence": {
        "confidenceScore": 5,
        "confidenceLevel": "RENDAH",
        "confidenceFactors": [
          "Market sideways, waspada",
          "R:RR moderat (1.8:1)",
          "Volatilitas tinggi (risky)"
        ]
      },
      "insights": {
        "whaleInsight": "Whale melakukan <span class=\"highlight\">DISTRIBUSI</span> sebesar <span class=\"highlight\">Rp 18.6 Miliar</span> dalam 7 hari transaksi. Puncak akumulasi tercapai di hari ke-61 (+150.4 M), setelah itu mulai distribusi bertahap. Ini mengindikasikan <span class=\"highlight\">take profit</span> oleh institusi besar.",
        "retailInsight": "Retail melakukan <span class=\"highlight\">AKUMULASI</span> sebesar <span class=\"highlight\">Rp 55.4 Miliar</span> dalam 7 hari transaksi. Puncak akumulasi di hari ke-64 (+-89.5 M). Ini menunjukkan minat beli yang kuat dari investor retail.",
        "whalePeak": 150.45,
        "whalePeakDay": 61,
        "retailPeak": -89.54,
        "retailPeakDay": 64
      }
    }
  }
}