{
  "generated_at": "2026-02-13 17:05:56",
  "period": "6 Bulan",
  "days": 180,
  "stocks": {
    "ANTM": {
      "code": "ANTM",
      "date_start": "2025-09-01",
      "date_end": "2026-02-12",
      "summary": {
        "whale_buy": 24123.210000000006,
        "retail_buy": 30476.950000000008,
        "whale_sell": 23592.48999999999,
        "retail_sell": 30873.699999999993,
        "whale_net": 530.7200000000157,
        "retail_net": -396.74999999998545,
        "total_buy": 54600.16000000002,
        "total_sell": 54466.18999999999,
        "whale_cum_buy_lot": 0,
        "whale_cum_sell_lot": 0,
        "retail_cum_buy_lot": 0,
        "retail_cum_sell_lot": 0,
        "whale_net_lot": 0,
        "retail_net_lot": 0,
        "whale_buyavg": 3590.76,
        "whale_sellavg": 3609.52,
        "retail_buyavg": 3583.93,
        "retail_sellavg": 3559.94
      },
      "brokers": [],
      "daily": [
        {
          "day": 1,
          "date": "2025-09-01",
          "date_display": "01/09/2025",
          "date_end": "2025-09-01",
          "whale_buy": 808.56,
          "retail_buy": 922.98,
          "whale_sell": 755.62,
          "retail_sell": 975.64,
          "whale_buyavg": 3183.28,
          "whale_sellavg": 3173.72,
          "retail_buyavg": 3164.39,
          "retail_sellavg": 3172.77,
          "whale_cum_buy": 808.56,
          "retail_cum_buy": 922.98,
          "whale_cum_sell": 755.62,
          "retail_cum_sell": 975.64,
          "whale_net": 52.94,
          "retail_net": -52.66,
          "whale_cum_net": 52.94,
          "retail_cum_net": -52.66,
          "whale_cum_buy_lot": 2540006,
          "whale_cum_sell_lot": 2380849,
          "retail_cum_buy_lot": 2916766,
          "retail_cum_sell_lot": 3075043,
          "whale_net_lot": 159157,
          "retail_net_lot": -158277
        },
        {
          "day": 2,
          "date": "2025-09-02",
          "date_display": "02/09/2025",
          "date_end": "2025-09-02",
          "whale_buy": 493.06,
          "retail_buy": 607.15,
          "whale_sell": 551.8,
          "retail_sell": 548.18,
          "whale_buyavg": 3404.19,
          "whale_sellavg": 3400.93,
          "retail_buyavg": 3392.73,
          "retail_sellavg": 3401.21,
          "whale_cum_buy": 1301.62,
          "retail_cum_buy": 1530.13,
          "whale_cum_sell": 1307.42,
          "retail_cum_sell": 1523.82,
          "whale_net": -58.74,
          "retail_net": 58.98,
          "whale_cum_net": -5.8,
          "retail_cum_net": 6.32,
          "whale_cum_buy_lot": 3923222,
          "whale_cum_sell_lot": 4028772,
          "retail_cum_buy_lot": 4705310,
          "retail_cum_sell_lot": 4704873,
          "whale_net_lot": -105550,
          "retail_net_lot": 437
        },
        {
          "day": 3,
          "date": "2025-09-03",
          "date_display": "03/09/2025",
          "date_end": "2025-09-03",
          "whale_buy": 437.74,
          "retail_buy": 363.89,
          "whale_sell": 206.52,
          "retail_sell": 405.02,
          "whale_buyavg": 3449.46,
          "whale_sellavg": 3454.22,
          "retail_buyavg": 3457.09,
          "retail_sellavg": 3465.73,
          "whale_cum_buy": 1739.36,
          "retail_cum_buy": 1894.02,
          "whale_cum_sell": 1513.94,
          "retail_cum_sell": 1928.83,
          "whale_net": 231.22,
          "retail_net": -41.13,
          "whale_cum_net": 225.42,
          "retail_cum_net": -34.82,
          "whale_cum_buy_lot": 5185950,
          "whale_cum_sell_lot": 4608007,
          "retail_cum_buy_lot": 5724160,
          "retail_cum_sell_lot": 5854512,
          "whale_net_lot": 577943,
          "retail_net_lot": -130352
        },
        {
          "day": 4,
          "date": "2025-09-04",
          "date_display": "04/09/2025",
          "date_end": "2025-09-04",
          "whale_buy": 221.63,
          "retail_buy": 176.94,
          "whale_sell": 192.32,
          "retail_sell": 210.59,
          "whale_buyavg": 3412.53,
          "whale_sellavg": 3411.45,
          "retail_buyavg": 3410.95,
          "retail_sellavg": 3414.9,
          "whale_cum_buy": 1960.99,
          "retail_cum_buy": 2070.96,
          "whale_cum_sell": 1706.26,
          "retail_cum_sell": 2139.43,
          "whale_net": 29.31,
          "retail_net": -33.65,
          "whale_cum_net": 254.73,
          "retail_cum_net": -68.46,
          "whale_cum_buy_lot": 5836790,
          "whale_cum_sell_lot": 5174612,
          "retail_cum_buy_lot": 6243925,
          "retail_cum_sell_lot": 6471451,
          "whale_net_lot": 662178,
          "retail_net_lot": -227526
        },
        {
          "day": 5,
          "date": "2025-09-08",
          "date_display": "08/09/2025",
          "date_end": "2025-09-08",
          "whale_buy": 479.89,
          "retail_buy": 571.34,
          "whale_sell": 461.62,
          "retail_sell": 534.5,
          "whale_buyavg": 3581.36,
          "whale_sellavg": 3595.5,
          "retail_buyavg": 3602.35,
          "retail_sellavg": 3585.2,
          "whale_cum_buy": 2440.88,
          "retail_cum_buy": 2642.3,
          "whale_cum_sell": 2167.88,
          "retail_cum_sell": 2673.92,
          "whale_net": 18.28,
          "retail_net": 36.84,
          "whale_cum_net": 273.01,
          "retail_cum_net": -31.62,
          "whale_cum_buy_lot": 7145431,
          "whale_cum_sell_lot": 6422114,
          "retail_cum_buy_lot": 7805772,
          "retail_cum_sell_lot": 7933209,
          "whale_net_lot": 723317,
          "retail_net_lot": -127437
        },
        {
          "day": 6,
          "date": "2025-09-09",
          "date_display": "09/09/2025",
          "date_end": "2025-09-09",
          "whale_buy": 423.64,
          "retail_buy": 428.31,
          "whale_sell": 634.96,
          "retail_sell": 519.18,
          "whale_buyavg": 3752.46,
          "whale_sellavg": 3768.66,
          "retail_buyavg": 3754.11,
          "retail_sellavg": 3758.26,
          "whale_cum_buy": 2864.52,
          "retail_cum_buy": 3070.61,
          "whale_cum_sell": 2802.83,
          "retail_cum_sell": 3193.1,
          "whale_net": -211.32,
          "retail_net": -90.87,
          "whale_cum_net": 61.68,
          "retail_cum_net": -122.5,
          "whale_cum_buy_lot": 8217971,
          "whale_cum_sell_lot": 8076299,
          "retail_cum_buy_lot": 8863065,
          "retail_cum_sell_lot": 9311531,
          "whale_net_lot": 141672,
          "retail_net_lot": -448466
        },
        {
          "day": 7,
          "date": "2025-09-10",
          "date_display": "10/09/2025",
          "date_end": "2025-09-10",
          "whale_buy": 241.01,
          "retail_buy": 388.51,
          "whale_sell": 241.95,
          "retail_sell": 381.69,
          "whale_buyavg": 3531.89,
          "whale_sellavg": 3534.19,
          "retail_buyavg": 3533.64,
          "retail_sellavg": 3532.41,
          "whale_cum_buy": 3105.53,
          "retail_cum_buy": 3459.11,
          "whale_cum_sell": 3044.79,
          "retail_cum_sell": 3574.79,
          "whale_net": -0.94,
          "retail_net": 6.82,
          "whale_cum_net": 60.74,
          "retail_cum_net": -115.68,
          "whale_cum_buy_lot": 8900347,
          "whale_cum_sell_lot": 8764027,
          "retail_cum_buy_lot": 9971160,
          "retail_cum_sell_lot": 10400376,
          "whale_net_lot": 136320,
          "retail_net_lot": -429216
        },
        {
          "day": 8,
          "date": "2025-09-11",
          "date_display": "11/09/2025",
          "date_end": "2025-09-11",
          "whale_buy": 150.52,
          "retail_buy": 246.27,
          "whale_sell": 178.39,
          "retail_sell": 264.2,
          "whale_buyavg": 3517.89,
          "whale_sellavg": 3460.78,
          "retail_buyavg": 3435.09,
          "retail_sellavg": 3440.12,
          "whale_cum_buy": 3256.05,
          "retail_cum_buy": 3705.38,
          "whale_cum_sell": 3223.17,
          "retail_cum_sell": 3838.99,
          "whale_net": -27.87,
          "retail_net": -17.93,
          "whale_cum_net": 32.87,
          "retail_cum_net": -133.61,
          "whale_cum_buy_lot": 9332763,
          "whale_cum_sell_lot": 9279002,
          "retail_cum_buy_lot": 10578990,
          "retail_cum_sell_lot": 11115172,
          "whale_net_lot": 53761,
          "retail_net_lot": -536182
        },
        {
          "day": 9,
          "date": "2025-09-12",
          "date_display": "12/09/2025",
          "date_end": "2025-09-12",
          "whale_buy": 128.39,
          "retail_buy": 199.49,
          "whale_sell": 178.42,
          "retail_sell": 178.85,
          "whale_buyavg": 3460.4,
          "whale_sellavg": 3464.01,
          "retail_buyavg": 3462.38,
          "retail_sellavg": 3460.12,
          "whale_cum_buy": 3384.44,
          "retail_cum_buy": 3904.88,
          "whale_cum_sell": 3401.59,
          "retail_cum_sell": 4017.84,
          "whale_net": -50.03,
          "retail_net": 20.64,
          "whale_cum_net": -17.16,
          "retail_cum_net": -112.97,
          "whale_cum_buy_lot": 9702065,
          "whale_cum_sell_lot": 9693718,
          "retail_cum_buy_lot": 11154268,
          "retail_cum_sell_lot": 11630000,
          "whale_net_lot": 8347,
          "retail_net_lot": -475732
        },
        {
          "day": 10,
          "date": "2025-09-15",
          "date_display": "15/09/2025",
          "date_end": "2025-09-15",
          "whale_buy": 135.91,
          "retail_buy": 149.52,
          "whale_sell": 138.82,
          "retail_sell": 134.74,
          "whale_buyavg": 3485.01,
          "whale_sellavg": 3484.03,
          "retail_buyavg": 3482.34,
          "retail_sellavg": 3482.54,
          "whale_cum_buy": 3520.35,
          "retail_cum_buy": 4054.39,
          "whale_cum_sell": 3540.41,
          "retail_cum_sell": 4152.58,
          "whale_net": -2.9,
          "retail_net": 14.78,
          "whale_cum_net": -20.06,
          "retail_cum_net": -98.19,
          "whale_cum_buy_lot": 10090981,
          "whale_cum_sell_lot": 10091250,
          "retail_cum_buy_lot": 11583054,
          "retail_cum_sell_lot": 12016107,
          "whale_net_lot": -269,
          "retail_net_lot": -433053
        },
        {
          "day": 11,
          "date": "2025-09-16",
          "date_display": "16/09/2025",
          "date_end": "2025-09-16",
          "whale_buy": 83.6,
          "retail_buy": 147.79,
          "whale_sell": 97.08,
          "retail_sell": 176.76,
          "whale_buyavg": 3553.11,
          "whale_sellavg": 3559.35,
          "retail_buyavg": 3555.18,
          "retail_sellavg": 3553.56,
          "whale_cum_buy": 3603.95,
          "retail_cum_buy": 4202.19,
          "whale_cum_sell": 3637.49,
          "retail_cum_sell": 4329.34,
          "whale_net": -13.48,
          "retail_net": -28.97,
          "whale_cum_net": -33.54,
          "retail_cum_net": -127.16,
          "whale_cum_buy_lot": 10318877,
          "whale_cum_sell_lot": 10358289,
          "retail_cum_buy_lot": 11989363,
          "retail_cum_sell_lot": 12505077,
          "whale_net_lot": -39412,
          "retail_net_lot": -515714
        },
        {
          "day": 12,
          "date": "2025-09-17",
          "date_display": "17/09/2025",
          "date_end": "2025-09-17",
          "whale_buy": 73.44,
          "retail_buy": 129.47,
          "whale_sell": 93.53,
          "retail_sell": 271.76,
          "whale_buyavg": 3498.78,
          "whale_sellavg": 3501.92,
          "retail_buyavg": 3499.77,
          "retail_sellavg": 3504.55,
          "whale_cum_buy": 3677.4,
          "retail_cum_buy": 4331.65,
          "whale_cum_sell": 3731.02,
          "retail_cum_sell": 4601.1,
          "whale_net": -20.09,
          "retail_net": -142.29,
          "whale_cum_net": -53.63,
          "retail_cum_net": -269.45,
          "whale_cum_buy_lot": 10532124,
          "whale_cum_sell_lot": 10629175,
          "retail_cum_buy_lot": 12365809,
          "retail_cum_sell_lot": 13201417,
          "whale_net_lot": -97051,
          "retail_net_lot": -835608
        },
        {
          "day": 13,
          "date": "2025-09-18",
          "date_display": "18/09/2025",
          "date_end": "2025-09-18",
          "whale_buy": 254.33,
          "retail_buy": 118.21,
          "whale_sell": 174.27,
          "retail_sell": 155.16,
          "whale_buyavg": 3437.53,
          "whale_sellavg": 3435.32,
          "retail_buyavg": 3437.98,
          "retail_sellavg": 3439.64,
          "whale_cum_buy": 3931.73,
          "retail_cum_buy": 4449.87,
          "whale_cum_sell": 3905.29,
          "retail_cum_sell": 4756.26,
          "whale_net": 80.06,
          "retail_net": -36.95,
          "whale_cum_net": 26.44,
          "retail_cum_net": -306.39,
          "whale_cum_buy_lot": 11273087,
          "whale_cum_sell_lot": 11138455,
          "retail_cum_buy_lot": 12709868,
          "retail_cum_sell_lot": 13654504,
          "whale_net_lot": 134632,
          "retail_net_lot": -944636
        },
        {
          "day": 14,
          "date": "2025-09-19",
          "date_display": "19/09/2025",
          "date_end": "2025-09-19",
          "whale_buy": 236.99,
          "retail_buy": 197.2,
          "whale_sell": 110.32,
          "retail_sell": 184.79,
          "whale_buyavg": 3503.69,
          "whale_sellavg": 3492.67,
          "retail_buyavg": 3495.66,
          "retail_sellavg": 3504.32,
          "whale_cum_buy": 4168.72,
          "retail_cum_buy": 4647.06,
          "whale_cum_sell": 4015.62,
          "retail_cum_sell": 4941.05,
          "whale_net": 126.66,
          "retail_net": 12.41,
          "whale_cum_net": 153.1,
          "retail_cum_net": -293.98,
          "whale_cum_buy_lot": 11946321,
          "whale_cum_sell_lot": 11446399,
          "retail_cum_buy_lot": 13269545,
          "retail_cum_sell_lot": 14174873,
          "whale_net_lot": 499922,
          "retail_net_lot": -905328
        },
        {
          "day": 15,
          "date": "2025-09-22",
          "date_display": "22/09/2025",
          "date_end": "2025-09-22",
          "whale_buy": 180.33,
          "retail_buy": 174.73,
          "whale_sell": 109.57,
          "retail_sell": 188.44,
          "whale_buyavg": 3541.71,
          "whale_sellavg": 3543.07,
          "retail_buyavg": 3542.11,
          "retail_sellavg": 3542.72,
          "whale_cum_buy": 4349.05,
          "retail_cum_buy": 4821.8,
          "whale_cum_sell": 4125.18,
          "retail_cum_sell": 5129.48,
          "whale_net": 70.76,
          "retail_net": -13.7,
          "whale_cum_net": 223.86,
          "retail_cum_net": -307.69,
          "whale_cum_buy_lot": 12453803,
          "whale_cum_sell_lot": 11751305,
          "retail_cum_buy_lot": 13761078,
          "retail_cum_sell_lot": 14705707,
          "whale_net_lot": 702498,
          "retail_net_lot": -944629
        },
        {
          "day": 16,
          "date": "2025-09-23",
          "date_display": "23/09/2025",
          "date_end": "2025-09-23",
          "whale_buy": 160.62,
          "retail_buy": 315.28,
          "whale_sell": 210.9,
          "retail_sell": 339.68,
          "whale_buyavg": 3672.98,
          "whale_sellavg": 3671.37,
          "retail_buyavg": 3666.48,
          "retail_sellavg": 3666.42,
          "whale_cum_buy": 4509.67,
          "retail_cum_buy": 5137.08,
          "whale_cum_sell": 4336.08,
          "retail_cum_sell": 5469.16,
          "whale_net": -50.27,
          "retail_net": -24.4,
          "whale_cum_net": 173.59,
          "retail_cum_net": -332.08,
          "whale_cum_buy_lot": 13081189,
          "whale_cum_sell_lot": 12321942,
          "retail_cum_buy_lot": 14602065,
          "retail_cum_sell_lot": 15613883,
          "whale_net_lot": 759247,
          "retail_net_lot": -1011818
        },
        {
          "day": 17,
          "date": "2025-09-24",
          "date_display": "24/09/2025",
          "date_end": "2025-09-24",
          "whale_buy": 140.93,
          "retail_buy": 342.69,
          "whale_sell": 99.12,
          "retail_sell": 220.94,
          "whale_buyavg": 3518.45,
          "whale_sellavg": 3525.7,
          "retail_buyavg": 3526.4,
          "retail_sellavg": 3529.9,
          "whale_cum_buy": 4650.61,
          "retail_cum_buy": 5479.76,
          "whale_cum_sell": 4435.2,
          "retail_cum_sell": 5690.1,
          "whale_net": 41.81,
          "retail_net": 121.74,
          "whale_cum_net": 215.41,
          "retail_cum_net": -210.34,
          "whale_cum_buy_lot": 13445045,
          "whale_cum_sell_lot": 12617541,
          "retail_cum_buy_lot": 15580183,
          "retail_cum_sell_lot": 16259511,
          "whale_net_lot": 827504,
          "retail_net_lot": -679328
        },
        {
          "day": 18,
          "date": "2025-09-25",
          "date_display": "25/09/2025",
          "date_end": "2025-09-25",
          "whale_buy": 301.73,
          "retail_buy": 452.07,
          "whale_sell": 301.44,
          "retail_sell": 452.58,
          "whale_buyavg": 3244.6,
          "whale_sellavg": 3238.68,
          "retail_buyavg": 3241.59,
          "retail_sellavg": 3241.93,
          "whale_cum_buy": 4952.34,
          "retail_cum_buy": 5931.84,
          "whale_cum_sell": 4736.64,
          "retail_cum_sell": 6142.68,
          "whale_net": 0.29,
          "retail_net": -0.5,
          "whale_cum_net": 215.7,
          "retail_cum_net": -210.84,
          "whale_cum_buy_lot": 14362854,
          "whale_cum_sell_lot": 13588555,
          "retail_cum_buy_lot": 17048327,
          "retail_cum_sell_lot": 17745978,
          "whale_net_lot": 774299,
          "retail_net_lot": -697651
        },
        {
          "day": 19,
          "date": "2025-09-26",
          "date_display": "26/09/2025",
          "date_end": "2025-09-26",
          "whale_buy": 150.04,
          "retail_buy": 235.51,
          "whale_sell": 139.43,
          "retail_sell": 287.39,
          "whale_buyavg": 3180.22,
          "whale_sellavg": 3180.69,
          "retail_buyavg": 3181.92,
          "retail_sellavg": 3182.44,
          "whale_cum_buy": 5102.38,
          "retail_cum_buy": 6167.34,
          "whale_cum_sell": 4876.07,
          "retail_cum_sell": 6430.07,
          "whale_net": 10.61,
          "retail_net": -51.88,
          "whale_cum_net": 226.31,
          "retail_cum_net": -262.73,
          "whale_cum_buy_lot": 14838216,
          "whale_cum_sell_lot": 14034420,
          "retail_cum_buy_lot": 17789767,
          "retail_cum_sell_lot": 18649183,
          "whale_net_lot": 803796,
          "retail_net_lot": -859416
        },
        {
          "day": 20,
          "date": "2025-09-29",
          "date_display": "29/09/2025",
          "date_end": "2025-09-29",
          "whale_buy": 151.58,
          "retail_buy": 229.95,
          "whale_sell": 150.81,
          "retail_sell": 222.34,
          "whale_buyavg": 3280.24,
          "whale_sellavg": 3279.17,
          "retail_buyavg": 3278.41,
          "retail_sellavg": 3277.32,
          "whale_cum_buy": 5253.96,
          "retail_cum_buy": 6397.3,
          "whale_cum_sell": 5026.88,
          "retail_cum_sell": 6652.41,
          "whale_net": 0.77,
          "retail_net": 7.62,
          "whale_cum_net": 227.08,
          "retail_cum_net": -255.11,
          "whale_cum_buy_lot": 15332278,
          "whale_cum_sell_lot": 14492781,
          "retail_cum_buy_lot": 18491585,
          "retail_cum_sell_lot": 19318676,
          "whale_net_lot": 839497,
          "retail_net_lot": -827091
        },
        {
          "day": 21,
          "date": "2025-09-30",
          "date_display": "30/09/2025",
          "date_end": "2025-09-30",
          "whale_buy": 185.85,
          "retail_buy": 189.28,
          "whale_sell": 224.34,
          "retail_sell": 129.91,
          "whale_buyavg": 3243.61,
          "whale_sellavg": 3227.56,
          "retail_buyavg": 3246.19,
          "retail_sellavg": 3259.2,
          "whale_cum_buy": 5439.8,
          "retail_cum_buy": 6586.57,
          "whale_cum_sell": 5251.22,
          "retail_cum_sell": 6782.32,
          "whale_net": -38.49,
          "retail_net": 59.37,
          "whale_cum_net": 188.59,
          "retail_cum_net": -195.75,
          "whale_cum_buy_lot": 15910692,
          "whale_cum_sell_lot": 15192910,
          "retail_cum_buy_lot": 19022927,
          "retail_cum_sell_lot": 19721017,
          "whale_net_lot": 717782,
          "retail_net_lot": -698090
        },
        {
          "day": 22,
          "date": "2025-10-01",
          "date_display": "01/10/2025",
          "date_end": "2025-10-01",
          "whale_buy": 174.69,
          "retail_buy": 167.79,
          "whale_sell": 228.51,
          "retail_sell": 153.04,
          "whale_buyavg": 3197.18,
          "whale_sellavg": 3196.68,
          "retail_buyavg": 3195.84,
          "retail_sellavg": 3196.49,
          "whale_cum_buy": 5614.49,
          "retail_cum_buy": 6754.36,
          "whale_cum_sell": 5479.72,
          "retail_cum_sell": 6935.36,
          "whale_net": -53.82,
          "retail_net": 14.74,
          "whale_cum_net": 134.76,
          "retail_cum_net": -181.0,
          "whale_cum_buy_lot": 16457537,
          "whale_cum_sell_lot": 15908208,
          "retail_cum_buy_lot": 19548545,
          "retail_cum_sell_lot": 20200757,
          "whale_net_lot": 549329,
          "retail_net_lot": -652212
        },
        {
          "day": 23,
          "date": "2025-10-02",
          "date_display": "02/10/2025",
          "date_end": "2025-10-02",
          "whale_buy": 100.0,
          "retail_buy": 113.38,
          "whale_sell": 149.92,
          "retail_sell": 166.59,
          "whale_buyavg": 3146.09,
          "whale_sellavg": 3145.01,
          "retail_buyavg": 3141.72,
          "retail_sellavg": 3143.19,
          "whale_cum_buy": 5714.49,
          "retail_cum_buy": 6867.74,
          "whale_cum_sell": 5629.64,
          "retail_cum_sell": 7101.95,
          "whale_net": -49.92,
          "retail_net": -53.21,
          "whale_cum_net": 84.85,
          "retail_cum_net": -234.22,
          "whale_cum_buy_lot": 16653860,
          "whale_cum_sell_lot": 16386316,
          "retail_cum_buy_lot": 19915541,
          "retail_cum_sell_lot": 20734784,
          "whale_net_lot": 267544,
          "retail_net_lot": -819243
        },
        {
          "day": 24,
          "date": "2025-10-03",
          "date_display": "03/10/2025",
          "date_end": "2025-10-03",
          "whale_buy": 134.22,
          "retail_buy": 139.8,
          "whale_sell": 106.58,
          "retail_sell": 149.45,
          "whale_buyavg": 3180.32,
          "whale_sellavg": 3181.9,
          "retail_buyavg": 3180.31,
          "retail_sellavg": 3180.21,
          "whale_cum_buy": 5848.71,
          "retail_cum_buy": 7007.53,
          "whale_cum_sell": 5736.23,
          "retail_cum_sell": 7251.41,
          "whale_net": 27.63,
          "retail_net": -9.66,
          "whale_cum_net": 112.48,
          "retail_cum_net": -243.87,
          "whale_cum_buy_lot": 17074647,
          "whale_cum_sell_lot": 16719301,
          "retail_cum_buy_lot": 20354474,
          "retail_cum_sell_lot": 21208918,
          "whale_net_lot": 355346,
          "retail_net_lot": -854444
        },
        {
          "day": 25,
          "date": "2025-10-06",
          "date_display": "06/10/2025",
          "date_end": "2025-10-06",
          "whale_buy": 56.62,
          "retail_buy": 176.94,
          "whale_sell": 41.33,
          "retail_sell": 180.94,
          "whale_buyavg": 3219.14,
          "whale_sellavg": 3222.1,
          "retail_buyavg": 3215.15,
          "retail_sellavg": 3214.6,
          "whale_cum_buy": 5905.33,
          "retail_cum_buy": 7184.47,
          "whale_cum_sell": 5777.56,
          "retail_cum_sell": 7432.34,
          "whale_net": 15.29,
          "retail_net": -4.0,
          "whale_cum_net": 127.77,
          "retail_cum_net": -247.87,
          "whale_cum_buy_lot": 17249522,
          "whale_cum_sell_lot": 16846186,
          "retail_cum_buy_lot": 20900554,
          "retail_cum_sell_lot": 21768339,
          "whale_net_lot": 403336,
          "retail_net_lot": -867785
        },
        {
          "day": 26,
          "date": "2025-10-07",
          "date_display": "07/10/2025",
          "date_end": "2025-10-07",
          "whale_buy": 66.74,
          "retail_buy": 195.57,
          "whale_sell": 83.9,
          "retail_sell": 168.27,
          "whale_buyavg": 3186.73,
          "whale_sellavg": 3190.67,
          "retail_buyavg": 3186.15,
          "retail_sellavg": 3185.3,
          "whale_cum_buy": 5972.08,
          "retail_cum_buy": 7380.04,
          "whale_cum_sell": 5861.47,
          "retail_cum_sell": 7600.61,
          "whale_net": -17.16,
          "retail_net": 27.3,
          "whale_cum_net": 110.61,
          "retail_cum_net": -220.57,
          "whale_cum_buy_lot": 17461015,
          "whale_cum_sell_lot": 17111105,
          "retail_cum_buy_lot": 21514333,
          "retail_cum_sell_lot": 22298023,
          "whale_net_lot": 349910,
          "retail_net_lot": -783690
        },
        {
          "day": 27,
          "date": "2025-10-08",
          "date_display": "08/10/2025",
          "date_end": "2025-10-08",
          "whale_buy": 200.19,
          "retail_buy": 455.15,
          "whale_sell": 212.73,
          "retail_sell": 467.36,
          "whale_buyavg": 3273.58,
          "whale_sellavg": 3280.29,
          "retail_buyavg": 3285.55,
          "retail_sellavg": 3279.21,
          "whale_cum_buy": 6172.27,
          "retail_cum_buy": 7835.19,
          "whale_cum_sell": 6074.2,
          "retail_cum_sell": 8067.97,
          "whale_net": -12.54,
          "retail_net": -12.21,
          "whale_cum_net": 98.08,
          "retail_cum_net": -232.78,
          "whale_cum_buy_lot": 18061307,
          "whale_cum_sell_lot": 17746666,
          "retail_cum_buy_lot": 22881344,
          "retail_cum_sell_lot": 23707188,
          "whale_net_lot": 314641,
          "retail_net_lot": -825844
        },
        {
          "day": 28,
          "date": "2025-10-09",
          "date_display": "09/10/2025",
          "date_end": "2025-10-09",
          "whale_buy": 188.47,
          "retail_buy": 302.1,
          "whale_sell": 126.21,
          "retail_sell": 226.69,
          "whale_buyavg": 3258.62,
          "whale_sellavg": 3257.64,
          "retail_buyavg": 3262.76,
          "retail_sellavg": 3264.36,
          "whale_cum_buy": 6360.74,
          "retail_cum_buy": 8137.29,
          "whale_cum_sell": 6200.4,
          "retail_cum_sell": 8294.66,
          "whale_net": 62.27,
          "retail_net": 75.41,
          "whale_cum_net": 160.34,
          "retail_cum_net": -157.37,
          "whale_cum_buy_lot": 18640089,
          "whale_cum_sell_lot": 18136741,
          "retail_cum_buy_lot": 23801293,
          "retail_cum_sell_lot": 24403225,
          "whale_net_lot": 503348,
          "retail_net_lot": -601932
        },
        {
          "day": 29,
          "date": "2025-10-10",
          "date_display": "10/10/2025",
          "date_end": "2025-10-10",
          "whale_buy": 152.97,
          "retail_buy": 172.24,
          "whale_sell": 169.37,
          "retail_sell": 182.98,
          "whale_buyavg": 3286.69,
          "whale_sellavg": 3288.3,
          "retail_buyavg": 3291.14,
          "retail_sellavg": 3289.19,
          "whale_cum_buy": 6513.71,
          "retail_cum_buy": 8309.53,
          "whale_cum_sell": 6369.78,
          "retail_cum_sell": 8477.64,
          "whale_net": -16.41,
          "retail_net": -10.74,
          "whale_cum_net": 143.93,
          "retail_cum_net": -168.1,
          "whale_cum_buy_lot": 19104636,
          "whale_cum_sell_lot": 18651501,
          "retail_cum_buy_lot": 24323122,
          "retail_cum_sell_lot": 24958159,
          "whale_net_lot": 453135,
          "retail_net_lot": -635037
        },
        {
          "day": 30,
          "date": "2025-10-13",
          "date_display": "13/10/2025",
          "date_end": "2025-10-13",
          "whale_buy": 191.8,
          "retail_buy": 280.36,
          "whale_sell": 149.39,
          "retail_sell": 317.57,
          "whale_buyavg": 3371.48,
          "whale_sellavg": 3370.25,
          "retail_buyavg": 3369.88,
          "retail_sellavg": 3368.45,
          "whale_cum_buy": 6705.51,
          "retail_cum_buy": 8589.9,
          "whale_cum_sell": 6519.17,
          "retail_cum_sell": 8795.21,
          "whale_net": 42.41,
          "retail_net": -37.21,
          "whale_cum_net": 186.34,
          "retail_cum_net": -205.31,
          "whale_cum_buy_lot": 19667263,
          "whale_cum_sell_lot": 19085740,
          "retail_cum_buy_lot": 25155815,
          "retail_cum_sell_lot": 25894628,
          "whale_net_lot": 581523,
          "retail_net_lot": -738813
        },
        {
          "day": 31,
          "date": "2025-10-14",
          "date_display": "14/10/2025",
          "date_end": "2025-10-14",
          "whale_buy": 220.11,
          "retail_buy": 330.56,
          "whale_sell": 238.3,
          "retail_sell": 391.87,
          "whale_buyavg": 3402.86,
          "whale_sellavg": 3393.8,
          "retail_buyavg": 3394.74,
          "retail_sellavg": 3399.16,
          "whale_cum_buy": 6925.62,
          "retail_cum_buy": 8920.45,
          "whale_cum_sell": 6757.46,
          "retail_cum_sell": 9187.08,
          "whale_net": -18.19,
          "retail_net": -61.32,
          "whale_cum_net": 168.15,
          "retail_cum_net": -266.63,
          "whale_cum_buy_lot": 20310769,
          "whale_cum_sell_lot": 19784210,
          "retail_cum_buy_lot": 26120039,
          "retail_cum_sell_lot": 27038887,
          "whale_net_lot": 526559,
          "retail_net_lot": -918848
        },
        {
          "day": 32,
          "date": "2025-10-15",
          "date_display": "15/10/2025",
          "date_end": "2025-10-15",
          "whale_buy": 168.71,
          "retail_buy": 333.07,
          "whale_sell": 243.39,
          "retail_sell": 374.19,
          "whale_buyavg": 3389.43,
          "whale_sellavg": 3384.06,
          "retail_buyavg": 3386.04,
          "retail_sellavg": 3393.64,
          "whale_cum_buy": 7094.33,
          "retail_cum_buy": 9253.52,
          "whale_cum_sell": 7000.86,
          "retail_cum_sell": 9561.27,
          "whale_net": -74.69,
          "retail_net": -41.12,
          "whale_cum_net": 93.47,
          "retail_cum_net": -307.75,
          "whale_cum_buy_lot": 20807292,
          "whale_cum_sell_lot": 20505391,
          "retail_cum_buy_lot": 27103756,
          "retail_cum_sell_lot": 28141560,
          "whale_net_lot": 301901,
          "retail_net_lot": -1037804
        },
        {
          "day": 33,
          "date": "2025-10-16",
          "date_display": "16/10/2025",
          "date_end": "2025-10-16",
          "whale_buy": 291.6,
          "retail_buy": 182.18,
          "whale_sell": 267.34,
          "retail_sell": 155.09,
          "whale_buyavg": 3467.08,
          "whale_sellavg": 3466.67,
          "retail_buyavg": 3458.68,
          "retail_sellavg": 3468.07,
          "whale_cum_buy": 7385.93,
          "retail_cum_buy": 9435.7,
          "whale_cum_sell": 7268.2,
          "retail_cum_sell": 9716.36,
          "whale_net": 24.26,
          "retail_net": 27.09,
          "whale_cum_net": 117.73,
          "retail_cum_net": -280.66,
          "whale_cum_buy_lot": 21641558,
          "whale_cum_sell_lot": 21269983,
          "retail_cum_buy_lot": 27651228,
          "retail_cum_sell_lot": 28567941,
          "whale_net_lot": 371575,
          "retail_net_lot": -916713
        },
        {
          "day": 34,
          "date": "2025-10-17",
          "date_display": "17/10/2025",
          "date_end": "2025-10-17",
          "whale_buy": 201.51,
          "retail_buy": 203.44,
          "whale_sell": 293.66,
          "retail_sell": 341.11,
          "whale_buyavg": 3467.59,
          "whale_sellavg": 3464.48,
          "retail_buyavg": 3464.67,
          "retail_sellavg": 3467.94,
          "whale_cum_buy": 7587.44,
          "retail_cum_buy": 9639.14,
          "whale_cum_sell": 7561.86,
          "retail_cum_sell": 10057.46,
          "whale_net": -92.15,
          "retail_net": -137.67,
          "whale_cum_net": 25.58,
          "retail_cum_net": -418.32,
          "whale_cum_buy_lot": 22223831,
          "whale_cum_sell_lot": 22118189,
          "retail_cum_buy_lot": 28236170,
          "retail_cum_sell_lot": 29551456,
          "whale_net_lot": 105642,
          "retail_net_lot": -1315286
        },
        {
          "day": 35,
          "date": "2025-10-20",
          "date_display": "20/10/2025",
          "date_end": "2025-10-20",
          "whale_buy": 157.02,
          "retail_buy": 209.98,
          "whale_sell": 110.97,
          "retail_sell": 204.55,
          "whale_buyavg": 3316.03,
          "whale_sellavg": 3314.88,
          "retail_buyavg": 3315.73,
          "retail_sellavg": 3315.03,
          "whale_cum_buy": 7744.46,
          "retail_cum_buy": 9849.12,
          "whale_cum_sell": 7672.83,
          "retail_cum_sell": 10262.02,
          "whale_net": 46.05,
          "retail_net": 5.43,
          "whale_cum_net": 71.63,
          "retail_cum_net": -412.9,
          "whale_cum_buy_lot": 22701598,
          "whale_cum_sell_lot": 22464756,
          "retail_cum_buy_lot": 28886746,
          "retail_cum_sell_lot": 30185929,
          "whale_net_lot": 236842,
          "retail_net_lot": -1299183
        },
        {
          "day": 36,
          "date": "2025-10-21",
          "date_display": "21/10/2025",
          "date_end": "2025-10-21",
          "whale_buy": 122.91,
          "retail_buy": 112.06,
          "whale_sell": 92.86,
          "retail_sell": 135.0,
          "whale_buyavg": 3311.25,
          "whale_sellavg": 3311.12,
          "retail_buyavg": 3310.7,
          "retail_sellavg": 3312.5,
          "whale_cum_buy": 7867.37,
          "retail_cum_buy": 9961.18,
          "whale_cum_sell": 7765.69,
          "retail_cum_sell": 10397.02,
          "whale_net": 30.05,
          "retail_net": -22.94,
          "whale_cum_net": 101.68,
          "retail_cum_net": -435.83,
          "whale_cum_buy_lot": 23072889,
          "whale_cum_sell_lot": 22745265,
          "retail_cum_buy_lot": 29225197,
          "retail_cum_sell_lot": 30593488,
          "whale_net_lot": 327624,
          "retail_net_lot": -1368291
        },
        {
          "day": 37,
          "date": "2025-10-22",
          "date_display": "22/10/2025",
          "date_end": "2025-10-22",
          "whale_buy": 79.67,
          "retail_buy": 122.66,
          "whale_sell": 99.39,
          "retail_sell": 131.59,
          "whale_buyavg": 3176.62,
          "whale_sellavg": 3177.67,
          "retail_buyavg": 3176.98,
          "retail_sellavg": 3176.89,
          "whale_cum_buy": 7947.03,
          "retail_cum_buy": 10083.84,
          "whale_cum_sell": 7865.08,
          "retail_cum_sell": 10528.61,
          "whale_net": -19.72,
          "retail_net": -8.93,
          "whale_cum_net": 81.96,
          "retail_cum_net": -444.77,
          "whale_cum_buy_lot": 23333172,
          "whale_cum_sell_lot": 23029677,
          "retail_cum_buy_lot": 29616703,
          "retail_cum_sell_lot": 31018387,
          "whale_net_lot": 303495,
          "retail_net_lot": -1401684
        },
        {
          "day": 38,
          "date": "2025-10-23",
          "date_display": "23/10/2025",
          "date_end": "2025-10-23",
          "whale_buy": 85.19,
          "retail_buy": 109.91,
          "whale_sell": 83.03,
          "retail_sell": 103.12,
          "whale_buyavg": 3190.55,
          "whale_sellavg": 3190.06,
          "retail_buyavg": 3186.74,
          "retail_sellavg": 3187.57,
          "whale_cum_buy": 8032.23,
          "retail_cum_buy": 10193.75,
          "whale_cum_sell": 7948.11,
          "retail_cum_sell": 10631.73,
          "whale_net": 2.17,
          "retail_net": 6.79,
          "whale_cum_net": 84.12,
          "retail_cum_net": -437.97,
          "whale_cum_buy_lot": 23600224,
          "whale_cum_sell_lot": 23289910,
          "retail_cum_buy_lot": 29961432,
          "retail_cum_sell_lot": 31341671,
          "whale_net_lot": 310314,
          "retail_net_lot": -1380239
        },
        {
          "day": 39,
          "date": "2025-10-24",
          "date_display": "24/10/2025",
          "date_end": "2025-10-24",
          "whale_buy": 73.64,
          "retail_buy": 110.95,
          "whale_sell": 77.6,
          "retail_sell": 102.53,
          "whale_buyavg": 3161.5,
          "whale_sellavg": 3157.22,
          "retail_buyavg": 3157.81,
          "retail_sellavg": 3161.3,
          "whale_cum_buy": 8105.87,
          "retail_cum_buy": 10304.7,
          "whale_cum_sell": 8025.7,
          "retail_cum_sell": 10734.26,
          "whale_net": -3.96,
          "retail_net": 8.42,
          "whale_cum_net": 80.17,
          "retail_cum_net": -429.56,
          "whale_cum_buy_lot": 23834323,
          "whale_cum_sell_lot": 23520292,
          "retail_cum_buy_lot": 30314105,
          "retail_cum_sell_lot": 31667756,
          "whale_net_lot": 314031,
          "retail_net_lot": -1353651
        },
        {
          "day": 40,
          "date": "2025-10-27",
          "date_display": "27/10/2025",
          "date_end": "2025-10-27",
          "whale_buy": 70.13,
          "retail_buy": 123.89,
          "whale_sell": 99.94,
          "retail_sell": 108.56,
          "whale_buyavg": 3155.69,
          "whale_sellavg": 3143.08,
          "retail_buyavg": 3147.09,
          "retail_sellavg": 3152.98,
          "whale_cum_buy": 8176.0,
          "retail_cum_buy": 10428.59,
          "whale_cum_sell": 8125.64,
          "retail_cum_sell": 10842.82,
          "whale_net": -29.8,
          "retail_net": 15.32,
          "whale_cum_net": 50.36,
          "retail_cum_net": -414.23,
          "whale_cum_buy_lot": 24057177,
          "whale_cum_sell_lot": 23838101,
          "retail_cum_buy_lot": 30707777,
          "retail_cum_sell_lot": 32012636,
          "whale_net_lot": 219076,
          "retail_net_lot": -1304859
        },
        {
          "day": 41,
          "date": "2025-10-28",
          "date_display": "28/10/2025",
          "date_end": "2025-10-28",
          "whale_buy": 66.82,
          "retail_buy": 134.7,
          "whale_sell": 47.81,
          "retail_sell": 148.42,
          "whale_buyavg": 3093.52,
          "whale_sellavg": 3093.86,
          "retail_buyavg": 3094.97,
          "retail_sellavg": 3093.67,
          "whale_cum_buy": 8242.82,
          "retail_cum_buy": 10563.29,
          "whale_cum_sell": 8173.45,
          "retail_cum_sell": 10991.24,
          "whale_net": 19.01,
          "retail_net": -13.72,
          "whale_cum_net": 69.37,
          "retail_cum_net": -427.95,
          "whale_cum_buy_lot": 24275520,
          "whale_cum_sell_lot": 23994868,
          "retail_cum_buy_lot": 31146559,
          "retail_cum_sell_lot": 32497187,
          "whale_net_lot": 280652,
          "retail_net_lot": -1350628
        },
        {
          "day": 42,
          "date": "2025-10-29",
          "date_display": "29/10/2025",
          "date_end": "2025-10-29",
          "whale_buy": 88.26,
          "retail_buy": 93.27,
          "whale_sell": 83.65,
          "retail_sell": 117.54,
          "whale_buyavg": 3170.06,
          "whale_sellavg": 3169.6,
          "retail_buyavg": 3173.1,
          "retail_sellavg": 3170.37,
          "whale_cum_buy": 8331.08,
          "retail_cum_buy": 10656.55,
          "whale_cum_sell": 8257.09,
          "retail_cum_sell": 11108.77,
          "whale_net": 4.62,
          "retail_net": -24.27,
          "whale_cum_net": 73.99,
          "retail_cum_net": -452.22,
          "whale_cum_buy_lot": 24552816,
          "whale_cum_sell_lot": 24257027,
          "retail_cum_buy_lot": 31569156,
          "retail_cum_sell_lot": 33002145,
          "whale_net_lot": 295789,
          "retail_net_lot": -1432989
        },
        {
          "day": 43,
          "date": "2025-10-30",
          "date_display": "30/10/2025",
          "date_end": "2025-10-30",
          "whale_buy": 46.85,
          "retail_buy": 93.17,
          "whale_sell": 37.19,
          "retail_sell": 121.1,
          "whale_buyavg": 3138.68,
          "whale_sellavg": 3144.26,
          "retail_buyavg": 3143.32,
          "retail_sellavg": 3141.29,
          "whale_cum_buy": 8377.93,
          "retail_cum_buy": 10749.72,
          "whale_cum_sell": 8294.28,
          "retail_cum_sell": 11229.87,
          "whale_net": 9.66,
          "retail_net": -27.93,
          "whale_cum_net": 83.64,
          "retail_cum_net": -480.15,
          "whale_cum_buy_lot": 24702931,
          "whale_cum_sell_lot": 24376343,
          "retail_cum_buy_lot": 31868565,
          "retail_cum_sell_lot": 33390411,
          "whale_net_lot": 326588,
          "retail_net_lot": -1521846
        },
        {
          "day": 44,
          "date": "2025-10-31",
          "date_display": "31/10/2025",
          "date_end": "2025-10-31",
          "whale_buy": 572.58,
          "retail_buy": 871.56,
          "whale_sell": 576.02,
          "retail_sell": 867.96,
          "whale_buyavg": 3139.09,
          "whale_sellavg": 3140.07,
          "retail_buyavg": 3138.01,
          "retail_sellavg": 3138.01,
          "whale_cum_buy": 8950.51,
          "retail_cum_buy": 11621.28,
          "whale_cum_sell": 8870.3,
          "retail_cum_sell": 12097.83,
          "whale_net": -3.43,
          "retail_net": 3.6,
          "whale_cum_net": 80.21,
          "retail_cum_net": -476.55,
          "whale_cum_buy_lot": 26527324,
          "whale_cum_sell_lot": 26211177,
          "retail_cum_buy_lot": 34646612,
          "retail_cum_sell_lot": 36157477,
          "whale_net_lot": 316147,
          "retail_net_lot": -1510865
        },
        {
          "day": 45,
          "date": "2025-11-03",
          "date_display": "03/11/2025",
          "date_end": "2025-11-03",
          "whale_buy": 74.64,
          "retail_buy": 100.65,
          "whale_sell": 73.13,
          "retail_sell": 102.9,
          "whale_buyavg": 3105.23,
          "whale_sellavg": 3103.65,
          "retail_buyavg": 3105.5,
          "retail_sellavg": 3106.64,
          "whale_cum_buy": 9025.16,
          "retail_cum_buy": 11721.93,
          "whale_cum_sell": 8943.43,
          "retail_cum_sell": 12200.73,
          "whale_net": 1.51,
          "retail_net": -2.26,
          "whale_cum_net": 81.73,
          "retail_cum_net": -478.8,
          "whale_cum_buy_lot": 26767702,
          "whale_cum_sell_lot": 26446804,
          "retail_cum_buy_lot": 34970747,
          "retail_cum_sell_lot": 36488794,
          "whale_net_lot": 320898,
          "retail_net_lot": -1518047
        },
        {
          "day": 46,
          "date": "2025-11-04",
          "date_display": "04/11/2025",
          "date_end": "2025-11-04",
          "whale_buy": 130.97,
          "retail_buy": 255.2,
          "whale_sell": 118.24,
          "retail_sell": 282.39,
          "whale_buyavg": 3023.53,
          "whale_sellavg": 3024.84,
          "retail_buyavg": 3016.2,
          "retail_sellavg": 3015.22,
          "whale_cum_buy": 9156.13,
          "retail_cum_buy": 11977.13,
          "whale_cum_sell": 9061.66,
          "retail_cum_sell": 12483.12,
          "whale_net": 12.74,
          "retail_net": -27.19,
          "whale_cum_net": 94.46,
          "retail_cum_net": -505.99,
          "whale_cum_buy_lot": 27206686,
          "whale_cum_sell_lot": 26841609,
          "retail_cum_buy_lot": 35824056,
          "retail_cum_sell_lot": 37432952,
          "whale_net_lot": 365077,
          "retail_net_lot": -1608896
        },
        {
          "day": 47,
          "date": "2025-11-05",
          "date_display": "05/11/2025",
          "date_end": "2025-11-05",
          "whale_buy": 104.05,
          "retail_buy": 190.67,
          "whale_sell": 99.49,
          "retail_sell": 131.7,
          "whale_buyavg": 2943.19,
          "whale_sellavg": 2947.78,
          "retail_buyavg": 2950.42,
          "retail_sellavg": 2945.18,
          "whale_cum_buy": 9260.18,
          "retail_cum_buy": 12167.8,
          "whale_cum_sell": 9161.16,
          "retail_cum_sell": 12614.82,
          "whale_net": 4.55,
          "retail_net": 58.97,
          "whale_cum_net": 99.02,
          "retail_cum_net": -447.02,
          "whale_cum_buy_lot": 27561946,
          "whale_cum_sell_lot": 27180144,
          "retail_cum_buy_lot": 36462273,
          "retail_cum_sell_lot": 37886872,
          "whale_net_lot": 381802,
          "retail_net_lot": -1424599
        },
        {
          "day": 48,
          "date": "2025-11-06",
          "date_display": "06/11/2025",
          "date_end": "2025-11-06",
          "whale_buy": 47.96,
          "retail_buy": 110.16,
          "whale_sell": 68.74,
          "retail_sell": 92.08,
          "whale_buyavg": 2941.27,
          "whale_sellavg": 2944.46,
          "retail_buyavg": 2942.9,
          "retail_sellavg": 2943.72,
          "whale_cum_buy": 9308.14,
          "retail_cum_buy": 12277.96,
          "whale_cum_sell": 9229.9,
          "retail_cum_sell": 12706.9,
          "whale_net": -20.78,
          "retail_net": 18.08,
          "whale_cum_net": 78.24,
          "retail_cum_net": -428.94,
          "whale_cum_buy_lot": 27724832,
          "whale_cum_sell_lot": 27413733,
          "retail_cum_buy_lot": 36836662,
          "retail_cum_sell_lot": 38199533,
          "whale_net_lot": 311099,
          "retail_net_lot": -1362871
        },
        {
          "day": 49,
          "date": "2025-11-07",
          "date_display": "07/11/2025",
          "date_end": "2025-11-07",
          "whale_buy": 74.15,
          "retail_buy": 47.31,
          "whale_sell": 102.13,
          "retail_sell": 68.46,
          "whale_buyavg": 2913.62,
          "whale_sellavg": 2911.09,
          "retail_buyavg": 2910.62,
          "retail_sellavg": 2913.98,
          "whale_cum_buy": 9382.29,
          "retail_cum_buy": 12325.27,
          "whale_cum_sell": 9332.03,
          "retail_cum_sell": 12775.35,
          "whale_net": -27.97,
          "retail_net": -21.14,
          "whale_cum_net": 50.26,
          "retail_cum_net": -450.08,
          "whale_cum_buy_lot": 27981210,
          "whale_cum_sell_lot": 27766212,
          "retail_cum_buy_lot": 37002400,
          "retail_cum_sell_lot": 38436508,
          "whale_net_lot": 214998,
          "retail_net_lot": -1434108
        },
        {
          "day": 50,
          "date": "2025-11-10",
          "date_display": "10/11/2025",
          "date_end": "2025-11-10",
          "whale_buy": 58.19,
          "retail_buy": 154.79,
          "whale_sell": 39.89,
          "retail_sell": 178.25,
          "whale_buyavg": 2911.02,
          "whale_sellavg": 2911.05,
          "retail_buyavg": 2914.46,
          "retail_sellavg": 2913.18,
          "whale_cum_buy": 9440.48,
          "retail_cum_buy": 12480.06,
          "whale_cum_sell": 9371.91,
          "retail_cum_sell": 12953.61,
          "whale_net": 18.3,
          "retail_net": -23.47,
          "whale_cum_net": 68.56,
          "retail_cum_net": -473.55,
          "whale_cum_buy_lot": 28180976,
          "whale_cum_sell_lot": 27902538,
          "retail_cum_buy_lot": 37533104,
          "retail_cum_sell_lot": 39048291,
          "whale_net_lot": 278438,
          "retail_net_lot": -1515187
        },
        {
          "day": 51,
          "date": "2025-11-11",
          "date_display": "11/11/2025",
          "date_end": "2025-11-11",
          "whale_buy": 89.2,
          "retail_buy": 172.5,
          "whale_sell": 86.66,
          "retail_sell": 126.23,
          "whale_buyavg": 2907.9,
          "whale_sellavg": 2907.11,
          "retail_buyavg": 2909.09,
          "retail_sellavg": 2910.31,
          "whale_cum_buy": 9529.68,
          "retail_cum_buy": 12652.56,
          "whale_cum_sell": 9458.57,
          "retail_cum_sell": 13079.84,
          "whale_net": 2.55,
          "retail_net": 46.28,
          "whale_cum_net": 71.11,
          "retail_cum_net": -427.27,
          "whale_cum_buy_lot": 28487811,
          "whale_cum_sell_lot": 28200941,
          "retail_cum_buy_lot": 38126220,
          "retail_cum_sell_lot": 39482378,
          "whale_net_lot": 286870,
          "retail_net_lot": -1356158
        },
        {
          "day": 52,
          "date": "2025-11-12",
          "date_display": "12/11/2025",
          "date_end": "2025-11-12",
          "whale_buy": 60.82,
          "retail_buy": 116.98,
          "whale_sell": 68.38,
          "retail_sell": 123.25,
          "whale_buyavg": 2887.77,
          "whale_sellavg": 2885.42,
          "retail_buyavg": 2885.12,
          "retail_sellavg": 2885.42,
          "whale_cum_buy": 9590.51,
          "retail_cum_buy": 12769.54,
          "whale_cum_sell": 9526.95,
          "retail_cum_sell": 13203.09,
          "whale_net": -7.55,
          "retail_net": -6.28,
          "whale_cum_net": 63.56,
          "retail_cum_net": -433.55,
          "whale_cum_buy_lot": 28698768,
          "whale_cum_sell_lot": 28438142,
          "retail_cum_buy_lot": 38532251,
          "retail_cum_sell_lot": 39909826,
          "whale_net_lot": 260626,
          "retail_net_lot": -1377575
        },
        {
          "day": 53,
          "date": "2025-11-13",
          "date_display": "13/11/2025",
          "date_end": "2025-11-13",
          "whale_buy": 44.96,
          "retail_buy": 117.8,
          "whale_sell": 47.55,
          "retail_sell": 92.48,
          "whale_buyavg": 2897.58,
          "whale_sellavg": 2898.18,
          "retail_buyavg": 2897.4,
          "retail_sellavg": 2897.28,
          "whale_cum_buy": 9635.47,
          "retail_cum_buy": 12887.35,
          "whale_cum_sell": 9574.5,
          "retail_cum_sell": 13295.56,
          "whale_net": -2.59,
          "retail_net": 25.33,
          "whale_cum_net": 60.97,
          "retail_cum_net": -408.22,
          "whale_cum_buy_lot": 28853585,
          "whale_cum_sell_lot": 28601892,
          "retail_cum_buy_lot": 38938527,
          "retail_cum_sell_lot": 40228267,
          "whale_net_lot": 251693,
          "retail_net_lot": -1289740
        },
        {
          "day": 54,
          "date": "2025-11-14",
          "date_display": "14/11/2025",
          "date_end": "2025-11-14",
          "whale_buy": 143.42,
          "retail_buy": 452.62,
          "whale_sell": 141.61,
          "retail_sell": 446.4,
          "whale_buyavg": 2987.02,
          "whale_sellavg": 2986.19,
          "retail_buyavg": 2989.56,
          "retail_sellavg": 2990.0,
          "whale_cum_buy": 9778.89,
          "retail_cum_buy": 13339.96,
          "whale_cum_sell": 9716.11,
          "retail_cum_sell": 13741.96,
          "whale_net": 1.81,
          "retail_net": 6.22,
          "whale_cum_net": 62.78,
          "retail_cum_net": -402.0,
          "whale_cum_buy_lot": 29327127,
          "whale_cum_sell_lot": 29070118,
          "retail_cum_buy_lot": 40443932,
          "retail_cum_sell_lot": 41723632,
          "whale_net_lot": 257009,
          "retail_net_lot": -1279700
        },
        {
          "day": 55,
          "date": "2025-11-17",
          "date_display": "17/11/2025",
          "date_end": "2025-11-17",
          "whale_buy": 155.69,
          "retail_buy": 253.59,
          "whale_sell": 163.31,
          "retail_sell": 272.4,
          "whale_buyavg": 3064.65,
          "whale_sellavg": 3061.31,
          "retail_buyavg": 3053.65,
          "retail_sellavg": 3053.37,
          "whale_cum_buy": 9934.58,
          "retail_cum_buy": 13593.55,
          "whale_cum_sell": 9879.42,
          "retail_cum_sell": 14014.36,
          "whale_net": -7.62,
          "retail_net": -18.81,
          "whale_cum_net": 55.15,
          "retail_cum_net": -420.81,
          "whale_cum_buy_lot": 29826253,
          "whale_cum_sell_lot": 29595889,
          "retail_cum_buy_lot": 41254631,
          "retail_cum_sell_lot": 42597832,
          "whale_net_lot": 230364,
          "retail_net_lot": -1343201
        },
        {
          "day": 56,
          "date": "2025-11-18",
          "date_display": "18/11/2025",
          "date_end": "2025-11-18",
          "whale_buy": 181.05,
          "retail_buy": 205.11,
          "whale_sell": 164.52,
          "retail_sell": 248.18,
          "whale_buyavg": 3055.6,
          "whale_sellavg": 3058.32,
          "retail_buyavg": 3055.3,
          "retail_sellavg": 3055.57,
          "whale_cum_buy": 10115.62,
          "retail_cum_buy": 13798.66,
          "whale_cum_sell": 10043.94,
          "retail_cum_sell": 14262.54,
          "whale_net": 16.53,
          "retail_net": -43.07,
          "whale_cum_net": 71.68,
          "retail_cum_net": -463.88,
          "whale_cum_buy_lot": 30418199,
          "whale_cum_sell_lot": 30134036,
          "retail_cum_buy_lot": 41926545,
          "retail_cum_sell_lot": 43410682,
          "whale_net_lot": 284163,
          "retail_net_lot": -1484137
        },
        {
          "day": 57,
          "date": "2025-11-19",
          "date_display": "19/11/2025",
          "date_end": "2025-11-19",
          "whale_buy": 88.14,
          "retail_buy": 99.11,
          "whale_sell": 77.26,
          "retail_sell": 104.06,
          "whale_buyavg": 3017.43,
          "whale_sellavg": 3015.27,
          "retail_buyavg": 3018.14,
          "retail_sellavg": 3019.19,
          "whale_cum_buy": 10203.76,
          "retail_cum_buy": 13897.76,
          "whale_cum_sell": 10121.2,
          "retail_cum_sell": 14366.6,
          "whale_net": 10.88,
          "retail_net": -4.96,
          "whale_cum_net": 82.56,
          "retail_cum_net": -468.84,
          "whale_cum_buy_lot": 30710939,
          "whale_cum_sell_lot": 30391502,
          "retail_cum_buy_lot": 42254932,
          "retail_cum_sell_lot": 43755906,
          "whale_net_lot": 319437,
          "retail_net_lot": -1500974
        },
        {
          "day": 58,
          "date": "2025-11-20",
          "date_display": "20/11/2025",
          "date_end": "2025-11-20",
          "whale_buy": 49.26,
          "retail_buy": 73.29,
          "whale_sell": 63.29,
          "retail_sell": 70.18,
          "whale_buyavg": 2993.3,
          "whale_sellavg": 2991.83,
          "retail_buyavg": 2992.32,
          "retail_sellavg": 2993.43,
          "whale_cum_buy": 10253.03,
          "retail_cum_buy": 13971.06,
          "whale_cum_sell": 10184.49,
          "retail_cum_sell": 14436.78,
          "whale_net": -14.03,
          "retail_net": 3.12,
          "whale_cum_net": 68.53,
          "retail_cum_net": -465.72,
          "whale_cum_buy_lot": 30876108,
          "whale_cum_sell_lot": 30603371,
          "retail_cum_buy_lot": 42500670,
          "retail_cum_sell_lot": 43991231,
          "whale_net_lot": 272737,
          "retail_net_lot": -1490561
        },
        {
          "day": 59,
          "date": "2025-11-21",
          "date_display": "21/11/2025",
          "date_end": "2025-11-21",
          "whale_buy": 79.91,
          "retail_buy": 34.44,
          "whale_sell": 98.71,
          "retail_sell": 47.18,
          "whale_buyavg": 2935.86,
          "whale_sellavg": 2936.14,
          "retail_buyavg": 2941.58,
          "retail_sellavg": 2949.94,
          "whale_cum_buy": 10332.94,
          "retail_cum_buy": 14005.5,
          "whale_cum_sell": 10283.2,
          "retail_cum_sell": 14483.96,
          "whale_net": -18.8,
          "retail_net": -12.74,
          "whale_cum_net": 49.74,
          "retail_cum_net": -478.46,
          "whale_cum_buy_lot": 31150601,
          "whale_cum_sell_lot": 30941827,
          "retail_cum_buy_lot": 42620315,
          "retail_cum_sell_lot": 44152489,
          "whale_net_lot": 208774,
          "retail_net_lot": -1532174
        },
        {
          "day": 60,
          "date": "2025-11-24",
          "date_display": "24/11/2025",
          "date_end": "2025-11-24",
          "whale_buy": 85.05,
          "retail_buy": 73.66,
          "whale_sell": 89.36,
          "retail_sell": 84.81,
          "whale_buyavg": 2936.13,
          "whale_sellavg": 2936.4,
          "retail_buyavg": 2931.71,
          "retail_sellavg": 2933.54,
          "whale_cum_buy": 10417.99,
          "retail_cum_buy": 14079.16,
          "whale_cum_sell": 10372.56,
          "retail_cum_sell": 14568.77,
          "whale_net": -4.32,
          "retail_net": -11.15,
          "whale_cum_net": 45.42,
          "retail_cum_net": -489.62,
          "whale_cum_buy_lot": 31440325,
          "whale_cum_sell_lot": 31246242,
          "retail_cum_buy_lot": 42872668,
          "retail_cum_sell_lot": 44442895,
          "whale_net_lot": 194083,
          "retail_net_lot": -1570227
        },
        {
          "day": 61,
          "date": "2025-11-25",
          "date_display": "25/11/2025",
          "date_end": "2025-11-25",
          "whale_buy": 67.85,
          "retail_buy": 113.68,
          "whale_sell": 62.47,
          "retail_sell": 131.9,
          "whale_buyavg": 2995.24,
          "whale_sellavg": 3001.07,
          "retail_buyavg": 2992.07,
          "retail_sellavg": 2987.01,
          "whale_cum_buy": 10485.84,
          "retail_cum_buy": 14192.84,
          "whale_cum_sell": 10435.03,
          "retail_cum_sell": 14700.67,
          "whale_net": 5.39,
          "retail_net": -18.22,
          "whale_cum_net": 50.81,
          "retail_cum_net": -507.84,
          "whale_cum_buy_lot": 31662595,
          "whale_cum_sell_lot": 31449860,
          "retail_cum_buy_lot": 43249380,
          "retail_cum_sell_lot": 44883304,
          "whale_net_lot": 212735,
          "retail_net_lot": -1633924
        },
        {
          "day": 62,
          "date": "2025-11-26",
          "date_display": "26/11/2025",
          "date_end": "2025-11-26",
          "whale_buy": 204.08,
          "retail_buy": 72.83,
          "whale_sell": 154.16,
          "retail_sell": 104.2,
          "whale_buyavg": 3028.82,
          "whale_sellavg": 3023.41,
          "retail_buyavg": 3019.91,
          "retail_sellavg": 3029.58,
          "whale_cum_buy": 10689.92,
          "retail_cum_buy": 14265.66,
          "whale_cum_sell": 10589.19,
          "retail_cum_sell": 14804.87,
          "whale_net": 49.92,
          "retail_net": -31.37,
          "whale_cum_net": 100.73,
          "retail_cum_net": -539.21,
          "whale_cum_buy_lot": 32334788,
          "whale_cum_sell_lot": 31958752,
          "retail_cum_buy_lot": 43489036,
          "retail_cum_sell_lot": 45225544,
          "whale_net_lot": 376036,
          "retail_net_lot": -1736508
        },
        {
          "day": 63,
          "date": "2025-11-27",
          "date_display": "27/11/2025",
          "date_end": "2025-11-27",
          "whale_buy": 71.22,
          "retail_buy": 81.77,
          "whale_sell": 74.83,
          "retail_sell": 80.55,
          "whale_buyavg": 3023.98,
          "whale_sellavg": 3017.19,
          "retail_buyavg": 3016.39,
          "retail_sellavg": 3023.56,
          "whale_cum_buy": 10761.15,
          "retail_cum_buy": 14347.43,
          "whale_cum_sell": 10664.02,
          "retail_cum_sell": 14885.42,
          "whale_net": -3.61,
          "retail_net": 1.22,
          "whale_cum_net": 97.13,
          "retail_cum_net": -537.99,
          "whale_cum_buy_lot": 32570233,
          "whale_cum_sell_lot": 32206937,
          "retail_cum_buy_lot": 43760076,
          "retail_cum_sell_lot": 45492056,
          "whale_net_lot": 363296,
          "retail_net_lot": -1731980
        },
        {
          "day": 64,
          "date": "2025-11-28",
          "date_display": "28/11/2025",
          "date_end": "2025-11-28",
          "whale_buy": 102.31,
          "retail_buy": 177.95,
          "whale_sell": 116.92,
          "retail_sell": 169.3,
          "whale_buyavg": 2930.89,
          "whale_sellavg": 2934.07,
          "retail_buyavg": 2929.49,
          "retail_sellavg": 2928.23,
          "whale_cum_buy": 10863.46,
          "retail_cum_buy": 14525.39,
          "whale_cum_sell": 10780.94,
          "retail_cum_sell": 15054.72,
          "whale_net": -14.6,
          "retail_net": 8.65,
          "whale_cum_net": 82.52,
          "retail_cum_net": -529.33,
          "whale_cum_buy_lot": 32922788,
          "whale_cum_sell_lot": 32608548,
          "retail_cum_buy_lot": 44374238,
          "retail_cum_sell_lot": 46077516,
          "whale_net_lot": 314240,
          "retail_net_lot": -1703278
        },
        {
          "day": 65,
          "date": "2025-12-01",
          "date_display": "01/12/2025",
          "date_end": "2025-12-01",
          "whale_buy": 98.21,
          "retail_buy": 70.22,
          "whale_sell": 78.43,
          "retail_sell": 85.39,
          "whale_buyavg": 2979.32,
          "whale_sellavg": 2974.15,
          "retail_buyavg": 2966.82,
          "retail_sellavg": 2973.78,
          "whale_cum_buy": 10961.67,
          "retail_cum_buy": 14595.61,
          "whale_cum_sell": 10859.36,
          "retail_cum_sell": 15140.11,
          "whale_net": 19.78,
          "retail_net": -15.16,
          "whale_cum_net": 102.31,
          "retail_cum_net": -544.5,
          "whale_cum_buy_lot": 33251162,
          "whale_cum_sell_lot": 32871329,
          "retail_cum_buy_lot": 44610365,
          "retail_cum_sell_lot": 46363820,
          "whale_net_lot": 379833,
          "retail_net_lot": -1753455
        },
        {
          "day": 66,
          "date": "2025-12-02",
          "date_display": "02/12/2025",
          "date_end": "2025-12-02",
          "whale_buy": 73.41,
          "retail_buy": 68.01,
          "whale_sell": 56.81,
          "retail_sell": 81.29,
          "whale_buyavg": 2979.35,
          "whale_sellavg": 2980.14,
          "retail_buyavg": 2977.4,
          "retail_sellavg": 2976.69,
          "whale_cum_buy": 11035.08,
          "retail_cum_buy": 14663.62,
          "whale_cum_sell": 10916.17,
          "retail_cum_sell": 15221.4,
          "whale_net": 16.6,
          "retail_net": -13.29,
          "whale_cum_net": 118.91,
          "retail_cum_net": -557.79,
          "whale_cum_buy_lot": 33497526,
          "whale_cum_sell_lot": 33061796,
          "retail_cum_buy_lot": 44838528,
          "retail_cum_sell_lot": 46636765,
          "whale_net_lot": 435730,
          "retail_net_lot": -1798237
        },
        {
          "day": 67,
          "date": "2025-12-03",
          "date_display": "03/12/2025",
          "date_end": "2025-12-03",
          "whale_buy": 67.83,
          "retail_buy": 55.63,
          "whale_sell": 46.0,
          "retail_sell": 76.52,
          "whale_buyavg": 2935.58,
          "whale_sellavg": 2935.96,
          "retail_buyavg": 2938.2,
          "retail_sellavg": 2936.89,
          "whale_cum_buy": 11102.91,
          "retail_cum_buy": 14719.25,
          "whale_cum_sell": 10962.17,
          "retail_cum_sell": 15297.92,
          "whale_net": 21.84,
          "retail_net": -20.89,
          "whale_cum_net": 140.75,
          "retail_cum_net": -578.67,
          "whale_cum_buy_lot": 33729418,
          "whale_cum_sell_lot": 33219990,
          "retail_cum_buy_lot": 45029638,
          "retail_cum_sell_lot": 46898859,
          "whale_net_lot": 509428,
          "retail_net_lot": -1869221
        },
        {
          "day": 68,
          "date": "2025-12-04",
          "date_display": "04/12/2025",
          "date_end": "2025-12-04",
          "whale_buy": 46.28,
          "retail_buy": 83.38,
          "whale_sell": 38.28,
          "retail_sell": 70.86,
          "whale_buyavg": 2912.27,
          "whale_sellavg": 2908.79,
          "retail_buyavg": 2911.75,
          "retail_sellavg": 2914.6,
          "whale_cum_buy": 11149.19,
          "retail_cum_buy": 14802.63,
          "whale_cum_sell": 11000.45,
          "retail_cum_sell": 15368.79,
          "whale_net": 8.0,
          "retail_net": 12.52,
          "whale_cum_net": 148.75,
          "retail_cum_net": -566.15,
          "whale_cum_buy_lot": 33888417,
          "whale_cum_sell_lot": 33352610,
          "retail_cum_buy_lot": 45311462,
          "retail_cum_sell_lot": 47142392,
          "whale_net_lot": 535807,
          "retail_net_lot": -1830930
        },
        {
          "day": 69,
          "date": "2025-12-05",
          "date_display": "05/12/2025",
          "date_end": "2025-12-05",
          "whale_buy": 40.21,
          "retail_buy": 74.9,
          "whale_sell": 39.76,
          "retail_sell": 61.99,
          "whale_buyavg": 2917.0,
          "whale_sellavg": 2918.74,
          "retail_buyavg": 2916.18,
          "retail_sellavg": 2916.01,
          "whale_cum_buy": 11189.41,
          "retail_cum_buy": 14877.54,
          "whale_cum_sell": 11040.2,
          "retail_cum_sell": 15430.78,
          "whale_net": 0.46,
          "retail_net": 12.91,
          "whale_cum_net": 149.2,
          "retail_cum_net": -553.24,
          "whale_cum_buy_lot": 34026267,
          "whale_cum_sell_lot": 33488749,
          "retail_cum_buy_lot": 45568328,
          "retail_cum_sell_lot": 47354871,
          "whale_net_lot": 537518,
          "retail_net_lot": -1786543
        },
        {
          "day": 70,
          "date": "2025-12-08",
          "date_display": "08/12/2025",
          "date_end": "2025-12-08",
          "whale_buy": 89.13,
          "retail_buy": 53.64,
          "whale_sell": 57.89,
          "retail_sell": 83.21,
          "whale_buyavg": 2953.71,
          "whale_sellavg": 2955.07,
          "retail_buyavg": 2960.05,
          "retail_sellavg": 2955.6,
          "whale_cum_buy": 11278.54,
          "retail_cum_buy": 14931.18,
          "whale_cum_sell": 11098.09,
          "retail_cum_sell": 15513.99,
          "whale_net": 31.24,
          "retail_net": -29.57,
          "whale_cum_net": 180.45,
          "retail_cum_net": -582.81,
          "whale_cum_buy_lot": 34327200,
          "whale_cum_sell_lot": 33683637,
          "retail_cum_buy_lot": 45748886,
          "retail_cum_sell_lot": 47635953,
          "whale_net_lot": 643563,
          "retail_net_lot": -1887067
        },
        {
          "day": 71,
          "date": "2025-12-09",
          "date_display": "09/12/2025",
          "date_end": "2025-12-09",
          "whale_buy": 42.29,
          "retail_buy": 59.65,
          "whale_sell": 52.17,
          "retail_sell": 34.14,
          "whale_buyavg": 2936.69,
          "whale_sellavg": 2934.24,
          "retail_buyavg": 2930.18,
          "retail_sellavg": 2932.37,
          "whale_cum_buy": 11320.83,
          "retail_cum_buy": 14990.83,
          "whale_cum_sell": 11150.26,
          "retail_cum_sell": 15548.13,
          "whale_net": -9.87,
          "retail_net": 25.51,
          "whale_cum_net": 170.57,
          "retail_cum_net": -557.3,
          "whale_cum_buy_lot": 34471394,
          "whale_cum_sell_lot": 33862011,
          "retail_cum_buy_lot": 45952924,
          "retail_cum_sell_lot": 47753146,
          "whale_net_lot": 609383,
          "retail_net_lot": -1800222
        },
        {
          "day": 72,
          "date": "2025-12-10",
          "date_display": "10/12/2025",
          "date_end": "2025-12-10",
          "whale_buy": 30.43,
          "retail_buy": 96.42,
          "whale_sell": 57.17,
          "retail_sell": 91.06,
          "whale_buyavg": 2935.29,
          "whale_sellavg": 2936.61,
          "retail_buyavg": 2936.75,
          "retail_sellavg": 2935.25,
          "whale_cum_buy": 11351.26,
          "retail_cum_buy": 15087.25,
          "whale_cum_sell": 11207.43,
          "retail_cum_sell": 15639.19,
          "whale_net": -26.74,
          "retail_net": 5.36,
          "whale_cum_net": 143.84,
          "retail_cum_net": -551.95,
          "whale_cum_buy_lot": 34575272,
          "whale_cum_sell_lot": 34056712,
          "retail_cum_buy_lot": 46281205,
          "retail_cum_sell_lot": 48063287,
          "whale_net_lot": 518560,
          "retail_net_lot": -1782082
        },
        {
          "day": 73,
          "date": "2025-12-11",
          "date_display": "11/12/2025",
          "date_end": "2025-12-11",
          "whale_buy": 85.4,
          "retail_buy": 88.87,
          "whale_sell": 149.39,
          "retail_sell": 101.88,
          "whale_buyavg": 2912.7,
          "whale_sellavg": 2909.2,
          "retail_buyavg": 2900.56,
          "retail_sellavg": 2907.73,
          "whale_cum_buy": 11436.66,
          "retail_cum_buy": 15176.12,
          "whale_cum_sell": 11356.82,
          "retail_cum_sell": 15741.07,
          "whale_net": -63.99,
          "retail_net": -13.01,
          "whale_cum_net": 79.84,
          "retail_cum_net": -564.95,
          "whale_cum_buy_lot": 34869527,
          "whale_cum_sell_lot": 34571061,
          "retail_cum_buy_lot": 46590002,
          "retail_cum_sell_lot": 48414360,
          "whale_net_lot": 298466,
          "retail_net_lot": -1824358
        },
        {
          "day": 74,
          "date": "2025-12-12",
          "date_display": "12/12/2025",
          "date_end": "2025-12-12",
          "whale_buy": 369.44,
          "retail_buy": 341.66,
          "whale_sell": 279.75,
          "retail_sell": 428.3,
          "whale_buyavg": 3029.1,
          "whale_sellavg": 3032.36,
          "retail_buyavg": 3038.96,
          "retail_sellavg": 3032.62,
          "whale_cum_buy": 11806.1,
          "retail_cum_buy": 15517.78,
          "whale_cum_sell": 11636.57,
          "retail_cum_sell": 16169.37,
          "whale_net": 89.69,
          "retail_net": -86.64,
          "whale_cum_net": 169.54,
          "retail_cum_net": -651.6,
          "whale_cum_buy_lot": 36080340,
          "whale_cum_sell_lot": 35479562,
          "retail_cum_buy_lot": 47692260,
          "retail_cum_sell_lot": 49808557,
          "whale_net_lot": 600778,
          "retail_net_lot": -2116297
        },
        {
          "day": 75,
          "date": "2025-12-15",
          "date_display": "15/12/2025",
          "date_end": "2025-12-15",
          "whale_buy": 293.79,
          "retail_buy": 205.6,
          "whale_sell": 297.83,
          "retail_sell": 223.59,
          "whale_buyavg": 3044.31,
          "whale_sellavg": 3048.3,
          "retail_buyavg": 3046.89,
          "retail_sellavg": 3044.05,
          "whale_cum_buy": 12099.89,
          "retail_cum_buy": 15723.37,
          "whale_cum_sell": 11934.4,
          "retail_cum_sell": 16392.97,
          "whale_net": -4.04,
          "retail_net": -18.0,
          "whale_cum_net": 165.49,
          "retail_cum_net": -669.59,
          "whale_cum_buy_lot": 37044633,
          "whale_cum_sell_lot": 36456743,
          "retail_cum_buy_lot": 48366550,
          "retail_cum_sell_lot": 50543738,
          "whale_net_lot": 587890,
          "retail_net_lot": -2177188
        },
        {
          "day": 76,
          "date": "2025-12-16",
          "date_display": "16/12/2025",
          "date_end": "2025-12-16",
          "whale_buy": 156.95,
          "retail_buy": 105.06,
          "whale_sell": 141.35,
          "retail_sell": 115.13,
          "whale_buyavg": 2992.18,
          "whale_sellavg": 2989.22,
          "retail_buyavg": 2985.13,
          "retail_sellavg": 2989.86,
          "whale_cum_buy": 12256.84,
          "retail_cum_buy": 15828.43,
          "whale_cum_sell": 12075.75,
          "retail_cum_sell": 16508.1,
          "whale_net": 15.6,
          "retail_net": -10.07,
          "whale_cum_net": 181.1,
          "retail_cum_net": -679.67,
          "whale_cum_buy_lot": 37569184,
          "whale_cum_sell_lot": 36926641,
          "retail_cum_buy_lot": 48719281,
          "retail_cum_sell_lot": 50930017,
          "whale_net_lot": 642543,
          "retail_net_lot": -2210736
        },
        {
          "day": 77,
          "date": "2025-12-17",
          "date_display": "17/12/2025",
          "date_end": "2025-12-17",
          "whale_buy": 159.31,
          "retail_buy": 103.58,
          "whale_sell": 73.34,
          "retail_sell": 107.27,
          "whale_buyavg": 3047.7,
          "whale_sellavg": 3043.85,
          "retail_buyavg": 3044.87,
          "retail_sellavg": 3047.6,
          "whale_cum_buy": 12416.15,
          "retail_cum_buy": 15932.01,
          "whale_cum_sell": 12149.09,
          "retail_cum_sell": 16615.36,
          "whale_net": 85.96,
          "retail_net": -3.69,
          "whale_cum_net": 267.06,
          "retail_cum_net": -683.36,
          "whale_cum_buy_lot": 38089778,
          "whale_cum_sell_lot": 37161360,
          "retail_cum_buy_lot": 49057079,
          "retail_cum_sell_lot": 51278100,
          "whale_net_lot": 928418,
          "retail_net_lot": -2221021
        },
        {
          "day": 78,
          "date": "2025-12-18",
          "date_display": "18/12/2025",
          "date_end": "2025-12-18",
          "whale_buy": 134.8,
          "retail_buy": 146.61,
          "whale_sell": 99.33,
          "retail_sell": 190.04,
          "whale_buyavg": 3061.49,
          "whale_sellavg": 3070.05,
          "retail_buyavg": 3077.45,
          "retail_sellavg": 3068.78,
          "whale_cum_buy": 12550.95,
          "retail_cum_buy": 16078.62,
          "whale_cum_sell": 12248.42,
          "retail_cum_sell": 16805.41,
          "whale_net": 35.47,
          "retail_net": -43.43,
          "whale_cum_net": 302.53,
          "retail_cum_net": -726.79,
          "whale_cum_buy_lot": 38528858,
          "whale_cum_sell_lot": 37482972,
          "retail_cum_buy_lot": 49531618,
          "retail_cum_sell_lot": 51898667,
          "whale_net_lot": 1045886,
          "retail_net_lot": -2367049
        },
        {
          "day": 79,
          "date": "2025-12-19",
          "date_display": "19/12/2025",
          "date_end": "2025-12-19",
          "whale_buy": 172.35,
          "retail_buy": 347.07,
          "whale_sell": 265.94,
          "retail_sell": 335.21,
          "whale_buyavg": 3122.87,
          "whale_sellavg": 3123.69,
          "retail_buyavg": 3124.49,
          "retail_sellavg": 3129.51,
          "whale_cum_buy": 12723.3,
          "retail_cum_buy": 16425.69,
          "whale_cum_sell": 12514.37,
          "retail_cum_sell": 17140.62,
          "whale_net": -93.59,
          "retail_net": 11.85,
          "whale_cum_net": 208.93,
          "retail_cum_net": -714.93,
          "whale_cum_buy_lot": 39063860,
          "whale_cum_sell_lot": 38327133,
          "retail_cum_buy_lot": 50635592,
          "retail_cum_sell_lot": 52961585,
          "whale_net_lot": 736727,
          "retail_net_lot": -2325993
        },
        {
          "day": 80,
          "date": "2025-12-22",
          "date_display": "22/12/2025",
          "date_end": "2025-12-22",
          "whale_buy": 285.41,
          "retail_buy": 369.18,
          "whale_sell": 243.9,
          "retail_sell": 410.46,
          "whale_buyavg": 3173.22,
          "whale_sellavg": 3175.12,
          "retail_buyavg": 3175.18,
          "retail_sellavg": 3175.59,
          "whale_cum_buy": 13008.71,
          "retail_cum_buy": 16794.87,
          "whale_cum_sell": 12758.27,
          "retail_cum_sell": 17551.09,
          "whale_net": 41.5,
          "retail_net": -41.28,
          "whale_cum_net": 250.44,
          "retail_cum_net": -756.21,
          "whale_cum_buy_lot": 39957679,
          "whale_cum_sell_lot": 39092475,
          "retail_cum_buy_lot": 51795420,
          "retail_cum_sell_lot": 54249432,
          "whale_net_lot": 865204,
          "retail_net_lot": -2454012
        },
        {
          "day": 81,
          "date": "2025-12-23",
          "date_display": "23/12/2025",
          "date_end": "2025-12-23",
          "whale_buy": 171.46,
          "retail_buy": 242.53,
          "whale_sell": 173.7,
          "retail_sell": 204.19,
          "whale_buyavg": 3209.14,
          "whale_sellavg": 3208.34,
          "retail_buyavg": 3208.36,
          "retail_sellavg": 3208.22,
          "whale_cum_buy": 13180.17,
          "retail_cum_buy": 17037.4,
          "whale_cum_sell": 12931.97,
          "retail_cum_sell": 17755.27,
          "whale_net": -2.24,
          "retail_net": 38.34,
          "whale_cum_net": 248.2,
          "retail_cum_net": -717.87,
          "whale_cum_buy_lot": 40490539,
          "whale_cum_sell_lot": 39633286,
          "retail_cum_buy_lot": 52547330,
          "retail_cum_sell_lot": 54880593,
          "whale_net_lot": 857253,
          "retail_net_lot": -2333263
        },
        {
          "day": 82,
          "date": "2025-12-24",
          "date_display": "24/12/2025",
          "date_end": "2025-12-24",
          "whale_buy": 244.99,
          "retail_buy": 292.54,
          "whale_sell": 198.89,
          "retail_sell": 370.26,
          "whale_buyavg": 3242.55,
          "whale_sellavg": 3238.8,
          "retail_buyavg": 3237.74,
          "retail_sellavg": 3244.95,
          "whale_cum_buy": 13425.16,
          "retail_cum_buy": 17329.94,
          "whale_cum_sell": 13130.86,
          "retail_cum_sell": 18125.54,
          "whale_net": 46.09,
          "retail_net": -77.73,
          "whale_cum_net": 294.29,
          "retail_cum_net": -795.6,
          "whale_cum_buy_lot": 41242863,
          "whale_cum_sell_lot": 40245361,
          "retail_cum_buy_lot": 53449086,
          "retail_cum_sell_lot": 56020293,
          "whale_net_lot": 997502,
          "retail_net_lot": -2571207
        },
        {
          "day": 83,
          "date": "2025-12-29",
          "date_display": "29/12/2025",
          "date_end": "2025-12-29",
          "whale_buy": 252.52,
          "retail_buy": 162.59,
          "whale_sell": 229.89,
          "retail_sell": 286.09,
          "whale_buyavg": 3343.01,
          "whale_sellavg": 3341.75,
          "retail_buyavg": 3333.48,
          "retail_sellavg": 3343.16,
          "whale_cum_buy": 13677.68,
          "retail_cum_buy": 17492.53,
          "whale_cum_sell": 13360.76,
          "retail_cum_sell": 18411.63,
          "whale_net": 22.63,
          "retail_net": -123.5,
          "whale_cum_net": 316.92,
          "retail_cum_net": -919.1,
          "whale_cum_buy_lot": 41972237,
          "whale_cum_sell_lot": 40914206,
          "retail_cum_buy_lot": 53914033,
          "retail_cum_sell_lot": 56857036,
          "whale_net_lot": 1058031,
          "retail_net_lot": -2943003
        },
        {
          "day": 84,
          "date": "2025-12-30",
          "date_display": "30/12/2025",
          "date_end": "2025-12-30",
          "whale_buy": 240.05,
          "retail_buy": 309.89,
          "whale_sell": 229.39,
          "retail_sell": 286.7,
          "whale_buyavg": 3169.93,
          "whale_sellavg": 3171.73,
          "retail_buyavg": 3173.18,
          "retail_sellavg": 3169.05,
          "whale_cum_buy": 13917.72,
          "retail_cum_buy": 17802.42,
          "whale_cum_sell": 13590.15,
          "retail_cum_sell": 18698.33,
          "whale_net": 10.66,
          "retail_net": 23.19,
          "whale_cum_net": 327.57,
          "retail_cum_net": -895.91,
          "whale_cum_buy_lot": 42738335,
          "whale_cum_sell_lot": 41650121,
          "retail_cum_buy_lot": 54900008,
          "retail_cum_sell_lot": 57769221,
          "whale_net_lot": 1088214,
          "retail_net_lot": -2869213
        },
        {
          "day": 85,
          "date": "2026-01-02",
          "date_display": "02/01/2026",
          "date_end": "2026-01-02",
          "whale_buy": 73.92,
          "retail_buy": 148.94,
          "whale_sell": 74.63,
          "retail_sell": 147.63,
          "whale_buyavg": 3202.56,
          "whale_sellavg": 3200.41,
          "retail_buyavg": 3202.46,
          "retail_sellavg": 3203.13,
          "whale_cum_buy": 13991.64,
          "retail_cum_buy": 17951.36,
          "whale_cum_sell": 13664.77,
          "retail_cum_sell": 18845.96,
          "whale_net": -0.71,
          "retail_net": 1.3,
          "whale_cum_net": 326.87,
          "retail_cum_net": -894.6,
          "whale_cum_buy_lot": 42969121,
          "whale_cum_sell_lot": 41883277,
          "retail_cum_buy_lot": 55363976,
          "retail_cum_sell_lot": 58228807,
          "whale_net_lot": 1085844,
          "retail_net_lot": -2864831
        },
        {
          "day": 86,
          "date": "2026-01-05",
          "date_display": "05/01/2026",
          "date_end": "2026-01-05",
          "whale_buy": 279.19,
          "retail_buy": 210.16,
          "whale_sell": 221.53,
          "retail_sell": 230.86,
          "whale_buyavg": 3330.39,
          "whale_sellavg": 3330.75,
          "retail_buyavg": 3333.88,
          "retail_sellavg": 3333.89,
          "whale_cum_buy": 14270.83,
          "retail_cum_buy": 18161.51,
          "whale_cum_sell": 13886.31,
          "retail_cum_sell": 19076.82,
          "whale_net": 57.66,
          "retail_net": -20.71,
          "whale_cum_net": 384.52,
          "retail_cum_net": -915.31,
          "whale_cum_buy_lot": 43800110,
          "whale_cum_sell_lot": 42540182,
          "retail_cum_buy_lot": 55977637,
          "retail_cum_sell_lot": 58900928,
          "whale_net_lot": 1259928,
          "retail_net_lot": -2923291
        },
        {
          "day": 87,
          "date": "2026-01-06",
          "date_display": "06/01/2026",
          "date_end": "2026-01-06",
          "whale_buy": 155.63,
          "retail_buy": 252.88,
          "whale_sell": 162.27,
          "retail_sell": 236.1,
          "whale_buyavg": 3423.9,
          "whale_sellavg": 3423.74,
          "retail_buyavg": 3424.7,
          "retail_sellavg": 3426.74,
          "whale_cum_buy": 14426.45,
          "retail_cum_buy": 18414.4,
          "whale_cum_sell": 14048.58,
          "retail_cum_sell": 19312.92,
          "whale_net": -6.65,
          "retail_net": 16.79,
          "whale_cum_net": 377.88,
          "retail_cum_net": -898.52,
          "whale_cum_buy_lot": 44239337,
          "whale_cum_sell_lot": 42997919,
          "retail_cum_buy_lot": 56714590,
          "retail_cum_sell_lot": 59716577,
          "whale_net_lot": 1241418,
          "retail_net_lot": -3001987
        },
        {
          "day": 88,
          "date": "2026-01-07",
          "date_display": "07/01/2026",
          "date_end": "2026-01-07",
          "whale_buy": 900.69,
          "retail_buy": 849.15,
          "whale_sell": 754.24,
          "retail_sell": 973.21,
          "whale_buyavg": 3764.5,
          "whale_sellavg": 3770.67,
          "retail_buyavg": 3781.08,
          "retail_sellavg": 3771.85,
          "whale_cum_buy": 15327.15,
          "retail_cum_buy": 19263.55,
          "whale_cum_sell": 14802.82,
          "retail_cum_sell": 20286.13,
          "whale_net": 146.45,
          "retail_net": -124.06,
          "whale_cum_net": 524.33,
          "retail_cum_net": -1022.58,
          "whale_cum_buy_lot": 46553334,
          "whale_cum_sell_lot": 44904755,
          "retail_cum_buy_lot": 58892164,
          "retail_cum_sell_lot": 62236653,
          "whale_net_lot": 1648579,
          "retail_net_lot": -3344489
        },
        {
          "day": 89,
          "date": "2026-01-08",
          "date_display": "08/01/2026",
          "date_end": "2026-01-08",
          "whale_buy": 345.35,
          "retail_buy": 611.9,
          "whale_sell": 291.3,
          "retail_sell": 682.17,
          "whale_buyavg": 3618.98,
          "whale_sellavg": 3595.73,
          "retail_buyavg": 3610.27,
          "retail_sellavg": 3616.1,
          "whale_cum_buy": 15672.49,
          "retail_cum_buy": 19875.45,
          "whale_cum_sell": 15094.12,
          "retail_cum_sell": 20968.3,
          "whale_net": 54.05,
          "retail_net": -70.27,
          "whale_cum_net": 578.37,
          "retail_cum_net": -1092.85,
          "whale_cum_buy_lot": 47442612,
          "whale_cum_sell_lot": 45719425,
          "retail_cum_buy_lot": 60622619,
          "retail_cum_sell_lot": 63840772,
          "whale_net_lot": 1723187,
          "retail_net_lot": -3218153
        },
        {
          "day": 90,
          "date": "2026-01-09",
          "date_display": "09/01/2026",
          "date_end": "2026-01-09",
          "whale_buy": 280.95,
          "retail_buy": 557.47,
          "whale_sell": 238.69,
          "retail_sell": 533.27,
          "whale_buyavg": 3564.29,
          "whale_sellavg": 3550.67,
          "retail_buyavg": 3559.74,
          "retail_sellavg": 3565.51,
          "whale_cum_buy": 15953.44,
          "retail_cum_buy": 20432.92,
          "whale_cum_sell": 15332.81,
          "retail_cum_sell": 21501.57,
          "whale_net": 42.26,
          "retail_net": 24.2,
          "whale_cum_net": 620.64,
          "retail_cum_net": -1068.66,
          "whale_cum_buy_lot": 48235445,
          "whale_cum_sell_lot": 46397691,
          "retail_cum_buy_lot": 62189707,
          "retail_cum_sell_lot": 65336897,
          "whale_net_lot": 1837754,
          "retail_net_lot": -3147190
        },
        {
          "day": 91,
          "date": "2026-01-12",
          "date_display": "12/01/2026",
          "date_end": "2026-01-12",
          "whale_buy": 360.45,
          "retail_buy": 726.38,
          "whale_sell": 344.68,
          "retail_sell": 657.43,
          "whale_buyavg": 3835.35,
          "whale_sellavg": 3847.33,
          "retail_buyavg": 3848.43,
          "retail_sellavg": 3841.11,
          "whale_cum_buy": 16313.9,
          "retail_cum_buy": 21159.3,
          "whale_cum_sell": 15677.49,
          "retail_cum_sell": 22159.0,
          "whale_net": 15.77,
          "retail_net": 68.96,
          "whale_cum_net": 636.41,
          "retail_cum_net": -999.7,
          "whale_cum_buy_lot": 49108219,
          "whale_cum_sell_lot": 47213136,
          "retail_cum_buy_lot": 64018610,
          "retail_cum_sell_lot": 66967000,
          "whale_net_lot": 1895083,
          "retail_net_lot": -2948390
        },
        {
          "day": 92,
          "date": "2026-01-13",
          "date_display": "13/01/2026",
          "date_end": "2026-01-13",
          "whale_buy": 306.35,
          "retail_buy": 395.48,
          "whale_sell": 350.21,
          "retail_sell": 446.74,
          "whale_buyavg": 3875.07,
          "whale_sellavg": 3875.01,
          "retail_buyavg": 3874.79,
          "retail_sellavg": 3874.75,
          "whale_cum_buy": 16620.25,
          "retail_cum_buy": 21554.78,
          "whale_cum_sell": 16027.7,
          "retail_cum_sell": 22605.74,
          "whale_net": -43.86,
          "retail_net": -51.26,
          "whale_cum_net": 592.54,
          "retail_cum_net": -1050.96,
          "whale_cum_buy_lot": 49894969,
          "whale_cum_sell_lot": 48116761,
          "retail_cum_buy_lot": 65038900,
          "retail_cum_sell_lot": 68151696,
          "whale_net_lot": 1778208,
          "retail_net_lot": -3112796
        },
        {
          "day": 93,
          "date": "2026-01-14",
          "date_display": "14/01/2026",
          "date_end": "2026-01-14",
          "whale_buy": 364.8,
          "retail_buy": 337.84,
          "whale_sell": 231.38,
          "retail_sell": 400.63,
          "whale_buyavg": 4078.14,
          "whale_sellavg": 4080.11,
          "retail_buyavg": 4081.06,
          "retail_sellavg": 4080.22,
          "whale_cum_buy": 16985.05,
          "retail_cum_buy": 21892.62,
          "whale_cum_sell": 16259.09,
          "retail_cum_sell": 23006.37,
          "whale_net": 133.42,
          "retail_net": -62.79,
          "whale_cum_net": 725.96,
          "retail_cum_net": -1113.76,
          "whale_cum_buy_lot": 50768639,
          "whale_cum_sell_lot": 48645142,
          "retail_cum_buy_lot": 65835066,
          "retail_cum_sell_lot": 69110808,
          "whale_net_lot": 2123497,
          "retail_net_lot": -3275742
        },
        {
          "day": 94,
          "date": "2026-01-15",
          "date_display": "15/01/2026",
          "date_end": "2026-01-15",
          "whale_buy": 291.4,
          "retail_buy": 252.22,
          "whale_sell": 303.73,
          "retail_sell": 280.34,
          "whale_buyavg": 4075.38,
          "whale_sellavg": 4080.4,
          "retail_buyavg": 4093.64,
          "retail_sellavg": 4082.94,
          "whale_cum_buy": 17276.45,
          "retail_cum_buy": 22144.84,
          "whale_cum_sell": 16562.82,
          "retail_cum_sell": 23286.72,
          "whale_net": -12.33,
          "retail_net": -28.12,
          "whale_cum_net": 713.63,
          "retail_cum_net": -1141.88,
          "whale_cum_buy_lot": 51483739,
          "whale_cum_sell_lot": 49389533,
          "retail_cum_buy_lot": 66450975,
          "retail_cum_sell_lot": 69797191,
          "whale_net_lot": 2094206,
          "retail_net_lot": -3346216
        },
        {
          "day": 95,
          "date": "2026-01-19",
          "date_display": "19/01/2026",
          "date_end": "2026-01-19",
          "whale_buy": 146.97,
          "retail_buy": 240.32,
          "whale_sell": 295.73,
          "retail_sell": 230.04,
          "whale_buyavg": 4018.94,
          "whale_sellavg": 4018.23,
          "retail_buyavg": 4011.17,
          "retail_sellavg": 4019.31,
          "whale_cum_buy": 17423.42,
          "retail_cum_buy": 22385.16,
          "whale_cum_sell": 16858.55,
          "retail_cum_sell": 23516.76,
          "whale_net": -148.76,
          "retail_net": 10.28,
          "whale_cum_net": 564.87,
          "retail_cum_net": -1131.6,
          "whale_cum_buy_lot": 51819925,
          "whale_cum_sell_lot": 50128924,
          "retail_cum_buy_lot": 66919349,
          "retail_cum_sell_lot": 70308907,
          "whale_net_lot": 1691001,
          "retail_net_lot": -3389558
        },
        {
          "day": 96,
          "date": "2026-01-20",
          "date_display": "20/01/2026",
          "date_end": "2026-01-20",
          "whale_buy": 176.72,
          "retail_buy": 338.65,
          "whale_sell": 154.1,
          "retail_sell": 290.89,
          "whale_buyavg": 4034.78,
          "whale_sellavg": 4052.03,
          "retail_buyavg": 4051.51,
          "retail_sellavg": 4042.9,
          "whale_cum_buy": 17600.14,
          "retail_cum_buy": 22723.81,
          "whale_cum_sell": 17012.65,
          "retail_cum_sell": 23807.64,
          "whale_net": 22.62,
          "retail_net": 47.77,
          "whale_cum_net": 587.49,
          "retail_cum_net": -1083.83,
          "whale_cum_buy_lot": 52256290,
          "whale_cum_sell_lot": 50507882,
          "retail_cum_buy_lot": 67754728,
          "retail_cum_sell_lot": 71026423,
          "whale_net_lot": 1748408,
          "retail_net_lot": -3271695
        },
        {
          "day": 97,
          "date": "2026-01-21",
          "date_display": "21/01/2026",
          "date_end": "2026-01-21",
          "whale_buy": 306.31,
          "retail_buy": 513.77,
          "whale_sell": 406.94,
          "retail_sell": 490.89,
          "whale_buyavg": 4219.35,
          "whale_sellavg": 4222.48,
          "retail_buyavg": 4225.97,
          "retail_sellavg": 4225.76,
          "whale_cum_buy": 17906.46,
          "retail_cum_buy": 23237.58,
          "whale_cum_sell": 17419.59,
          "retail_cum_sell": 24298.53,
          "whale_net": -100.63,
          "retail_net": 22.88,
          "whale_cum_net": 486.87,
          "retail_cum_net": -1060.95,
          "whale_cum_buy_lot": 52950910,
          "whale_cum_sell_lot": 51451180,
          "retail_cum_buy_lot": 68941755,
          "retail_cum_sell_lot": 72158774,
          "whale_net_lot": 1499730,
          "retail_net_lot": -3217019
        },
        {
          "day": 98,
          "date": "2026-01-22",
          "date_display": "22/01/2026",
          "date_end": "2026-01-22",
          "whale_buy": 352.02,
          "retail_buy": 320.71,
          "whale_sell": 433.69,
          "retail_sell": 280.74,
          "whale_buyavg": 4187.29,
          "whale_sellavg": 4179.92,
          "retail_buyavg": 4180.71,
          "retail_sellavg": 4192.24,
          "whale_cum_buy": 18258.47,
          "retail_cum_buy": 23558.29,
          "whale_cum_sell": 17853.28,
          "retail_cum_sell": 24579.26,
          "whale_net": -81.67,
          "retail_net": 39.97,
          "whale_cum_net": 405.19,
          "retail_cum_net": -1020.97,
          "whale_cum_buy_lot": 53792822,
          "whale_cum_sell_lot": 52489389,
          "retail_cum_buy_lot": 69709302,
          "retail_cum_sell_lot": 72829121,
          "whale_net_lot": 1303433,
          "retail_net_lot": -3119819
        },
        {
          "day": 99,
          "date": "2026-01-23",
          "date_display": "23/01/2026",
          "date_end": "2026-01-23",
          "whale_buy": 256.17,
          "retail_buy": 243.23,
          "whale_sell": 217.71,
          "retail_sell": 224.89,
          "whale_buyavg": 4328.96,
          "whale_sellavg": 4334.47,
          "retail_buyavg": 4332.64,
          "retail_sellavg": 4332.72,
          "whale_cum_buy": 18514.65,
          "retail_cum_buy": 23801.52,
          "whale_cum_sell": 18070.99,
          "retail_cum_sell": 24804.15,
          "whale_net": 38.46,
          "retail_net": 18.35,
          "whale_cum_net": 443.66,
          "retail_cum_net": -1002.63,
          "whale_cum_buy_lot": 54371640,
          "whale_cum_sell_lot": 52975837,
          "retail_cum_buy_lot": 70385778,
          "retail_cum_sell_lot": 73327609,
          "whale_net_lot": 1395803,
          "retail_net_lot": -2941831
        },
        {
          "day": 100,
          "date": "2026-01-26",
          "date_display": "26/01/2026",
          "date_end": "2026-01-26",
          "whale_buy": 637.97,
          "retail_buy": 1081.13,
          "whale_sell": 728.25,
          "retail_sell": 952.12,
          "whale_buyavg": 4735.74,
          "whale_sellavg": 4760.01,
          "retail_buyavg": 4736.69,
          "retail_sellavg": 4723.53,
          "whale_cum_buy": 19152.62,
          "retail_cum_buy": 24882.65,
          "whale_cum_sell": 18799.24,
          "retail_cum_sell": 25756.26,
          "whale_net": -90.28,
          "retail_net": 129.01,
          "whale_cum_net": 353.38,
          "retail_cum_net": -873.62,
          "whale_cum_buy_lot": 55656686,
          "whale_cum_sell_lot": 54432968,
          "retail_cum_buy_lot": 72607343,
          "retail_cum_sell_lot": 75280791,
          "whale_net_lot": 1223718,
          "retail_net_lot": -2673448
        },
        {
          "day": 101,
          "date": "2026-01-27",
          "date_display": "27/01/2026",
          "date_end": "2026-01-27",
          "whale_buy": 313.39,
          "retail_buy": 715.49,
          "whale_sell": 274.78,
          "retail_sell": 672.83,
          "whale_buyavg": 4616.47,
          "whale_sellavg": 4623.26,
          "retail_buyavg": 4624.61,
          "retail_sellavg": 4622.8,
          "whale_cum_buy": 19466.01,
          "retail_cum_buy": 25598.14,
          "whale_cum_sell": 19074.01,
          "retail_cum_sell": 26429.1,
          "whale_net": 38.62,
          "retail_net": 42.66,
          "whale_cum_net": 392.0,
          "retail_cum_net": -830.96,
          "whale_cum_buy_lot": 56290841,
          "whale_cum_sell_lot": 55027305,
          "retail_cum_buy_lot": 74198483,
          "retail_cum_sell_lot": 76742926,
          "whale_net_lot": 1263536,
          "retail_net_lot": -2544443
        },
        {
          "day": 102,
          "date": "2026-01-28",
          "date_display": "28/01/2026",
          "date_end": "2026-01-28",
          "whale_buy": 1026.62,
          "retail_buy": 883.74,
          "whale_sell": 1383.5,
          "retail_sell": 585.91,
          "whale_buyavg": 4404.5,
          "whale_sellavg": 4432.43,
          "retail_buyavg": 4446.12,
          "retail_sellavg": 4415.51,
          "whale_cum_buy": 20492.63,
          "retail_cum_buy": 26481.88,
          "whale_cum_sell": 20457.51,
          "retail_cum_sell": 27015.01,
          "whale_net": -356.88,
          "retail_net": 297.83,
          "whale_cum_net": 35.12,
          "retail_cum_net": -533.13,
          "whale_cum_buy_lot": 58652013,
          "whale_cum_sell_lot": 58174770,
          "retail_cum_buy_lot": 75983164,
          "retail_cum_sell_lot": 78108241,
          "whale_net_lot": 477243,
          "retail_net_lot": -2125077
        },
        {
          "day": 103,
          "date": "2026-01-29",
          "date_display": "29/01/2026",
          "date_end": "2026-01-29",
          "whale_buy": 955.33,
          "retail_buy": 795.88,
          "whale_sell": 680.64,
          "retail_sell": 774.72,
          "whale_buyavg": 4180.91,
          "whale_sellavg": 4158.94,
          "retail_buyavg": 4193.78,
          "retail_sellavg": 4165.09,
          "whale_cum_buy": 21447.96,
          "retail_cum_buy": 27277.76,
          "whale_cum_sell": 21138.15,
          "retail_cum_sell": 27789.73,
          "whale_net": 274.69,
          "retail_net": 21.17,
          "whale_cum_net": 309.81,
          "retail_cum_net": -511.96,
          "whale_cum_buy_lot": 60535878,
          "whale_cum_sell_lot": 59976470,
          "retail_cum_buy_lot": 78036803,
          "retail_cum_sell_lot": 79955748,
          "whale_net_lot": 559408,
          "retail_net_lot": -1918945
        },
        {
          "day": 104,
          "date": "2026-01-30",
          "date_display": "30/01/2026",
          "date_end": "2026-01-30",
          "whale_buy": 422.4,
          "retail_buy": 419.82,
          "whale_sell": 484.75,
          "retail_sell": 593.31,
          "whale_buyavg": 4222.67,
          "whale_sellavg": 4217.69,
          "retail_buyavg": 4219.74,
          "retail_sellavg": 4220.97,
          "whale_cum_buy": 21870.36,
          "retail_cum_buy": 27697.58,
          "whale_cum_sell": 21622.9,
          "retail_cum_sell": 28383.04,
          "whale_net": -62.35,
          "retail_net": -173.49,
          "whale_cum_net": 247.45,
          "retail_cum_net": -685.46,
          "whale_cum_buy_lot": 61534947,
          "whale_cum_sell_lot": 61125178,
          "retail_cum_buy_lot": 79033804,
          "retail_cum_sell_lot": 81361471,
          "whale_net_lot": 409769,
          "retail_net_lot": -2327667
        },
        {
          "day": 105,
          "date": "2026-02-02",
          "date_display": "02/02/2026",
          "date_end": "2026-02-02",
          "whale_buy": 373.12,
          "retail_buy": 520.56,
          "whale_sell": 348.31,
          "retail_sell": 441.13,
          "whale_buyavg": 3738.98,
          "whale_sellavg": 3742.34,
          "retail_buyavg": 3740.57,
          "retail_sellavg": 3745.47,
          "whale_cum_buy": 22243.48,
          "retail_cum_buy": 28218.14,
          "whale_cum_sell": 21971.21,
          "retail_cum_sell": 28824.17,
          "whale_net": 24.82,
          "retail_net": 79.42,
          "whale_cum_net": 272.27,
          "retail_cum_net": -606.03,
          "whale_cum_buy_lot": 62617328,
          "whale_cum_sell_lot": 62143095,
          "retail_cum_buy_lot": 80519349,
          "retail_cum_sell_lot": 82648882,
          "whale_net_lot": 474233,
          "retail_net_lot": -2129533
        },
        {
          "day": 106,
          "date": "2026-02-03",
          "date_display": "03/02/2026",
