{
  "generated_at": "2026-02-13 16:58:10",
  "stocks": {
    "ANTM": {
      "code": "ANTM",
      "date_start": "2025-09-01",
      "date_end": "2026-02-12",
      "summary": {
        "whale_buy": 24123.26,
        "retail_buy": 30476.92,
        "whale_sell": 23592.46,
        "retail_sell": 30873.69,
        "whale_buyavg": 3525.93,
        "retail_buyavg": 3518.77,
        "whale_sellavg": 3545.73,
        "retail_sellavg": 3498.82,
        "whale_net": 530.8,
        "retail_net": -396.78,
        "total_buy": 54600.18,
        "total_sell": 54466.15,
        "whale_cum_buy_lot": 67454040,
        "whale_cum_sell_lot": 66452601,
        "retail_cum_buy_lot": 86224380,
        "retail_cum_sell_lot": 87892568,
        "whale_net_lot": 1001439,
        "retail_net_lot": -1668188
      },
      "brokers": [
        {
          "code": "CC",
          "name": "Mandiri Sekuritas",
          "category": "whale",
          "buy": 6838.37,
          "sell": 6543.69,
          "buyavg": 3537.35,
          "sellavg": 3613.87,
          "buyavg_weighted": 24189676.910800684,
          "sellavg_weighted": 23648054.258216094,
          "net": 294.68,
          "total": 13382.06
        },
        {
          "code": "AK",
          "name": "UBS Sekuritas",
          "category": "whale",
          "buy": 6157.31,
          "sell": 5431.21,
          "buyavg": 3627.61,
          "sellavg": 3652.9,
          "buyavg_weighted": 22336301.697480805,
          "sellavg_weighted": 19839691.210844446,
          "net": 726.1,
          "total": 11588.52
        },
        {
          "code": "YP",
          "name": "Mirae Asset",
          "category": "retail",
          "buy": 5227.67,
          "sell": 5517.15,
          "buyavg": 3561.53,
          "sellavg": 3537.76,
          "buyavg_weighted": 18618508.60005057,
          "sellavg_weighted": 19518352.971339397,
          "net": -289.48,
          "total": 10744.83
        },
        {
          "code": "ZP",
          "name": "Maybank Sekuritas",
          "category": "retail",
          "buy": 4134.0,
          "sell": 3809.64,
          "buyavg": 3630.12,
          "sellavg": 3611.6,
          "buyavg_weighted": 15006911.1968157,
          "sellavg_weighted": 13758885.703251325,
          "net": 324.36,
          "total": 7943.65
        },
        {
          "code": "XL",
          "name": "Stockbit",
          "category": "retail",
          "buy": 3959.89,
          "sell": 3937.19,
          "buyavg": 3601.72,
          "sellavg": 3529.41,
          "buyavg_weighted": 14262420.11861125,
          "sellavg_weighted": 13895977.408099461,
          "net": 22.69,
          "total": 7897.08
        },
        {
          "code": "BK",
          "name": "JP Morgan",
          "category": "whale",
          "buy": 3274.77,
          "sell": 3150.73,
          "buyavg": 3643.5,
          "sellavg": 3619.69,
          "buyavg_weighted": 11931625.628460761,
          "sellavg_weighted": 11404666.398719532,
          "net": 124.05,
          "total": 6425.5
        },
        {
          "code": "PD",
          "name": "IPOT",
          "category": "retail",
          "buy": 2326.55,
          "sell": 2464.27,
          "buyavg": 3553.6,
          "sellavg": 3509.4,
          "buyavg_weighted": 8267632.760886596,
          "sellavg_weighted": 8648106.720808044,
          "net": -137.72,
          "total": 4790.83
        },
        {
          "code": "XC",
          "name": "Ajaib Sekuritas",
          "category": "retail",
          "buy": 1789.6,
          "sell": 2032.85,
          "buyavg": 3588.54,
          "sellavg": 3507.41,
          "buyavg_weighted": 6422045.908324478,
          "sellavg_weighted": 7130044.562324789,
          "net": -243.25,
          "total": 3822.45
        },
        {
          "code": "YU",
          "name": "Yuanta Sekuritas",
          "category": "retail",
          "buy": 1680.11,
          "sell": 1656.69,
          "buyavg": 3643.85,
          "sellavg": 3659.04,
          "buyavg_weighted": 6122071.558739315,
          "sellavg_weighted": 6061894.882215905,
          "net": 23.42,
          "total": 3336.8
        },
        {
          "code": "NI",
          "name": "BNI Sekuritas",
          "category": "whale",
          "buy": 1537.57,
          "sell": 1669.46,
          "buyavg": 3565.78,
          "sellavg": 3513.01,
          "buyavg_weighted": 5482635.130084801,
          "sellavg_weighted": 5864832.268780193,
          "net": -131.89,
          "total": 3207.04
        },
        {
          "code": "BB",
          "name": "Broker BB",
          "category": "retail",
          "buy": 1249.13,
          "sell": 1251.83,
          "buyavg": 3420.18,
          "sellavg": 3428.18,
          "buyavg_weighted": 4272252.497003614,
          "sellavg_weighted": 4291503.379810495,
          "net": -2.7,
          "total": 2500.96
        },
        {
          "code": "CP",
          "name": "Ciptadana Sekuritas",
          "category": "retail",
          "buy": 1169.66,
          "sell": 1302.85,
          "buyavg": 3551.38,
          "sellavg": 3569.24,
          "buyavg_weighted": 4153906.66699303,
          "sellavg_weighted": 4650185.419251927,
          "net": -133.19,
          "total": 2472.51
        },
        {
          "code": "MG",
          "name": "MNC Sekuritas",
          "category": "retail",
          "buy": 1215.99,
          "sell": 1174.67,
          "buyavg": 3528.38,
          "sellavg": 3524.07,
          "buyavg_weighted": 4290478.0978875,
          "sellavg_weighted": 4139624.0448992285,
          "net": 41.32,
          "total": 2390.66
        },
        {
          "code": "SQ",
          "name": "BCA Sekuritas",
          "category": "whale",
          "buy": 1112.7,
          "sell": 1157.62,
          "buyavg": 3520.53,
          "sellavg": 3476.34,
          "buyavg_weighted": 3917288.545880439,
          "sellavg_weighted": 4024275.824852391,
          "net": -44.93,
          "total": 2270.32
        },
        {
          "code": "LG",
          "name": "Trimegah Sekuritas",
          "category": "retail",
          "buy": 1172.63,
          "sell": 1015.28,
          "buyavg": 3643.71,
          "sellavg": 3603.91,
          "buyavg_weighted": 4272726.226519313,
          "sellavg_weighted": 3658980.5784266377,
          "net": 157.35,
          "total": 2187.91
        },
        {
          "code": "OD",
          "name": "BRI Danareksa",
          "category": "whale",
          "buy": 987.93,
          "sell": 1070.57,
          "buyavg": 3567.72,
          "sellavg": 3582.93,
          "buyavg_weighted": 3524659.550405909,
          "sellavg_weighted": 3835777.113675842,
          "net": -82.65,
          "total": 2058.5
        },
        {
          "code": "KK",
          "name": "Phillip Sekuritas",
          "category": "whale",
          "buy": 971.26,
          "sell": 1049.89,
          "buyavg": 3472.29,
          "sellavg": 3484.28,
          "buyavg_weighted": 3372492.3844279503,
          "sellavg_weighted": 3658113.3759748805,
          "net": -78.63,
          "total": 2021.16
        },
        {
          "code": "KZ",
          "name": "Broker KZ",
          "category": "whale",
          "buy": 794.31,
          "sell": 960.11,
          "buyavg": 3742.66,
          "sellavg": 3785.85,
          "buyavg_weighted": 2972831.1393151446,
          "sellavg_weighted": 3634837.2014554497,
          "net": -165.8,
          "total": 1754.41
        },
        {
          "code": "AZ",
          "name": "Asia Trade",
          "category": "retail",
          "buy": 861.11,
          "sell": 868.89,
          "buyavg": 3558.85,
          "sellavg": 3523.75,
          "buyavg_weighted": 3064560.1418069494,
          "sellavg_weighted": 3061752.085764028,
          "net": -7.79,
          "total": 1730.0
        },
        {
          "code": "DR",
          "name": "RHB/Danareksa",
          "category": "whale",
          "buy": 713.6,
          "sell": 790.11,
          "buyavg": 3503.53,
          "sellavg": 3497.05,
          "buyavg_weighted": 2500122.4262585794,
          "sellavg_weighted": 2763051.9710557,
          "net": -76.51,
          "total": 1503.72
        },
        {
          "code": "HD",
          "name": "KGI Sekuritas",
          "category": "retail",
          "buy": 618.84,
          "sell": 698.17,
          "buyavg": 3702.48,
          "sellavg": 3652.9,
          "buyavg_weighted": 2291244.0912893293,
          "sellavg_weighted": 2550343.9481705935,
          "net": -79.33,
          "total": 1317.01
        },
        {
          "code": "EP",
          "name": "MNC Sekuritas",
          "category": "retail",
          "buy": 552.53,
          "sell": 552.47,
          "buyavg": 3487.19,
          "sellavg": 3492.84,
          "buyavg_weighted": 1926779.4155022702,
          "sellavg_weighted": 1929691.0603024273,
          "net": 0.06,
          "total": 1105.0
        },
        {
          "code": "GR",
          "name": "Gundalah",
          "category": "retail",
          "buy": 543.59,
          "sell": 556.45,
          "buyavg": 3530.54,
          "sellavg": 3530.32,
          "buyavg_weighted": 1919165.3345931594,
          "sellavg_weighted": 1964445.7574257527,
          "net": -12.86,
          "total": 1100.05
        },
        {
          "code": "RX",
          "name": "Macquarie Sekuritas",
          "category": "whale",
          "buy": 548.14,
          "sell": 509.3,
          "buyavg": 3913.14,
          "sellavg": 3860.35,
          "buyavg_weighted": 2144949.7401912007,
          "sellavg_weighted": 1966078.0735686568,
          "net": 38.84,
          "total": 1057.44
        },
        {
          "code": "TP",
          "name": "OCBC Sekuritas",
          "category": "whale",
          "buy": 372.61,
          "sell": 440.74,
          "buyavg": 3607.85,
          "sellavg": 3587.64,
          "buyavg_weighted": 1344320.5760029098,
          "sellavg_weighted": 1581215.385385742,
          "net": -68.12,
          "total": 813.35
        },
        {
          "code": "AI",
          "name": "UOB Kay Hian",
          "category": "whale",
          "buy": 372.53,
          "sell": 368.81,
          "buyavg": 3523.53,
          "sellavg": 3535.27,
          "buyavg_weighted": 1312621.81382498,
          "sellavg_weighted": 1303843.1159087927,
          "net": 3.72,
          "total": 741.33
        },
        {
          "code": "DX",
          "name": "Bahana Sekuritas",
          "category": "whale",
          "buy": 342.92,
          "sell": 333.72,
          "buyavg": 3566.31,
          "sellavg": 3594.25,
          "buyavg_weighted": 1222958.8150242104,
          "sellavg_weighted": 1199472.2682492945,
          "net": 9.2,
          "total": 676.63
        },
        {
          "code": "YB",
          "name": "Yulie Sekuritas",
          "category": "retail",
          "buy": 319.75,
          "sell": 345.02,
          "buyavg": 3634.22,
          "sellavg": 3618.77,
          "buyavg_weighted": 1162041.4188975003,
          "sellavg_weighted": 1248548.9737125698,
          "net": -25.27,
          "total": 664.78
        },
        {
          "code": "DH",
          "name": "Sinarmas Sekuritas",
          "category": "retail",
          "buy": 326.25,
          "sell": 317.07,
          "buyavg": 3476.29,
          "sellavg": 3496.22,
          "buyavg_weighted": 1134140.7744078408,
          "sellavg_weighted": 1108547.5009933405,
          "net": 9.18,
          "total": 643.33
        },
        {
          "code": "AG",
          "name": "Agra Sekuritas",
          "category": "retail",
          "buy": 324.09,
          "sell": 314.13,
          "buyavg": 3763.81,
          "sellavg": 3800.9,
          "buyavg_weighted": 1219814.0489340401,
          "sellavg_weighted": 1193975.4215062798,
          "net": 9.96,
          "total": 638.21
        },
        {
          "code": "BQ",
          "name": "Korea Investment",
          "category": "retail",
          "buy": 311.1,
          "sell": 307.39,
          "buyavg": 3597.8,
          "sellavg": 3620.39,
          "buyavg_weighted": 1119275.4938184163,
          "sellavg_weighted": 1112871.4846608022,
          "net": 3.71,
          "total": 618.49
        },
        {
          "code": "AF",
          "name": "Broker AF",
          "category": "retail",
          "buy": 303.97,
          "sell": 236.61,
          "buyavg": 3928.2,
          "sellavg": 3939.14,
          "buyavg_weighted": 1194056.0375593698,
          "sellavg_weighted": 932039.5550730551,
          "net": 67.36,
          "total": 540.58
        },
        {
          "code": "AT",
          "name": "Phintraco Sekuritas",
          "category": "retail",
          "buy": 280.04,
          "sell": 251.25,
          "buyavg": 3613.12,
          "sellavg": 3614.06,
          "buyavg_weighted": 1011817.6490963702,
          "sellavg_weighted": 908031.7014219997,
          "net": 28.78,
          "total": 531.29
        },
        {
          "code": "IF",
          "name": "Samuel Sekuritas",
          "category": "retail",
          "buy": 203.91,
          "sell": 217.31,
          "buyavg": 3475.24,
          "sellavg": 3491.78,
          "buyavg_weighted": 708635.9928334703,
          "sellavg_weighted": 758798.5739176798,
          "net": -13.39,
          "total": 421.22
        },
        {
          "code": "SS",
          "name": "Broker SS",
          "category": "retail",
          "buy": 196.93,
          "sell": 213.99,
          "buyavg": 3784.74,
          "sellavg": 3865.63,
          "buyavg_weighted": 745328.0158750201,
          "sellavg_weighted": 827206.6399610798,
          "net": -17.06,
          "total": 410.91
        },
        {
          "code": "YJ",
          "name": "Lotus Andalan",
          "category": "retail",
          "buy": 198.34,
          "sell": 171.65,
          "buyavg": 3462.43,
          "sellavg": 3456.76,
          "buyavg_weighted": 686737.5131268301,
          "sellavg_weighted": 593352.601969417,
          "net": 26.69,
          "total": 369.98
        },
        {
          "code": "XA",
          "name": "NH Korindo",
          "category": "retail",
          "buy": 169.69,
          "sell": 180.08,
          "buyavg": 3625.71,
          "sellavg": 3663.54,
          "buyavg_weighted": 615246.1507791999,
          "sellavg_weighted": 659729.9993985901,
          "net": -10.39,
          "total": 349.77
        },
        {
          "code": "HP",
          "name": "Hanson Sekuritas",
          "category": "retail",
          "buy": 164.95,
          "sell": 184.22,
          "buyavg": 3574.3,
          "sellavg": 3618.43,
          "buyavg_weighted": 589581.3608887199,
          "sellavg_weighted": 666587.4162112402,
          "net": -19.27,
          "total": 349.17
        },
        {
          "code": "KI",
          "name": "Kingsford",
          "category": "retail",
          "buy": 163.78,
          "sell": 177.66,
          "buyavg": 3544.09,
          "sellavg": 3597.36,
          "buyavg_weighted": 580451.6025066,
          "sellavg_weighted": 639107.6931808841,
          "net": -13.88,
          "total": 341.44
        },
        {
          "code": "AO",
          "name": "Broker AO",
          "category": "retail",
          "buy": 145.05,
          "sell": 145.01,
          "buyavg": 3507.58,
          "sellavg": 3528.23,
          "buyavg_weighted": 508774.9151150301,
          "sellavg_weighted": 511628.14894920314,
          "net": 0.04,
          "total": 290.05
        },
        {
          "code": "CD",
          "name": "Broker CD",
          "category": "whale",
          "buy": 97.39,
          "sell": 115.3,
          "buyavg": 3642.2,
          "sellavg": 3736.99,
          "buyavg_weighted": 354713.99460265,
          "sellavg_weighted": 430874.6763315199,
          "net": -17.91,
          "total": 212.69
        },
        {
          "code": "BR",
          "name": "Broker BR",
          "category": "retail",
          "buy": 82.27,
          "sell": 87.07,
          "buyavg": 3649.72,
          "sellavg": 3582.02,
          "buyavg_weighted": 300262.86223324,
          "sellavg_weighted": 311886.75860882,
          "net": -4.8,
          "total": 169.33
        },
        {
          "code": "ZR",
          "name": "Broker ZR",
          "category": "retail",
          "buy": 72.34,
          "sell": 90.73,
          "buyavg": 3524.7,
          "sellavg": 3646.08,
          "buyavg_weighted": 254976.80760061007,
          "sellavg_weighted": 330808.5554777999,
          "net": -18.39,
          "total": 163.08
        },
        {
          "code": "FS",
          "name": "Broker FS",
          "category": "retail",
          "buy": 75.53,
          "sell": 83.74,
          "buyavg": 3580.54,
          "sellavg": 3637.42,
          "buyavg_weighted": 270437.98402165005,
          "sellavg_weighted": 304597.38062385,
          "net": -8.2,
          "total": 159.27
        },
        {
          "code": "LS",
          "name": "Lippo Sekuritas",
          "category": "retail",
          "buy": 62.77,
          "sell": 75.46,
          "buyavg": 3560.98,
          "sellavg": 3610.98,
          "buyavg_weighted": 223522.47090865002,
          "sellavg_weighted": 272484.78899047,
          "net": -12.69,
          "total": 138.24
        },
        {
          "code": "RF",
          "name": "Broker RF",
          "category": "retail",
          "buy": 60.76,
          "sell": 66.64,
          "buyavg": 3364.13,
          "sellavg": 3408.5,
          "buyavg_weighted": 204404.65534116,
          "sellavg_weighted": 227142.43087995006,
          "net": -5.88,
          "total": 127.4
        },
        {
          "code": "ES",
          "name": "Broker ES",
          "category": "retail",
          "buy": 64.83,
          "sell": 59.49,
          "buyavg": 3489.73,
          "sellavg": 3521.6,
          "buyavg_weighted": 226239.14173358984,
          "sellavg_weighted": 209499.88513897592,
          "net": 5.34,
          "total": 124.32
        },
        {
          "code": "PC",
          "name": "Broker PC",
          "category": "retail",
          "buy": 45.05,
          "sell": 50.84,
          "buyavg": 3457.38,
          "sellavg": 3615.37,
          "buyavg_weighted": 155755.03001681005,
          "sellavg_weighted": 183805.6371254,
          "net": -5.79,
          "total": 95.88
        },
        {
          "code": "FZ",
          "name": "Broker FZ",
          "category": "retail",
          "buy": 41.47,
          "sell": 45.85,
          "buyavg": 3547.98,
          "sellavg": 3541.58,
          "buyavg_weighted": 147134.84470964002,
          "sellavg_weighted": 162381.597689674,
          "net": -4.38,
          "total": 87.31
        },
        {
          "code": "PF",
          "name": "Broker PF",
          "category": "retail",
          "buy": 46.25,
          "sell": 33.31,
          "buyavg": 3548.59,
          "sellavg": 3456.84,
          "buyavg_weighted": 164122.18456365,
          "sellavg_weighted": 115147.39640776998,
          "net": 12.93,
          "total": 79.56
        },
        {
          "code": "IH",
          "name": "Broker IH",
          "category": "retail",
          "buy": 28.8,
          "sell": 32.99,
          "buyavg": 3176.01,
          "sellavg": 3295.44,
          "buyavg_weighted": 91469.04589216998,
          "sellavg_weighted": 108716.69074278999,
          "net": -4.19,
          "total": 61.78
        },
        {
          "code": "IN",
          "name": "Broker IN",
          "category": "retail",
          "buy": 26.97,
          "sell": 27.95,
          "buyavg": 3584.83,
          "sellavg": 3559.9,
          "buyavg_weighted": 96682.91768268002,
          "sellavg_weighted": 99499.11897309002,
          "net": -0.98,
          "total": 54.91
        },
        {
          "code": "BS",
          "name": "Broker BS",
          "category": "retail",
          "buy": 26.11,
          "sell": 26.5,
          "buyavg": 3722.04,
          "sellavg": 3744.67,
          "buyavg_weighted": 97182.52869033998,
          "sellavg_weighted": 99233.78173219,
          "net": -0.39,
          "total": 52.61
        },
        {
          "code": "SH",
          "name": "Broker SH",
          "category": "retail",
          "buy": 21.22,
          "sell": 25.68,
          "buyavg": 3501.81,
          "sellavg": 3581.52,
          "buyavg_weighted": 74308.30645772,
          "sellavg_weighted": 91973.51590411001,
          "net": -4.45,
          "total": 46.9
        },
        {
          "code": "IU",
          "name": "Broker IU",
          "category": "retail",
          "buy": 16.71,
          "sell": 28.66,
          "buyavg": 3596.31,
          "sellavg": 3692.7,
          "buyavg_weighted": 60094.26998695001,
          "sellavg_weighted": 105832.77453870002,
          "net": -11.95,
          "total": 45.38
        },
        {
          "code": "RO",
          "name": "Broker RO",
          "category": "retail",
          "buy": 21.93,
          "sell": 21.56,
          "buyavg": 3545.01,
          "sellavg": 3631.91,
          "buyavg_weighted": 77742.00741448998,
          "sellavg_weighted": 78304.010761346,
          "net": 0.37,
          "total": 43.5
        },
        {
          "code": "GA",
          "name": "Broker GA",
          "category": "retail",
          "buy": 19.66,
          "sell": 21.01,
          "buyavg": 3892.98,
          "sellavg": 3988.7,
          "buyavg_weighted": 76535.8887898,
          "sellavg_weighted": 83802.63465113,
          "net": -1.35,
          "total": 40.68
        },
        {
          "code": "DP",
          "name": "Broker DP",
          "category": "retail",
          "buy": 22.57,
          "sell": 17.93,
          "buyavg": 3539.65,
          "sellavg": 3432.75,
          "buyavg_weighted": 79889.91295811,
          "sellavg_weighted": 61549.15033306999,
          "net": 4.65,
          "total": 40.5
        },
        {
          "code": "MI",
          "name": "Broker MI",
          "category": "retail",
          "buy": 14.06,
          "sell": 19.49,
          "buyavg": 3456.51,
          "sellavg": 3359.57,
          "buyavg_weighted": 48598.513088299995,
          "sellavg_weighted": 65478.04660631321,
          "net": -5.43,
          "total": 33.55
        },
        {
          "code": "QA",
          "name": "Broker QA",
          "category": "retail",
          "buy": 14.02,
          "sell": 14.64,
          "buyavg": 3168.29,
          "sellavg": 3257.17,
          "buyavg_weighted": 44419.45893863003,
          "sellavg_weighted": 47684.951766890015,
          "net": -0.62,
          "total": 28.66
        },
        {
          "code": "RG",
          "name": "RHB Sekuritas",
          "category": "retail",
          "buy": 11.57,
          "sell": 16.6,
          "buyavg": 3587.55,
          "sellavg": 3641.31,
          "buyavg_weighted": 41507.995603369985,
          "sellavg_weighted": 60445.82409045002,
          "net": -5.04,
          "total": 28.17
        },
        {
          "code": "SA",
          "name": "Broker SA",
          "category": "retail",
          "buy": 11.57,
          "sell": 14.9,
          "buyavg": 3678.57,
          "sellavg": 3765.55,
          "buyavg_weighted": 42561.065855459994,
          "sellavg_weighted": 56106.69364350001,
          "net": -3.33,
          "total": 26.47
        },
        {
          "code": "RS",
          "name": "Broker RS",
          "category": "retail",
          "buy": 9.64,
          "sell": 10.58,
          "buyavg": 3602.82,
          "sellavg": 3810.31,
          "buyavg_weighted": 34731.153148380006,
          "sellavg_weighted": 40313.12586791001,
          "net": -0.94,
          "total": 20.21
        },
        {
          "code": "MU",
          "name": "Mandiri Investasi",
          "category": "retail",
          "buy": 9.18,
          "sell": 9.51,
          "buyavg": 3280.5,
          "sellavg": 3484.2,
          "buyavg_weighted": 30114.99147306,
          "sellavg_weighted": 33134.75351997001,
          "net": -0.34,
          "total": 18.69
        },
        {
          "code": "SF",
          "name": "Broker SF",
          "category": "retail",
          "buy": 7.68,
          "sell": 10.89,
          "buyavg": 3426.2,
          "sellavg": 3571.21,
          "buyavg_weighted": 26313.22410843,
          "sellavg_weighted": 38890.51735945999,
          "net": -3.22,
          "total": 18.57
        },
        {
          "code": "IT",
          "name": "Broker IT",
          "category": "retail",
          "buy": 10.43,
          "sell": 7.11,
          "buyavg": 3284.68,
          "sellavg": 3438.62,
          "buyavg_weighted": 34259.24386619999,
          "sellavg_weighted": 24448.573280639997,
          "net": 3.32,
          "total": 17.54
        },
        {
          "code": "PG",
          "name": "Broker PG",
          "category": "retail",
          "buy": 7.09,
          "sell": 9.37,
          "buyavg": 3344.52,
          "sellavg": 3419.21,
          "buyavg_weighted": 23712.679601300006,
          "sellavg_weighted": 32037.952231870004,
          "net": -2.28,
          "total": 16.46
        },
        {
          "code": "TS",
          "name": "Broker TS",
          "category": "retail",
          "buy": 7.56,
          "sell": 8.71,
          "buyavg": 3658.54,
          "sellavg": 3762.41,
          "buyavg_weighted": 27658.566196249998,
          "sellavg_weighted": 32770.58680972,
          "net": -1.15,
          "total": 16.27
        },
        {
          "code": "EL",
          "name": "Broker EL",
          "category": "retail",
          "buy": 4.58,
          "sell": 9.01,
          "buyavg": 4186.42,
          "sellavg": 4397.96,
          "buyavg_weighted": 19173.801864179997,
          "sellavg_weighted": 39625.604253929996,
          "net": -4.43,
          "total": 13.59
        },
        {
          "code": "AR",
          "name": "Artha Sekuritas",
          "category": "retail",
          "buy": 4.44,
          "sell": 7.21,
          "buyavg": 3548.05,
          "sellavg": 3972.26,
          "buyavg_weighted": 15753.349645539998,
          "sellavg_weighted": 28639.964338620004,
          "net": -2.77,
          "total": 11.65
        },
        {
          "code": "ID",
          "name": "Broker ID",
          "category": "retail",
          "buy": 4.75,
          "sell": 4.4,
          "buyavg": 3382.2,
          "sellavg": 3666.99,
          "buyavg_weighted": 16065.46675172,
          "sellavg_weighted": 16134.757617989999,
          "net": 0.36,
          "total": 9.15
        },
        {
          "code": "AH",
          "name": "Broker AH",
          "category": "retail",
          "buy": 2.41,
          "sell": 5.4,
          "buyavg": 3480.5,
          "sellavg": 3328.91,
          "buyavg_weighted": 8387.9981,
          "sellavg_weighted": 17976.111306590006,
          "net": -2.98,
          "total": 7.81
        },
        {
          "code": "PP",
          "name": "Broker PP",
          "category": "retail",
          "buy": 2.76,
          "sell": 4.82,
          "buyavg": 3501.93,
          "sellavg": 3547.65,
          "buyavg_weighted": 9665.31998964,
          "sellavg_weighted": 17099.660652469996,
          "net": -2.06,
          "total": 7.58
        },
        {
          "code": "OK",
          "name": "Broker OK",
          "category": "retail",
          "buy": 1.8,
          "sell": 5.45,
          "buyavg": 3497.41,
          "sellavg": 4031.49,
          "buyavg_weighted": 6295.3464109000015,
          "sellavg_weighted": 21971.645651820003,
          "net": -3.65,
          "total": 7.25
        },
        {
          "code": "GI",
          "name": "Broker GI",
          "category": "retail",
          "buy": 2.31,
          "sell": 4.16,
          "buyavg": 3707.86,
          "sellavg": 3869.19,
          "buyavg_weighted": 8565.151238249999,
          "sellavg_weighted": 16095.83777467,
          "net": -1.86,
          "total": 6.47
        },
        {
          "code": "PO",
          "name": "Broker PO",
          "category": "retail",
          "buy": 1.45,
          "sell": 3.45,
          "buyavg": 3720.94,
          "sellavg": 3365.63,
          "buyavg_weighted": 5395.358672299999,
          "sellavg_weighted": 11611.435285720003,
          "net": -2.0,
          "total": 4.9
        },
        {
          "code": "JB",
          "name": "Broker JB",
          "category": "retail",
          "buy": 0.45,
          "sell": 3.17,
          "buyavg": 3465.31,
          "sellavg": 3578.86,
          "buyavg_weighted": 1559.38775386,
          "sellavg_weighted": 11344.970900369997,
          "net": -2.72,
          "total": 3.62
        },
        {
          "code": "RB",
          "name": "Broker RB",
          "category": "retail",
          "buy": 0.54,
          "sell": 2.61,
          "buyavg": 3799.27,
          "sellavg": 3782.99,
          "buyavg_weighted": 2051.60411048,
          "sellavg_weighted": 9873.609829789999,
          "net": -2.07,
          "total": 3.15
        },
        {
          "code": "DD",
          "name": "Broker DD",
          "category": "whale",
          "buy": 1.85,
          "sell": 1.2,
          "buyavg": 3694.8,
          "sellavg": 3729.52,
          "buyavg_weighted": 6835.3867832900005,
          "sellavg_weighted": 4475.425497470001,
          "net": 0.65,
          "total": 3.05
        },
        {
          "code": "BF",
          "name": "Broker BF",
          "category": "retail",
          "buy": 1.59,
          "sell": 1.1,
          "buyavg": 3025.4,
          "sellavg": 2989.7,
          "buyavg_weighted": 4810.385,
          "sellavg_weighted": 3288.6696060100003,
          "net": 0.48,
          "total": 2.69
        },
        {
          "code": "TF",
          "name": "Trust Sekuritas",
          "category": "retail",
          "buy": 0.29,
          "sell": 2.0,
          "buyavg": 3578.97,
          "sellavg": 3705.68,
          "buyavg_weighted": 1037.89998377,
          "sellavg_weighted": 7411.355054809999,
          "net": -1.71,
          "total": 2.28
        },
        {
          "code": "AN",
          "name": "Broker AN",
          "category": "retail",
          "buy": 0.81,
          "sell": 1.18,
          "buyavg": 3533.43,
          "sellavg": 3538.09,
          "buyavg_weighted": 2862.0799108099995,
          "sellavg_weighted": 4174.944412419999,
          "net": -0.37,
          "total": 1.98
        },
        {
          "code": "AD",
          "name": "Broker AD",
          "category": "retail",
          "buy": 0.74,
          "sell": 0.95,
          "buyavg": 3186.13,
          "sellavg": 3834.65,
          "buyavg_weighted": 2357.73317941,
          "sellavg_weighted": 3642.9185363200004,
          "net": -0.21,
          "total": 1.69
        },
        {
          "code": "DU",
          "name": "Broker DU",
          "category": "retail",
          "buy": 0.34,
          "sell": 0.98,
          "buyavg": 3404.97,
          "sellavg": 3650.64,
          "buyavg_weighted": 1157.68863828,
          "sellavg_weighted": 3577.62958403,
          "net": -0.64,
          "total": 1.32
        },
        {
          "code": "YO",
          "name": "Broker YO",
          "category": "retail",
          "buy": 0.31,
          "sell": 0.34,
          "buyavg": 3550.93,
          "sellavg": 3962.32,
          "buyavg_weighted": 1100.78694,
          "sellavg_weighted": 1347.19005337,
          "net": -0.03,
          "total": 0.65
        },
        {
          "code": "IC",
          "name": "Broker IC",
          "category": "retail",
          "buy": 0.02,
          "sell": 0.32,
          "buyavg": 4373.76,
          "sellavg": 4826.31,
          "buyavg_weighted": 87.47513048000002,
          "sellavg_weighted": 1544.4179997800002,
          "net": -0.31,
          "total": 0.34
        },
        {
          "code": "PS",
          "name": "Broker PS",
          "category": "retail",
          "buy": 0.15,
          "sell": 0.1,
          "buyavg": 2879.58,
          "sellavg": 3538.42,
          "buyavg_weighted": 431.93681999999995,
          "sellavg_weighted": 353.84155,
          "net": 0.05,
          "total": 0.25
        },
        {
          "code": "PI",
          "name": "Broker PI",
          "category": "retail",
          "buy": 0.0,
          "sell": 0.03,
          "buyavg": 0,
          "sellavg": 3707.46,
          "buyavg_weighted": 3.61227,
          "sellavg_weighted": 111.22370063999999,
          "net": -0.03,
          "total": 0.03
        },
        {
          "code": "FO",
          "name": "Broker FO",
          "category": "retail",
          "buy": 0.0,
          "sell": 0.01,
          "buyavg": 0,
          "sellavg": 4070.44,
          "buyavg_weighted": 10.3041,
          "sellavg_weighted": 40.7044,
          "net": -0.01,
          "total": 0.02
        },
        {
          "code": "II",
          "name": "Broker II",
          "category": "retail",
          "buy": 0.0,
          "sell": 0.0,
          "buyavg": 0,
          "sellavg": 0,
          "buyavg_weighted": 16.4025,
          "sellavg_weighted": 7.12336,
          "net": 0.0,
          "total": 0.01
        }
      ],
      "daily": [
        {
          "day": 1,
          "date": "2025-09-01",
          "date_display": "01/09/2025",
          "date_end": "2025-09-01",
          "whale_buy": 808.56,
          "retail_buy": 922.98,
          "whale_sell": 755.62,
          "retail_sell": 975.64,
          "whale_buyavg": 3183.28,
          "whale_sellavg": 3173.72,
          "retail_buyavg": 3164.39,
          "retail_sellavg": 3172.77,
          "whale_cum_buy": 808.56,
          "retail_cum_buy": 922.98,
          "whale_cum_sell": 755.62,
          "retail_cum_sell": 975.64,
          "whale_net": 52.94,
          "retail_net": -52.66,
          "whale_cum_net": 52.94,
          "retail_cum_net": -52.66,
          "whale_cum_buy_lot": 2540006,
          "whale_cum_sell_lot": 2380849,
          "retail_cum_buy_lot": 2916766,
          "retail_cum_sell_lot": 3075043,
          "whale_net_lot": 159157,
          "retail_net_lot": -158277
        },
        {
          "day": 2,
          "date": "2025-09-02",
          "date_display": "02/09/2025",
          "date_end": "2025-09-02",
          "whale_buy": 493.06,
          "retail_buy": 607.15,
          "whale_sell": 551.8,
          "retail_sell": 548.18,
          "whale_buyavg": 3404.19,
          "whale_sellavg": 3400.93,
          "retail_buyavg": 3392.73,
          "retail_sellavg": 3401.21,
          "whale_cum_buy": 1301.62,
          "retail_cum_buy": 1530.13,
          "whale_cum_sell": 1307.42,
          "retail_cum_sell": 1523.82,
          "whale_net": -58.74,
          "retail_net": 58.98,
          "whale_cum_net": -5.8,
          "retail_cum_net": 6.32,
          "whale_cum_buy_lot": 3923222,
          "whale_cum_sell_lot": 4028772,
          "retail_cum_buy_lot": 4705310,
          "retail_cum_sell_lot": 4704873,
          "whale_net_lot": -105550,
          "retail_net_lot": 437
        },
        {
          "day": 3,
          "date": "2025-09-03",
          "date_display": "03/09/2025",
          "date_end": "2025-09-03",
          "whale_buy": 437.74,
          "retail_buy": 363.89,
          "whale_sell": 206.52,
          "retail_sell": 405.02,
          "whale_buyavg": 3449.46,
          "whale_sellavg": 3454.22,
          "retail_buyavg": 3457.09,
          "retail_sellavg": 3465.73,
          "whale_cum_buy": 1739.36,
          "retail_cum_buy": 1894.02,
          "whale_cum_sell": 1513.94,
          "retail_cum_sell": 1928.83,
          "whale_net": 231.22,
          "retail_net": -41.13,
          "whale_cum_net": 225.42,
          "retail_cum_net": -34.82,
          "whale_cum_buy_lot": 5185950,
          "whale_cum_sell_lot": 4608007,
          "retail_cum_buy_lot": 5724160,
          "retail_cum_sell_lot": 5854512,
          "whale_net_lot": 577943,
          "retail_net_lot": -130352
        },
        {
          "day": 4,
          "date": "2025-09-04",
          "date_display": "04/09/2025",
          "date_end": "2025-09-04",
          "whale_buy": 221.63,
          "retail_buy": 176.94,
          "whale_sell": 192.32,
          "retail_sell": 210.59,
          "whale_buyavg": 3412.53,
          "whale_sellavg": 3411.45,
          "retail_buyavg": 3410.95,
          "retail_sellavg": 3414.9,
          "whale_cum_buy": 1960.99,
          "retail_cum_buy": 2070.96,
          "whale_cum_sell": 1706.26,
          "retail_cum_sell": 2139.43,
          "whale_net": 29.31,
          "retail_net": -33.65,
          "whale_cum_net": 254.73,
          "retail_cum_net": -68.46,
          "whale_cum_buy_lot": 5836790,
          "whale_cum_sell_lot": 5174612,
          "retail_cum_buy_lot": 6243925,
          "retail_cum_sell_lot": 6471451,
          "whale_net_lot": 662178,
          "retail_net_lot": -227526
        },
        {
          "day": 5,
          "date": "2025-09-08",
          "date_display": "08/09/2025",
          "date_end": "2025-09-08",
          "whale_buy": 479.89,
          "retail_buy": 571.34,
          "whale_sell": 461.62,
          "retail_sell": 534.5,
          "whale_buyavg": 3581.36,
          "whale_sellavg": 3595.5,
          "retail_buyavg": 3602.35,
          "retail_sellavg": 3585.2,
          "whale_cum_buy": 2440.88,
          "retail_cum_buy": 2642.3,
          "whale_cum_sell": 2167.88,
          "retail_cum_sell": 2673.92,
          "whale_net": 18.28,
          "retail_net": 36.84,
          "whale_cum_net": 273.01,
          "retail_cum_net": -31.62,
          "whale_cum_buy_lot": 7145431,
          "whale_cum_sell_lot": 6422114,
          "retail_cum_buy_lot": 7805772,
          "retail_cum_sell_lot": 7933209,
          "whale_net_lot": 723317,
          "retail_net_lot": -127437
        },
        {
          "day": 6,
          "date": "2025-09-09",
          "date_display": "09/09/2025",
          "date_end": "2025-09-09",
          "whale_buy": 423.64,
          "retail_buy": 428.31,
          "whale_sell": 634.96,
          "retail_sell": 519.18,
          "whale_buyavg": 3752.46,
          "whale_sellavg": 3768.66,
          "retail_buyavg": 3754.11,
          "retail_sellavg": 3758.26,
          "whale_cum_buy": 2864.52,
          "retail_cum_buy": 3070.61,
          "whale_cum_sell": 2802.83,
          "retail_cum_sell": 3193.1,
          "whale_net": -211.32,
          "retail_net": -90.87,
          "whale_cum_net": 61.68,
          "retail_cum_net": -122.5,
          "whale_cum_buy_lot": 8217971,
          "whale_cum_sell_lot": 8076299,
          "retail_cum_buy_lot": 8863065,
          "retail_cum_sell_lot": 9311531,
          "whale_net_lot": 141672,
          "retail_net_lot": -448466
        },
        {
          "day": 7,
          "date": "2025-09-10",
          "date_display": "10/09/2025",
          "date_end": "2025-09-10",
          "whale_buy": 241.01,
          "retail_buy": 388.51,
          "whale_sell": 241.95,
          "retail_sell": 381.69,
          "whale_buyavg": 3531.89,
          "whale_sellavg": 3534.19,
          "retail_buyavg": 3533.64,
          "retail_sellavg": 3532.41,
          "whale_cum_buy": 3105.53,
          "retail_cum_buy": 3459.11,
          "whale_cum_sell": 3044.79,
          "retail_cum_sell": 3574.79,
          "whale_net": -0.94,
          "retail_net": 6.82,
          "whale_cum_net": 60.74,
          "retail_cum_net": -115.68,
          "whale_cum_buy_lot": 8900347,
          "whale_cum_sell_lot": 8764027,
          "retail_cum_buy_lot": 9971160,
          "retail_cum_sell_lot": 10400376,
          "whale_net_lot": 136320,
          "retail_net_lot": -429216
        },
        {
          "day": 8,
          "date": "2025-09-11",
          "date_display": "11/09/2025",
          "date_end": "2025-09-11",
          "whale_buy": 150.52,
          "retail_buy": 246.27,
          "whale_sell": 178.39,
          "retail_sell": 264.2,
          "whale_buyavg": 3517.89,
          "whale_sellavg": 3460.78,
          "retail_buyavg": 3435.09,
          "retail_sellavg": 3440.12,
          "whale_cum_buy": 3256.05,
          "retail_cum_buy": 3705.38,
          "whale_cum_sell": 3223.17,
          "retail_cum_sell": 3838.99,
          "whale_net": -27.87,
          "retail_net": -17.93,
          "whale_cum_net": 32.87,
          "retail_cum_net": -133.61,
          "whale_cum_buy_lot": 9332763,
          "whale_cum_sell_lot": 9279002,
          "retail_cum_buy_lot": 10578990,
          "retail_cum_sell_lot": 11115172,
          "whale_net_lot": 53761,
          "retail_net_lot": -536182
        },
        {
          "day": 9,
          "date": "2025-09-12",
          "date_display": "12/09/2025",
          "date_end": "2025-09-12",
          "whale_buy": 128.39,
          "retail_buy": 199.49,
          "whale_sell": 178.42,
          "retail_sell": 178.85,
          "whale_buyavg": 3460.4,
          "whale_sellavg": 3464.01,
          "retail_buyavg": 3462.38,
          "retail_sellavg": 3460.12,
          "whale_cum_buy": 3384.44,
          "retail_cum_buy": 3904.88,
          "whale_cum_sell": 3401.59,
          "retail_cum_sell": 4017.84,
          "whale_net": -50.03,
          "retail_net": 20.64,
          "whale_cum_net": -17.16,
          "retail_cum_net": -112.97,
          "whale_cum_buy_lot": 9702065,
          "whale_cum_sell_lot": 9693718,
          "retail_cum_buy_lot": 11154268,
          "retail_cum_sell_lot": 11630000,
          "whale_net_lot": 8347,
          "retail_net_lot": -475732
        },
        {
          "day": 10,
          "date": "2025-09-15",
          "date_display": "15/09/2025",
          "date_end": "2025-09-15",
          "whale_buy": 135.91,
          "retail_buy": 149.52,
          "whale_sell": 138.82,
          "retail_sell": 134.74,
          "whale_buyavg": 3485.01,
          "whale_sellavg": 3484.03,
          "retail_buyavg": 3482.34,
          "retail_sellavg": 3482.54,
          "whale_cum_buy": 3520.35,
          "retail_cum_buy": 4054.39,
          "whale_cum_sell": 3540.41,
          "retail_cum_sell": 4152.58,
          "whale_net": -2.9,
          "retail_net": 14.78,
          "whale_cum_net": -20.06,
          "retail_cum_net": -98.19,
          "whale_cum_buy_lot": 10090981,
          "whale_cum_sell_lot": 10091250,
          "retail_cum_buy_lot": 11583054,
          "retail_cum_sell_lot": 12016107,
          "whale_net_lot": -269,
          "retail_net_lot": -433053
        },
        {
          "day": 11,
          "date": "2025-09-16",
          "date_display": "16/09/2025",
          "date_end": "2025-09-16",
          "whale_buy": 83.6,
          "retail_buy": 147.79,
          "whale_sell": 97.08,
          "retail_sell": 176.76,
          "whale_buyavg": 3553.11,
          "whale_sellavg": 3559.35,
          "retail_buyavg": 3555.18,
          "retail_sellavg": 3553.56,
          "whale_cum_buy": 3603.95,
          "retail_cum_buy": 4202.19,
          "whale_cum_sell": 3637.49,
          "retail_cum_sell": 4329.34,
          "whale_net": -13.48,
          "retail_net": -28.97,
          "whale_cum_net": -33.54,
          "retail_cum_net": -127.16,
          "whale_cum_buy_lot": 10318877,
          "whale_cum_sell_lot": 10358289,
          "retail_cum_buy_lot": 11989363,
          "retail_cum_sell_lot": 12505077,
          "whale_net_lot": -39412,
          "retail_net_lot": -515714
        },
        {
          "day": 12,
          "date": "2025-09-17",
          "date_display": "17/09/2025",
          "date_end": "2025-09-17",
          "whale_buy": 73.44,
          "retail_buy": 129.47,
          "whale_sell": 93.53,
          "retail_sell": 271.76,
          "whale_buyavg": 3498.78,
          "whale_sellavg": 3501.92,
          "retail_buyavg": 3499.77,
          "retail_sellavg": 3504.55,
          "whale_cum_buy": 3677.4,
          "retail_cum_buy": 4331.65,
          "whale_cum_sell": 3731.02,
          "retail_cum_sell": 4601.1,
          "whale_net": -20.09,
          "retail_net": -142.29,
          "whale_cum_net": -53.63,
          "retail_cum_net": -269.45,
          "whale_cum_buy_lot": 10532124,
          "whale_cum_sell_lot": 10629175,
          "retail_cum_buy_lot": 12365809,
          "retail_cum_sell_lot": 13201417,
          "whale_net_lot": -97051,
          "retail_net_lot": -835608
        },
        {
          "day": 13,
          "date": "2025-09-18",
          "date_display": "18/09/2025",
          "date_end": "2025-09-18",
          "whale_buy": 254.33,
          "retail_buy": 118.21,
          "whale_sell": 174.27,
          "retail_sell": 155.16,
          "whale_buyavg": 3437.53,
          "whale_sellavg": 3435.32,
          "retail_buyavg": 3437.98,
          "retail_sellavg": 3439.64,
          "whale_cum_buy": 3931.73,
          "retail_cum_buy": 4449.87,
          "whale_cum_sell": 3905.29,
          "retail_cum_sell": 4756.26,
          "whale_net": 80.06,
          "retail_net": -36.95,
          "whale_cum_net": 26.44,
          "retail_cum_net": -306.39,
          "whale_cum_buy_lot": 11273087,
          "whale_cum_sell_lot": 11138455,
          "retail_cum_buy_lot": 12709868,
          "retail_cum_sell_lot": 13654504,
          "whale_net_lot": 134632,
          "retail_net_lot": -944636
        },
        {
          "day": 14,
          "date": "2025-09-19",
          "date_display": "19/09/2025",
          "date_end": "2025-09-19",
          "whale_buy": 236.99,
          "retail_buy": 197.2,
          "whale_sell": 110.32,
          "retail_sell": 184.79,
          "whale_buyavg": 3503.69,
          "whale_sellavg": 3492.67,
          "retail_buyavg": 3495.66,
          "retail_sellavg": 3504.32,
          "whale_cum_buy": 4168.72,
          "retail_cum_buy": 4647.06,
          "whale_cum_sell": 4015.62,
          "retail_cum_sell": 4941.05,
          "whale_net": 126.66,
          "retail_net": 12.41,
          "whale_cum_net": 153.1,
          "retail_cum_net": -293.98,
          "whale_cum_buy_lot": 11946321,
          "whale_cum_sell_lot": 11446399,
          "retail_cum_buy_lot": 13269545,
          "retail_cum_sell_lot": 14174873,
          "whale_net_lot": 499922,
          "retail_net_lot": -905328
        },
        {
          "day": 15,
          "date": "2025-09-22",
          "date_display": "22/09/2025",
          "date_end": "2025-09-22",
          "whale_buy": 180.33,
          "retail_buy": 174.73,
          "whale_sell": 109.57,
          "retail_sell": 188.44,
          "whale_buyavg": 3541.71,
          "whale_sellavg": 3543.07,
          "retail_buyavg": 3542.11,
          "retail_sellavg": 3542.72,
          "whale_cum_buy": 4349.05,
          "retail_cum_buy": 4821.8,
          "whale_cum_sell": 4125.18,
          "retail_cum_sell": 5129.48,
          "whale_net": 70.76,
          "retail_net": -13.7,
          "whale_cum_net": 223.86,
          "retail_cum_net": -307.69,
          "whale_cum_buy_lot": 12453803,
          "whale_cum_sell_lot": 11751305,
          "retail_cum_buy_lot": 13761078,
          "retail_cum_sell_lot": 14705707,
          "whale_net_lot": 702498,
          "retail_net_lot": -944629
        },
        {
          "day": 16,
          "date": "2025-09-23",
          "date_display": "23/09/2025",
          "date_end": "2025-09-23",
          "whale_buy": 160.62,
          "retail_buy": 315.28,
          "whale_sell": 210.9,
          "retail_sell": 339.68,
          "whale_buyavg": 3672.98,
          "whale_sellavg": 3671.37,
          "retail_buyavg": 3666.48,
          "retail_sellavg": 3666.42,
          "whale_cum_buy": 4509.67,
          "retail_cum_buy": 5137.08,
          "whale_cum_sell": 4336.08,
          "retail_cum_sell": 5469.16,
          "whale_net": -50.27,
          "retail_net": -24.4,
          "whale_cum_net": 173.59,
          "retail_cum_net": -332.08,
          "whale_cum_buy_lot": 13081189,
          "whale_cum_sell_lot": 12321942,
          "retail_cum_buy_lot": 14602065,
          "retail_cum_sell_lot": 15613883,
          "whale_net_lot": 759247,
          "retail_net_lot": -1011818
        },
        {
          "day": 17,
          "date": "2025-09-24",
          "date_display": "24/09/2025",
          "date_end": "2025-09-24",
          "whale_buy": 140.93,
          "retail_buy": 342.69,
          "whale_sell": 99.12,
          "retail_sell": 220.94,
          "whale_buyavg": 3518.45,
          "whale_sellavg": 3525.7,
          "retail_buyavg": 3526.4,
          "retail_sellavg": 3529.9,
          "whale_cum_buy": 4650.61,
          "retail_cum_buy": 5479.76,
          "whale_cum_sell": 4435.2,
          "retail_cum_sell": 5690.1,
          "whale_net": 41.81,
          "retail_net": 121.74,
          "whale_cum_net": 215.41,
          "retail_cum_net": -210.34,
          "whale_cum_buy_lot": 13445045,
          "whale_cum_sell_lot": 12617541,
          "retail_cum_buy_lot": 15580183,
          "retail_cum_sell_lot": 16259511,
          "whale_net_lot": 827504,
          "retail_net_lot": -679328
        },
        {
          "day": 18,
          "date": "2025-09-25",
          "date_display": "25/09/2025",
          "date_end": "2025-09-25",
          "whale_buy": 301.73,
          "retail_buy": 452.07,
          "whale_sell": 301.44,
          "retail_sell": 452.58,
          "whale_buyavg": 3244.6,
          "whale_sellavg": 3238.68,
          "retail_buyavg": 3241.59,
          "retail_sellavg": 3241.93,
          "whale_cum_buy": 4952.34,
          "retail_cum_buy": 5931.84,
          "whale_cum_sell": 4736.64,
          "retail_cum_sell": 6142.68,
          "whale_net": 0.29,
          "retail_net": -0.5,
          "whale_cum_net": 215.7,
          "retail_cum_net": -210.84,
          "whale_cum_buy_lot": 14362854,
          "whale_cum_sell_lot": 13588555,
          "retail_cum_buy_lot": 17048327,
          "retail_cum_sell_lot": 17745978,
          "whale_net_lot": 774299,
          "retail_net_lot": -697651
        },
        {
          "day": 19,
          "date": "2025-09-26",
          "date_display": "26/09/2025",
          "date_end": "2025-09-26",
          "whale_buy": 150.04,
          "retail_buy": 235.51,
          "whale_sell": 139.43,
          "retail_sell": 287.39,
          "whale_buyavg": 3180.22,
          "whale_sellavg": 3180.69,
          "retail_buyavg": 3181.92,
          "retail_sellavg": 3182.44,
          "whale_cum_buy": 5102.38,
          "retail_cum_buy": 6167.34,
          "whale_cum_sell": 4876.07,
          "retail_cum_sell": 6430.07,
          "whale_net": 10.61,
          "retail_net": -51.88,
          "whale_cum_net": 226.31,
          "retail_cum_net": -262.73,
          "whale_cum_buy_lot": 14838216,
          "whale_cum_sell_lot": 14034420,
          "retail_cum_buy_lot": 17789767,
          "retail_cum_sell_lot": 18649183,
          "whale_net_lot": 803796,
          "retail_net_lot": -859416
        },
        {
          "day": 20,
          "date": "2025-09-29",
          "date_display": "29/09/2025",
          "date_end": "2025-09-29",
          "whale_buy": 151.58,
          "retail_buy": 229.95,
          "whale_sell": 150.81,
          "retail_sell": 222.34,
          "whale_buyavg": 3280.24,
          "whale_sellavg": 3279.17,
          "retail_buyavg": 3278.41,
          "retail_sellavg": 3277.32,
          "whale_cum_buy": 5253.96,
          "retail_cum_buy": 6397.3,
          "whale_cum_sell": 5026.88,
          "retail_cum_sell": 6652.41,
          "whale_net": 0.77,
          "retail_net": 7.62,
          "whale_cum_net": 227.08,
          "retail_cum_net": -255.11,
          "whale_cum_buy_lot": 15332278,
          "whale_cum_sell_lot": 14492781,
          "retail_cum_buy_lot": 18491585,
          "retail_cum_sell_lot": 19318676,
          "whale_net_lot": 839497,
          "retail_net_lot": -827091
        },
        {
          "day": 21,
          "date": "2025-09-30",
          "date_display": "30/09/2025",
          "date_end": "2025-09-30",
          "whale_buy": 185.85,
          "retail_buy": 189.28,
          "whale_sell": 224.34,
          "retail_sell": 129.91,
          "whale_buyavg": 3243.61,
          "whale_sellavg": 3227.56,
          "retail_buyavg": 3246.19,
          "retail_sellavg": 3259.2,
          "whale_cum_buy": 5439.8,
          "retail_cum_buy": 6586.57,
          "whale_cum_sell": 5251.22,
          "retail_cum_sell": 6782.32,
          "whale_net": -38.49,
          "retail_net": 59.37,
          "whale_cum_net": 188.59,
          "retail_cum_net": -195.75,
          "whale_cum_buy_lot": 15910692,
          "whale_cum_sell_lot": 15192910,
          "retail_cum_buy_lot": 19022927,
          "retail_cum_sell_lot": 19721017,
          "whale_net_lot": 717782,
          "retail_net_lot": -698090
        },
        {
          "day": 22,
          "date": "2025-10-01",
          "date_display": "01/10/2025",
          "date_end": "2025-10-01",
          "whale_buy": 174.69,
          "retail_buy": 167.79,
          "whale_sell": 228.51,
          "retail_sell": 153.04,
          "whale_buyavg": 3197.18,
          "whale_sellavg": 3196.68,
          "retail_buyavg": 3195.84,
          "retail_sellavg": 3196.49,
          "whale_cum_buy": 5614.49,
          "retail_cum_buy": 6754.36,
          "whale_cum_sell": 5479.72,
          "retail_cum_sell": 6935.36,
          "whale_net": -53.82,
          "retail_net": 14.74,
          "whale_cum_net": 134.76,
          "retail_cum_net": -181.0,
          "whale_cum_buy_lot": 16457537,
          "whale_cum_sell_lot": 15908208,
          "retail_cum_buy_lot": 19548545,
          "retail_cum_sell_lot": 20200757,
          "whale_net_lot": 549329,
          "retail_net_lot": -652212
        },
        {
          "day": 23,
          "date": "2025-10-02",
          "date_display": "02/10/2025",
          "date_end": "2025-10-02",
          "whale_buy": 100.0,
          "retail_buy": 113.38,
          "whale_sell": 149.92,
          "retail_sell": 166.59,
          "whale_buyavg": 3146.09,
          "whale_sellavg": 3145.01,
          "retail_buyavg": 3141.72,
          "retail_sellavg": 3143.19,
          "whale_cum_buy": 5714.49,
          "retail_cum_buy": 6867.74,
          "whale_cum_sell": 5629.64,
          "retail_cum_sell": 7101.95,
          "whale_net": -49.92,
          "retail_net": -53.21,
          "whale_cum_net": 84.85,
          "retail_cum_net": -234.22,
          "whale_cum_buy_lot": 16653860,
          "whale_cum_sell_lot": 16386316,
          "retail_cum_buy_lot": 19915541,
          "retail_cum_sell_lot": 20734784,
          "whale_net_lot": 267544,
          "retail_net_lot": -819243
        },
        {
          "day": 24,
          "date": "2025-10-03",
          "date_display": "03/10/2025",
          "date_end": "2025-10-03",
          "whale_buy": 134.22,
          "retail_buy": 139.8,
          "whale_sell": 106.58,
          "retail_sell": 149.45,
          "whale_buyavg": 3180.32,
          "whale_sellavg": 3181.9,
          "retail_buyavg": 3180.31,
          "retail_sellavg": 3180.21,
          "whale_cum_buy": 5848.71,
          "retail_cum_buy": 7007.53,
          "whale_cum_sell": 5736.23,
          "retail_cum_sell": 7251.41,
          "whale_net": 27.63,
          "retail_net": -9.66,
          "whale_cum_net": 112.48,
          "retail_cum_net": -243.87,
          "whale_cum_buy_lot": 17074647,
          "whale_cum_sell_lot": 16719301,
          "retail_cum_buy_lot": 20354474,
          "retail_cum_sell_lot": 21208918,
          "whale_net_lot": 355346,
          "retail_net_lot": -854444
        },
        {
          "day": 25,
          "date": "2025-10-06",
          "date_display": "06/10/2025",
          "date_end": "2025-10-06",
          "whale_buy": 56.62,
          "retail_buy": 176.94,
          "whale_sell": 41.33,
          "retail_sell": 180.94,
          "whale_buyavg": 3219.14,
          "whale_sellavg": 3222.1,
          "retail_buyavg": 3215.15,
          "retail_sellavg": 3214.6,
          "whale_cum_buy": 5905.33,
          "retail_cum_buy": 7184.47,
          "whale_cum_sell": 5777.56,
          "retail_cum_sell": 7432.34,
          "whale_net": 15.29,
          "retail_net": -4.0,
          "whale_cum_net": 127.77,
          "retail_cum_net": -247.87,
          "whale_cum_buy_lot": 17249522,
          "whale_cum_sell_lot": 16846186,
          "retail_cum_buy_lot": 20900554,
          "retail_cum_sell_lot": 21768339,
          "whale_net_lot": 403336,
          "retail_net_lot": -867785
        },
        {
          "day": 26,
          "date": "2025-10-07",
          "date_display": "07/10/2025",
          "date_end": "2025-10-07",
          "whale_buy": 66.74,
          "retail_buy": 195.57,
          "whale_sell": 83.9,
          "retail_sell": 168.27,
          "whale_buyavg": 3186.73,
          "whale_sellavg": 3190.67,
          "retail_buyavg": 3186.15,
          "retail_sellavg": 3185.3,
          "whale_cum_buy": 5972.08,
          "retail_cum_buy": 7380.04,
          "whale_cum_sell": 5861.47,
          "retail_cum_sell": 7600.61,
          "whale_net": -17.16,
          "retail_net": 27.3,
          "whale_cum_net": 110.61,
          "retail_cum_net": -220.57,
          "whale_cum_buy_lot": 17461015,
          "whale_cum_sell_lot": 17111105,
          "retail_cum_buy_lot": 21514333,
          "retail_cum_sell_lot": 22298023,
          "whale_net_lot": 349910,
          "retail_net_lot": -783690
        },
        {
          "day": 27,
          "date": "2025-10-08",
          "date_display": "08/10/2025",
          "date_end": "2025-10-08",
          "whale_buy": 200.19,
          "retail_buy": 455.15,
          "whale_sell": 212.73,
          "retail_sell": 467.36,
          "whale_buyavg": 3273.58,
          "whale_sellavg": 3280.29,
          "retail_buyavg": 3285.55,
          "retail_sellavg": 3279.21,
          "whale_cum_buy": 6172.27,
          "retail_cum_buy": 7835.19,
          "whale_cum_sell": 6074.2,
          "retail_cum_sell": 8067.97,
          "whale_net": -12.54,
          "retail_net": -12.21,
          "whale_cum_net": 98.08,
          "retail_cum_net": -232.78,
          "whale_cum_buy_lot": 18061307,
          "whale_cum_sell_lot": 17746666,
          "retail_cum_buy_lot": 22881344,
          "retail_cum_sell_lot": 23707188,
          "whale_net_lot": 314641,
          "retail_net_lot": -825844
        },
        {
          "day": 28,
          "date": "2025-10-09",
          "date_display": "09/10/2025",
          "date_end": "2025-10-09",
          "whale_buy": 188.47,
          "retail_buy": 302.1,
          "whale_sell": 126.21,
          "retail_sell": 226.69,
          "whale_buyavg": 3258.62,
          "whale_sellavg": 3257.64,
          "retail_buyavg": 3262.76,
          "retail_sellavg": 3264.36,
          "whale_cum_buy": 6360.74,
          "retail_cum_buy": 8137.29,
          "whale_cum_sell": 6200.4,
          "retail_cum_sell": 8294.66,
          "whale_net": 62.27,
          "retail_net": 75.41,
          "whale_cum_net": 160.34,
          "retail_cum_net": -157.37,
          "whale_cum_buy_lot": 18640089,
          "whale_cum_sell_lot": 18136741,
          "retail_cum_buy_lot": 23801293,
          "retail_cum_sell_lot": 24403225,
          "whale_net_lot": 503348,
          "retail_net_lot": -601932
        },
        {
          "day": 29,
          "date": "2025-10-10",
          "date_display": "10/10/2025",
          "date_end": "2025-10-10",
          "whale_buy": 152.97,
          "retail_buy": 172.24,
          "whale_sell": 169.37,
          "retail_sell": 182.98,
          "whale_buyavg": 3286.69,
          "whale_sellavg": 3288.3,
          "retail_buyavg": 3291.14,
          "retail_sellavg": 3289.19,
          "whale_cum_buy": 6513.71,
          "retail_cum_buy": 8309.53,
          "whale_cum_sell": 6369.78,
          "retail_cum_sell": 8477.64,
          "whale_net": -16.41,
          "retail_net": -10.74,
          "whale_cum_net": 143.93,
          "retail_cum_net": -168.1,
          "whale_cum_buy_lot": 19104636,
          "whale_cum_sell_lot": 18651501,
          "retail_cum_buy_lot": 24323122,
          "retail_cum_sell_lot": 24958159,
          "whale_net_lot": 453135,
          "retail_net_lot": -635037
        },
        {
          "day": 30,
          "date": "2025-10-13",
          "date_display": "13/10/2025",
          "date_end": "2025-10-13",
          "whale_buy": 191.8,
          "retail_buy": 280.36,
          "whale_sell": 149.39,
          "retail_sell": 317.57,
          "whale_buyavg": 3371.48,
          "whale_sellavg": 3370.25,
          "retail_buyavg": 3369.88,
          "retail_sellavg": 3368.45,
          "whale_cum_buy": 6705.51,
          "retail_cum_buy": 8589.9,
          "whale_cum_sell": 6519.17,
          "retail_cum_sell": 8795.21,
          "whale_net": 42.41,
          "retail_net": -37.21,
          "whale_cum_net": 186.34,
          "retail_cum_net": -205.31,
          "whale_cum_buy_lot": 19667263,
          "whale_cum_sell_lot": 19085740,
          "retail_cum_buy_lot": 25155815,
          "retail_cum_sell_lot": 25894628,
          "whale_net_lot": 581523,
          "retail_net_lot": -738813
        },
        {
          "day": 31,
          "date": "2025-10-14",
          "date_display": "14/10/2025",
          "date_end": "2025-10-14",
          "whale_buy": 220.11,
          "retail_buy": 330.56,
          "whale_sell": 238.3,
          "retail_sell": 391.87,
          "whale_buyavg": 3402.86,
          "whale_sellavg": 3393.8,
          "retail_buyavg": 3394.74,
          "retail_sellavg": 3399.16,
          "whale_cum_buy": 6925.62,
          "retail_cum_buy": 8920.45,
          "whale_cum_sell": 6757.46,
          "retail_cum_sell": 9187.08,
          "whale_net": -18.19,
          "retail_net": -61.32,
          "whale_cum_net": 168.15,
          "retail_cum_net": -266.63,
          "whale_cum_buy_lot": 20310769,
          "whale_cum_sell_lot": 19784210,
          "retail_cum_buy_lot": 26120039,
          "retail_cum_sell_lot": 27038887,
          "whale_net_lot": 526559,
          "retail_net_lot": -918848
        },
        {
          "day": 32,
          "date": "2025-10-15",
          "date_display": "15/10/2025",
          "date_end": "2025-10-15",
          "whale_buy": 168.71,
          "retail_buy": 333.07,
          "whale_sell": 243.39,
          "retail_sell": 374.19,
          "whale_buyavg": 3389.43,
          "whale_sellavg": 3384.06,
          "retail_buyavg": 3386.04,
          "retail_sellavg": 3393.64,
          "whale_cum_buy": 7094.33,
          "retail_cum_buy": 9253.52,
          "whale_cum_sell": 7000.86,
          "retail_cum_sell": 9561.27,
          "whale_net": -74.69,
          "retail_net": -41.12,
          "whale_cum_net": 93.47,
          "retail_cum_net": -307.75,
          "whale_cum_buy_lot": 20807292,
          "whale_cum_sell_lot": 20505391,
          "retail_cum_buy_lot": 27103756,
          "retail_cum_sell_lot": 28141560,
          "whale_net_lot": 301901,
          "retail_net_lot": -1037804
        },
        {
          "day": 33,
          "date": "2025-10-16",
          "date_display": "16/10/2025",
          "date_end": "2025-10-16",
          "whale_buy": 291.6,
          "retail_buy": 182.18,
          "whale_sell": 267.34,
          "retail_sell": 155.09,
          "whale_buyavg": 3467.08,
          "whale_sellavg": 3466.67,
          "retail_buyavg": 3458.68,
          "retail_sellavg": 3468.07,
          "whale_cum_buy": 7385.93,
          "retail_cum_buy": 9435.7,
          "whale_cum_sell": 7268.2,
          "retail_cum_sell": 9716.36,
          "whale_net": 24.26,
          "retail_net": 27.09,
          "whale_cum_net": 117.73,
          "retail_cum_net": -280.66,
          "whale_cum_buy_lot": 21641558,
          "whale_cum_sell_lot": 21269983,
          "retail_cum_buy_lot": 27651228,
          "retail_cum_sell_lot": 28567941,
          "whale_net_lot": 371575,
          "retail_net_lot": -916713
        },
        {
          "day": 34,
          "date": "2025-10-17",
          "date_display": "17/10/2025",
          "date_end": "2025-10-17",
          "whale_buy": 201.51,
          "retail_buy": 203.44,
          "whale_sell": 293.66,
          "retail_sell": 341.11,
          "whale_buyavg": 3467.59,
          "whale_sellavg": 3464.48,
          "retail_buyavg": 3464.67,
          "retail_sellavg": 3467.94,
          "whale_cum_buy": 7587.44,
          "retail_cum_buy": 9639.14,
          "whale_cum_sell": 7561.86,
          "retail_cum_sell": 10057.46,
          "whale_net": -92.15,
          "retail_net": -137.67,
          "whale_cum_net": 25.58,
          "retail_cum_net": -418.32,
          "whale_cum_buy_lot": 22223831,
          "whale_cum_sell_lot": 22118189,
          "retail_cum_buy_lot": 28236170,
          "retail_cum_sell_lot": 29551456,
          "whale_net_lot": 105642,
          "retail_net_lot": -1315286
        },
        {
          "day": 35,
          "date": "2025-10-20",
          "date_display": "20/10/2025",
          "date_end": "2025-10-20",
          "whale_buy": 157.02,
          "retail_buy": 209.98,
          "whale_sell": 110.97,
          "retail_sell": 204.55,
          "whale_buyavg": 3316.03,
          "whale_sellavg": 3314.88,
          "retail_buyavg": 3315.73,
          "retail_sellavg": 3315.03,
          "whale_cum_buy": 7744.46,
          "retail_cum_buy": 9849.12,
          "whale_cum_sell": 7672.83,
          "retail_cum_sell": 10262.02,
          "whale_net": 46.05,
          "retail_net": 5.43,
          "whale_cum_net": 71.63,
          "retail_cum_net": -412.9,
          "whale_cum_buy_lot": 22701598,
          "whale_cum_sell_lot": 22464756,
          "retail_cum_buy_lot": 28886746,
          "retail_cum_sell_lot": 30185929,
          "whale_net_lot": 236842,
          "retail_net_lot": -1299183
        },
        {
          "day": 36,
          "date": "2025-10-21",
          "date_display": "21/10/2025",
          "date_end": "2025-10-21",
          "whale_buy": 122.91,
          "retail_buy": 112.06,
          "whale_sell": 92.86,
          "retail_sell": 135.0,
          "whale_buyavg": 3311.25,
          "whale_sellavg": 3311.12,
          "retail_buyavg": 3310.7,
          "retail_sellavg": 3312.5,
          "whale_cum_buy": 7867.37,
          "retail_cum_buy": 9961.18,
          "whale_cum_sell": 7765.69,
          "retail_cum_sell": 10397.02,
          "whale_net": 30.05,
          "retail_net": -22.94,
          "whale_cum_net": 101.68,
          "retail_cum_net": -435.83,
          "whale_cum_buy_lot": 23072889,
          "whale_cum_sell_lot": 22745265,
          "retail_cum_buy_lot": 29225197,
          "retail_cum_sell_lot": 30593488,
          "whale_net_lot": 327624,
          "retail_net_lot": -1368291
        },
        {
          "day": 37,
          "date": "2025-10-22",
          "date_display": "22/10/2025",
          "date_end": "2025-10-22",
          "whale_buy": 79.67,
          "retail_buy": 122.66,
          "whale_sell": 99.39,
          "retail_sell": 131.59,
          "whale_buyavg": 3176.62,
          "whale_sellavg": 3177.67,
          "retail_buyavg": 3176.98,
          "retail_sellavg": 3176.89,
          "whale_cum_buy": 7947.03,
          "retail_cum_buy": 10083.84,
          "whale_cum_sell": 7865.08,
          "retail_cum_sell": 10528.61,
          "whale_net": -19.72,
          "retail_net": -8.93,
          "whale_cum_net": 81.96,
          "retail_cum_net": -444.77,
          "whale_cum_buy_lot": 23333172,
          "whale_cum_sell_lot": 23029677,
          "retail_cum_buy_lot": 29616703,
          "retail_cum_sell_lot": 31018387,
          "whale_net_lot": 303495,
          "retail_net_lot": -1401684
        },
        {
          "day": 38,
          "date": "2025-10-23",
          "date_display": "23/10/2025",
          "date_end": "2025-10-23",
          "whale_buy": 85.19,
          "retail_buy": 109.91,
          "whale_sell": 83.03,
          "retail_sell": 103.12,
          "whale_buyavg": 3190.55,
          "whale_sellavg": 3190.06,
          "retail_buyavg": 3186.74,
          "retail_sellavg": 3187.57,
          "whale_cum_buy": 8032.23,
          "retail_cum_buy": 10193.75,
          "whale_cum_sell": 7948.11,
          "retail_cum_sell": 10631.73,
          "whale_net": 2.17,
          "retail_net": 6.79,
          "whale_cum_net": 84.12,
          "retail_cum_net": -437.97,
          "whale_cum_buy_lot": 23600224,
          "whale_cum_sell_lot": 23289910,
          "retail_cum_buy_lot": 29961432,
          "retail_cum_sell_lot": 31341671,
          "whale_net_lot": 310314,
          "retail_net_lot": -1380239
        },
        {
          "day": 39,
          "date": "2025-10-24",
          "date_display": "24/10/2025",
          "date_end": "2025-10-24",
          "whale_buy": 73.64,
          "retail_buy": 110.95,
          "whale_sell": 77.6,
          "retail_sell": 102.53,
          "whale_buyavg": 3161.5,
          "whale_sellavg": 3157.22,
          "retail_buyavg": 3157.81,
          "retail_sellavg": 3161.3,
          "whale_cum_buy": 8105.87,
          "retail_cum_buy": 10304.7,
          "whale_cum_sell": 8025.7,
          "retail_cum_sell": 10734.26,
          "whale_net": -3.96,
          "retail_net": 8.42,
          "whale_cum_net": 80.17,
          "retail_cum_net": -429.56,
          "whale_cum_buy_lot": 23834323,
          "whale_cum_sell_lot": 23520292,
          "retail_cum_buy_lot": 30314105,
          "retail_cum_sell_lot": 31667756,
          "whale_net_lot": 314031,
          "retail_net_lot": -1353651
        },
        {
          "day": 40,
          "date": "2025-10-27",
          "date_display": "27/10/2025",
          "date_end": "2025-10-27",
          "whale_buy": 70.13,
          "retail_buy": 123.89,
          "whale_sell": 99.94,
          "retail_sell": 108.56,
          "whale_buyavg": 3155.69,
          "whale_sellavg": 3143.08,
          "retail_buyavg": 3147.09,
          "retail_sellavg": 3152.98,
          "whale_cum_buy": 8176.0,
          "retail_cum_buy": 10428.59,
          "whale_cum_sell": 8125.64,
          "retail_cum_sell": 10842.82,
          "whale_net": -29.8,
          "retail_net": 15.32,
          "whale_cum_net": 50.36,
          "retail_cum_net": -414.23,
          "whale_cum_buy_lot": 24057177,
          "whale_cum_sell_lot": 23838101,
          "retail_cum_buy_lot": 30707777,
          "retail_cum_sell_lot": 32012636,
          "whale_net_lot": 219076,
          "retail_net_lot": -1304859
        },
        {
          "day": 41,
          "date": "2025-10-28",
          "date_display": "28/10/2025",
          "date_end": "2025-10-28",
          "whale_buy": 66.82,
          "retail_buy": 134.7,
          "whale_sell": 47.81,
          "retail_sell": 148.42,
          "whale_buyavg": 3093.52,
          "whale_sellavg": 3093.86,
          "retail_buyavg": 3094.97,
          "retail_sellavg": 3093.67,
          "whale_cum_buy": 8242.82,
          "retail_cum_buy": 10563.29,
          "whale_cum_sell": 8173.45,
          "retail_cum_sell": 10991.24,
          "whale_net": 19.01,
          "retail_net": -13.72,
          "whale_cum_net": 69.37,
          "retail_cum_net": -427.95,
          "whale_cum_buy_lot": 24275520,
          "whale_cum_sell_lot": 23994868,
          "retail_cum_buy_lot": 31146559,
          "retail_cum_sell_lot": 32497187,
          "whale_net_lot": 280652,
          "retail_net_lot": -1350628
        },
        {
          "day": 42,
          "date": "2025-10-29",
          "date_display": "29/10/2025",
          "date_end": "2025-10-29",
          "whale_buy": 88.26,
          "retail_buy": 93.27,
          "whale_sell": 83.65,
          "retail_sell": 117.54,
          "whale_buyavg": 3170.06,
          "whale_sellavg": 3169.6,
          "retail_buyavg": 3173.1,
          "retail_sellavg": 3170.37,
          "whale_cum_buy": 8331.08,
          "retail_cum_buy": 10656.55,
          "whale_cum_sell": 8257.09,
          "retail_cum_sell": 11108.77,
          "whale_net": 4.62,
          "retail_net": -24.27,
          "whale_cum_net": 73.99,
          "retail_cum_net": -452.22,
          "whale_cum_buy_lot": 24552816,
          "whale_cum_sell_lot": 24257027,
          "retail_cum_buy_lot": 31569156,
          "retail_cum_sell_lot": 33002145,
          "whale_net_lot": 295789,
          "retail_net_lot": -1432989
        },
        {
          "day": 43,
          "date": "2025-10-30",
          "date_display": "30/10/2025",
          "date_end": "2025-10-30",
          "whale_buy": 46.85,
          "retail_buy": 93.17,
          "whale_sell": 37.19,
          "retail_sell": 121.1,
          "whale_buyavg": 3138.68,
          "whale_sellavg": 3144.26,
          "retail_buyavg": 3143.32,
          "retail_sellavg": 3141.29,
          "whale_cum_buy": 8377.93,
          "retail_cum_buy": 10749.72,
          "whale_cum_sell": 8294.28,
          "retail_cum_sell": 11229.87,
          "whale_net": 9.66,
          "retail_net": -27.93,
          "whale_cum_net": 83.64,
          "retail_cum_net": -480.15,
          "whale_cum_buy_lot": 24702931,
          "whale_cum_sell_lot": 24376343,
          "retail_cum_buy_lot": 31868565,
          "retail_cum_sell_lot": 33390411,
          "whale_net_lot": 326588,
          "retail_net_lot": -1521846
        },
        {
          "day": 44,
          "date": "2025-10-31",
          "date_display": "31/10/2025",
          "date_end": "2025-10-31",
          "whale_buy": 572.58,
          "retail_buy": 871.56,
          "whale_sell": 576.02,
          "retail_sell": 867.96,
          "whale_buyavg": 3139.09,
          "whale_sellavg": 3140.07,
          "retail_buyavg": 3138.01,
          "retail_sellavg": 3138.01,
          "whale_cum_buy": 8950.51,
          "retail_cum_buy": 11621.28,
          "whale_cum_sell": 8870.3,
          "retail_cum_sell": 12097.83,
          "whale_net": -3.43,
          "retail_net": 3.6,
          "whale_cum_net": 80.21,
          "retail_cum_net": -476.55,
          "whale_cum_buy_lot": 26527324,
          "whale_cum_sell_lot": 26211177,
          "retail_cum_buy_lot": 34646612,
          "retail_cum_sell_lot": 36157477,
          "whale_net_lot": 316147,
          "retail_net_lot": -1510865
        },
        {
          "day": 45,
          "date": "2025-11-03",
          "date_display": "03/11/2025",
          "date_end": "2025-11-03",
          "whale_buy": 74.64,
          "retail_buy": 100.65,
          "whale_sell": 73.13,
          "retail_sell": 102.9,
          "whale_buyavg": 3105.23,
          "whale_sellavg": 3103.65,
          "retail_buyavg": 3105.5,
          "retail_sellavg": 3106.64,
          "whale_cum_buy": 9025.16,
          "retail_cum_buy": 11721.93,
          "whale_cum_sell": 8943.43,
          "retail_cum_sell": 12200.73,
          "whale_net": 1.51,
          "retail_net": -2.26,
          "whale_cum_net": 81.73,
          "retail_cum_net": -478.8,
          "whale_cum_buy_lot": 26767702,
          "whale_cum_sell_lot": 26446804,
          "retail_cum_buy_lot": 34970747,
          "retail_cum_sell_lot": 36488794,
          "whale_net_lot": 320898,
          "retail_net_lot": -1518047
        },
        {
          "day": 46,
          "date": "2025-11-04",
          "date_display": "04/11/2025",
          "date_end": "2025-11-04",
          "whale_buy": 130.97,
          "retail_buy": 255.2,
          "whale_sell": 118.24,
          "retail_sell": 282.39,
          "whale_buyavg": 3023.53,
          "whale_sellavg": 3024.84,
          "retail_buyavg": 3016.2,
          "retail_sellavg": 3015.22,
          "whale_cum_buy": 9156.13,
          "retail_cum_buy": 11977.13,
          "whale_cum_sell": 9061.66,
          "retail_cum_sell": 12483.12,
          "whale_net": 12.74,
          "retail_net": -27.19,
          "whale_cum_net": 94.46,
          "retail_cum_net": -505.99,
          "whale_cum_buy_lot": 27206686,
          "whale_cum_sell_lot": 26841609,
          "retail_cum_buy_lot": 35824056,
          "retail_cum_sell_lot": 37432952,
          "whale_net_lot": 365077,
          "retail_net_lot": -1608896
        },
        {
          "day": 47,
          "date": "2025-11-05",
          "date_display": "05/11/2025",
          "date_end": "2025-11-05",
          "whale_buy": 104.05,
          "retail_buy": 190.67,
          "whale_sell": 99.49,
          "retail_sell": 131.7,
          "whale_buyavg": 2943.19,
          "whale_sellavg": 2947.78,
          "retail_buyavg": 2950.42,
          "retail_sellavg": 2945.18,
          "whale_cum_buy": 9260.18,
          "retail_cum_buy": 12167.8,
          "whale_cum_sell": 9161.16,
          "retail_cum_sell": 12614.82,
          "whale_net": 4.55,
          "retail_net": 58.97,
          "whale_cum_net": 99.02,
          "retail_cum_net": -447.02,
          "whale_cum_buy_lot": 27561946,
          "whale_cum_sell_lot": 27180144,
          "retail_cum_buy_lot": 36462273,
          "retail_cum_sell_lot": 37886872,
          "whale_net_lot": 381802,
          "retail_net_lot": -1424599
        },
        {
          "day": 48,
          "date": "2025-11-06",
          "date_display": "06/11/2025",
          "date_end": "2025-11-06",
          "whale_buy": 47.96,
          "retail_buy": 110.16,
          "whale_sell": 68.74,
          "retail_sell": 92.08,
          "whale_buyavg": 2941.27,
          "whale_sellavg": 2944.46,
          "retail_buyavg": 2942.9,
          "retail_sellavg": 2943.72,
          "whale_cum_buy": 9308.14,
          "retail_cum_buy": 12277.96,
          "whale_cum_sell": 9229.9,
          "retail_cum_sell": 12706.9,
          "whale_net": -20.78,
          "retail_net": 18.08,
          "whale_cum_net": 78.24,
          "retail_cum_net": -428.94,
          "whale_cum_buy_lot": 27724832,
          "whale_cum_sell_lot": 27413733,
          "retail_cum_buy_lot": 36836662,
          "retail_cum_sell_lot": 38199533,
          "whale_net_lot": 311099,
          "retail_net_lot": -1362871
        },
        {
          "day": 49,
          "date": "2025-11-07",
          "date_display": "07/11/2025",
          "date_end": "2025-11-07",
          "whale_buy": 74.15,
          "retail_buy": 47.31,
          "whale_sell": 102.13,
          "retail_sell": 68.46,
          "whale_buyavg": 2913.62,
          "whale_sellavg": 2911.09,
          "retail_buyavg": 2910.62,
          "retail_sellavg": 2913.98,
          "whale_cum_buy": 9382.29,
          "retail_cum_buy": 12325.27,
          "whale_cum_sell": 9332.03,
          "retail_cum_sell": 12775.35,
          "whale_net": -27.97,
          "retail_net": -21.14,
          "whale_cum_net": 50.26,
          "retail_cum_net": -450.08,
          "whale_cum_buy_lot": 27981210,
          "whale_cum_sell_lot": 27766212,
          "retail_cum_buy_lot": 37002400,
          "retail_cum_sell_lot": 38436508,
          "whale_net_lot": 214998,
          "retail_net_lot": -1434108
        },
        {
          "day": 50,
          "date": "2025-11-10",
          "date_display": "10/11/2025",
          "date_end": "2025-11-10",
          "whale_buy": 58.19,
          "retail_buy": 154.79,
          "whale_sell": 39.89,
          "retail_sell": 178.25,
          "whale_buyavg": 2911.02,
          "whale_sellavg": 2911.05,
          "retail_buyavg": 2914.46,
          "retail_sellavg": 2913.18,
          "whale_cum_buy": 9440.48,
          "retail_cum_buy": 12480.06,
          "whale_cum_sell": 9371.91,
          "retail_cum_sell": 12953.61,
          "whale_net": 18.3,
          "retail_net": -23.47,
          "whale_cum_net": 68.56,
          "retail_cum_net": -473.55,
          "whale_cum_buy_lot": 28180976,
          "whale_cum_sell_lot": 27902538,
          "retail_cum_buy_lot": 37533104,
          "retail_cum_sell_lot": 39048291,
          "whale_net_lot": 278438,
          "retail_net_lot": -1515187
        },
        {
          "day": 51,
          "date": "2025-11-11",
          "date_display": "11/11/2025",
          "date_end": "2025-11-11",
          "whale_buy": 89.2,
          "retail_buy": 172.5,
          "whale_sell": 86.66,
          "retail_sell": 126.23,
          "whale_buyavg": 2907.9,
          "whale_sellavg": 2907.11,
          "retail_buyavg": 2909.09,
          "retail_sellavg": 2910.31,
          "whale_cum_buy": 9529.68,
          "retail_cum_buy": 12652.56,
          "whale_cum_sell": 9458.57,
          "retail_cum_sell": 13079.84,
          "whale_net": 2.55,
          "retail_net": 46.28,
          "whale_cum_net": 71.11,
          "retail_cum_net": -427.27,
          "whale_cum_buy_lot": 28487811,
          "whale_cum_sell_lot": 28200941,
          "retail_cum_buy_lot": 38126220,
          "retail_cum_sell_lot": 39482378,
          "whale_net_lot": 286870,
          "retail_net_lot": -1356158
        },
        {
          "day": 52,
          "date": "2025-11-12",
          "date_display": "12/11/2025",
          "date_end": "2025-11-12",
          "whale_buy": 60.82,
          "retail_buy": 116.98,
          "whale_sell": 68.38,
          "retail_sell": 123.25,
          "whale_buyavg": 2887.77,
          "whale_sellavg": 2885.42,
          "retail_buyavg": 2885.12,
          "retail_sellavg": 2885.42,
          "whale_cum_buy": 9590.51,
          "retail_cum_buy": 12769.54,
          "whale_cum_sell": 9526.95,
          "retail_cum_sell": 13203.09,
          "whale_net": -7.55,
          "retail_net": -6.28,
          "whale_cum_net": 63.56,
          "retail_cum_net": -433.55,
          "whale_cum_buy_lot": 28698768,
          "whale_cum_sell_lot": 28438142,
          "retail_cum_buy_lot": 38532251,
          "retail_cum_sell_lot": 39909826,
          "whale_net_lot": 260626,
          "retail_net_lot": -1377575
        },
        {
          "day": 53,
          "date": "2025-11-13",
          "date_display": "13/11/2025",
          "date_end": "2025-11-13",
          "whale_buy": 44.96,
          "retail_buy": 117.8,
          "whale_sell": 47.55,
          "retail_sell": 92.48,
          "whale_buyavg": 2897.58,
          "whale_sellavg": 2898.18,
          "retail_buyavg": 2897.4,
          "retail_sellavg": 2897.28,
          "whale_cum_buy": 9635.47,
          "retail_cum_buy": 12887.35,
          "whale_cum_sell": 9574.5,
          "retail_cum_sell": 13295.56,
          "whale_net": -2.59,
          "retail_net": 25.33,
          "whale_cum_net": 60.97,
          "retail_cum_net": -408.22,
          "whale_cum_buy_lot": 28853585,
          "whale_cum_sell_lot": 28601892,
          "retail_cum_buy_lot": 38938527,
          "retail_cum_sell_lot": 40228267,
          "whale_net_lot": 251693,
          "retail_net_lot": -1289740
        },
        {
          "day": 54,
          "date": "2025-11-14",
          "date_display": "14/11/2025",
          "date_end": "2025-11-14",
          "whale_buy": 143.42,
          "retail_buy": 452.62,
          "whale_sell": 141.61,
          "retail_sell": 446.4,
          "whale_buyavg": 2987.02,
          "whale_sellavg": 2986.19,
          "retail_buyavg": 2989.56,
          "retail_sellavg": 2990.0,
          "whale_cum_buy": 9778.89,
          "retail_cum_buy": 13339.96,
          "whale_cum_sell": 9716.11,
          "retail_cum_sell": 13741.96,
          "whale_net": 1.81,
          "retail_net": 6.22,
          "whale_cum_net": 62.78,
          "retail_cum_net": -402.0,
          "whale_cum_buy_lot": 29327127,
          "whale_cum_sell_lot": 29070118,
          "retail_cum_buy_lot": 40443932,
          "retail_cum_sell_lot": 41723632,
          "whale_net_lot": 257009,
          "retail_net_lot": -1279700
        },
        {
          "day": 55,
          "date": "2025-11-17",
          "date_display": "17/11/2025",
          "date_end": "2025-11-17",
          "whale_buy": 155.69,
          "retail_buy": 253.59,
          "whale_sell": 163.31,
          "retail_sell": 272.4,
          "whale_buyavg": 3064.65,
          "whale_sellavg": 3061.31,
          "retail_buyavg": 3053.65,
          "retail_sellavg": 3053.37,
          "whale_cum_buy": 9934.58,
          "retail_cum_buy": 13593.55,
          "whale_cum_sell": 9879.42,
          "retail_cum_sell": 14014.36,
          "whale_net": -7.62,
          "retail_net": -18.81,
          "whale_cum_net": 55.15,
          "retail_cum_net": -420.81,
          "whale_cum_buy_lot": 29826253,
          "whale_cum_sell_lot": 29595889,
          "retail_cum_buy_lot": 41254631,
          "retail_cum_sell_lot": 42597832,
          "whale_net_lot": 230364,
          "retail_net_lot": -1343201
        },
        {
          "day": 56,
          "date": "2025-11-18",
          "date_display": "18/11/2025",
          "date_end": "2025-11-18",
          "whale_buy": 181.05,
          "retail_buy": 205.11,
          "whale_sell": 164.52,
          "retail_sell": 248.18,
          "whale_buyavg": 3055.6,
          "whale_sellavg": 3058.32,
          "retail_buyavg": 3055.3,
          "retail_sellavg": 3055.57,
          "whale_cum_buy": 10115.62,
          "retail_cum_buy": 13798.66,
          "whale_cum_sell": 10043.94,
          "retail_cum_sell": 14262.54,
          "whale_net": 16.53,
          "retail_net": -43.07,
          "whale_cum_net": 71.68,
          "retail_cum_net": -463.88,
          "whale_cum_buy_lot": 30418199,
          "whale_cum_sell_lot": 30134036,
          "retail_cum_buy_lot": 41926545,
          "retail_cum_sell_lot": 43410682,
          "whale_net_lot": 284163,
          "retail_net_lot": -1484137
        },
        {
          "day": 57,
          "date": "2025-11-19",
          "date_display": "19/11/2025",
          "date_end": "2025-11-19",
          "whale_buy": 88.14,
          "retail_buy": 99.11,
          "whale_sell": 77.26,
          "retail_sell": 104.06,
          "whale_buyavg": 3017.43,
          "whale_sellavg": 3015.27,
          "retail_buyavg": 3018.14,
          "retail_sellavg": 3019.19,
          "whale_cum_buy": 10203.76,
          "retail_cum_buy": 13897.76,
          "whale_cum_sell": 10121.2,
          "retail_cum_sell": 14366.6,
          "whale_net": 10.88,
          "retail_net": -4.96,
          "whale_cum_net": 82.56,
          "retail_cum_net": -468.84,
          "whale_cum_buy_lot": 30710939,
          "whale_cum_sell_lot": 30391502,
          "retail_cum_buy_lot": 42254932,
          "retail_cum_sell_lot": 43755906,
          "whale_net_lot": 319437,
          "retail_net_lot": -1500974
        },
        {
          "day": 58,
          "date": "2025-11-20",
          "date_display": "20/11/2025",
          "date_end": "2025-11-20",
          "whale_buy": 49.26,
          "retail_buy": 73.29,
          "whale_sell": 63.29,
          "retail_sell": 70.18,
          "whale_buyavg": 2993.3,
          "whale_sellavg": 2991.83,
          "retail_buyavg": 2992.32,
          "retail_sellavg": 2993.43,
          "whale_cum_buy": 10253.03,
          "retail_cum_buy": 13971.06,
          "whale_cum_sell": 10184.49,
          "retail_cum_sell": 14436.78,
          "whale_net": -14.03,
          "retail_net": 3.12,
          "whale_cum_net": 68.53,
          "retail_cum_net": -465.72,
          "whale_cum_buy_lot": 30876108,
          "whale_cum_sell_lot": 30603371,
          "retail_cum_buy_lot": 42500670,
          "retail_cum_sell_lot": 43991231,
          "whale_net_lot": 272737,
          "retail_net_lot": -1490561
        },
        {
          "day": 59,
          "date": "2025-11-21",
          "date_display": "21/11/2025",
          "date_end": "2025-11-21",
          "whale_buy": 79.91,
          "retail_buy": 34.44,
          "whale_sell": 98.71,
          "retail_sell": 47.18,
          "whale_buyavg": 2935.86,
          "whale_sellavg": 2936.14,
          "retail_buyavg": 2941.58,
          "retail_sellavg": 2949.94,
          "whale_cum_buy": 10332.94,
          "retail_cum_buy": 14005.5,
          "whale_cum_sell": 10283.2,
          "retail_cum_sell": 14483.96,
          "whale_net": -18.8,
          "retail_net": -12.74,
          "whale_cum_net": 49.74,
          "retail_cum_net": -478.46,
          "whale_cum_buy_lot": 31150601,
          "whale_cum_sell_lot": 30941827,
          "retail_cum_buy_lot": 42620315,
          "retail_cum_sell_lot": 44152489,
          "whale_net_lot": 208774,
          "retail_net_lot": -1532174
        },
        {
          "day": 60,
          "date": "2025-11-24",
          "date_display": "24/11/2025",
          "date_end": "2025-11-24",
          "whale_buy": 85.05,
          "retail_buy": 73.66,
          "whale_sell": 89.36,
          "retail_sell": 84.81,
          "whale_buyavg": 2936.13,
          "whale_sellavg": 2936.4,
          "retail_buyavg": 2931.71,
          "retail_sellavg": 2933.54,
          "whale_cum_buy": 10417.99,
          "retail_cum_buy": 14079.16,
          "whale_cum_sell": 10372.56,
          "retail_cum_sell": 14568.77,
          "whale_net": -4.32,
          "retail_net": -11.15,
          "whale_cum_net": 45.42,
          "retail_cum_net": -489.62,
          "whale_cum_buy_lot": 31440325,
          "whale_cum_sell_lot": 31246242,
          "retail_cum_buy_lot": 42872668,
          "retail_cum_sell_lot": 44442895,
          "whale_net_lot": 194083,
          "retail_net_lot": -1570227
        },
        {
          "day": 61,
          "date": "2025-11-25",
          "date_display": "25/11/2025",
          "date_end": "2025-11-25",
          "whale_buy": 67.85,
          "retail_buy": 113.68,
          "whale_sell": 62.47,
          "retail_sell": 131.9,
          "whale_buyavg": 2995.24,
          "whale_sellavg": 3001.07,
          "retail_buyavg": 2992.07,
          "retail_sellavg": 2987.01,
          "whale_cum_buy": 10485.84,
          "retail_cum_buy": 14192.84,
          "whale_cum_sell": 10435.03,
          "retail_cum_sell": 14700.67,
          "whale_net": 5.39,
          "retail_net": -18.22,
          "whale_cum_net": 50.81,
          "retail_cum_net": -507.84,
          "whale_cum_buy_lot": 31662595,
          "whale_cum_sell_lot": 31449860,
          "retail_cum_buy_lot": 43249380,
          "retail_cum_sell_lot": 44883304,
          "whale_net_lot": 212735,
          "retail_net_lot": -1633924
        },
        {
          "day": 62,
          "date": "2025-11-26",
          "date_display": "26/11/2025",
          "date_end": "2025-11-26",
          "whale_buy": 204.08,
          "retail_buy": 72.83,
          "whale_sell": 154.16,
          "retail_sell": 104.2,
          "whale_buyavg": 3028.82,
          "whale_sellavg": 3023.41,
          "retail_buyavg": 3019.91,
          "retail_sellavg": 3029.58,
          "whale_cum_buy": 10689.92,
          "retail_cum_buy": 14265.66,
          "whale_cum_sell": 10589.19,
          "retail_cum_sell": 14804.87,
          "whale_net": 49.92,
          "retail_net": -31.37,
          "whale_cum_net": 100.73,
          "retail_cum_net": -539.21,
          "whale_cum_buy_lot": 32334788,
          "whale_cum_sell_lot": 31958752,
          "retail_cum_buy_lot": 43489036,
          "retail_cum_sell_lot": 45225544,
          "whale_net_lot": 376036,
          "retail_net_lot": -1736508
        },
        {
          "day": 63,
          "date": "2025-11-27",
          "date_display": "27/11/2025",
          "date_end": "2025-11-27",
          "whale_buy": 71.22,
          "retail_buy": 81.77,
          "whale_sell": 74.83,
          "retail_sell": 80.55,
          "whale_buyavg": 3023.98,
          "whale_sellavg": 3017.19,
          "retail_buyavg": 3016.39,
          "retail_sellavg": 3023.56,
          "whale_cum_buy": 10761.15,
          "retail_cum_buy": 14347.43,
          "whale_cum_sell": 10664.02,
          "retail_cum_sell": 14885.42,
          "whale_net": -3.61,
          "retail_net": 1.22,
          "whale_cum_net": 97.13,
          "retail_cum_net": -537.99,
          "whale_cum_buy_lot": 32570233,
          "whale_cum_sell_lot": 32206937,
          "retail_cum_buy_lot": 43760076,
          "retail_cum_sell_lot": 45492056,
          "whale_net_lot": 363296,
          "retail_net_lot": -1731980
        },
        {
          "day": 64,
          "date": "2025-11-28",
          "date_display": "28/11/2025",
          "date_end": "2025-11-28",
          "whale_buy": 102.31,
          "retail_buy": 177.95,
          "whale_sell": 116.92,
          "retail_sell": 169.3,
          "whale_buyavg": 2930.89,
          "whale_sellavg": 2934.07,
          "retail_buyavg": 2929.49,
          "retail_sellavg": 2928.23,
          "whale_cum_buy": 10863.46,
          "retail_cum_buy": 14525.39,
          "whale_cum_sell": 10780.94,
          "retail_cum_sell": 15054.72,
          "whale_net": -14.6,
          "retail_net": 8.65,
          "whale_cum_net": 82.52,
          "retail_cum_net": -529.33,
          "whale_cum_buy_lot": 32922788,
          "whale_cum_sell_lot": 32608548,
          "retail_cum_buy_lot": 44374238,
          "retail_cum_sell_lot": 46077516,
          "whale_net_lot": 314240,
          "retail_net_lot": -1703278
        },
        {
          "day": 65,
          "date": "2025-12-01",
          "date_display": "01/12/2025",
          "date_end": "2025-12-01",
          "whale_buy": 98.21,
          "retail_buy": 70.22,
          "whale_sell": 78.43,
          "retail_sell": 85.39,
          "whale_buyavg": 2979.32,
          "whale_sellavg": 2974.15,
          "retail_buyavg": 2966.82,
          "retail_sellavg": 2973.78,
          "whale_cum_buy": 10961.67,
          "retail_cum_buy": 14595.61,
          "whale_cum_sell": 10859.36,
          "retail_cum_sell": 15140.11,
          "whale_net": 19.78,
          "retail_net": -15.16,
          "whale_cum_net": 102.31,
          "retail_cum_net": -544.5,
          "whale_cum_buy_lot": 33251162,
          "whale_cum_sell_lot": 32871329,
          "retail_cum_buy_lot": 44610365,
          "retail_cum_sell_lot": 46363820,
          "whale_net_lot": 379833,
          "retail_net_lot": -1753455
        },
        {
          "day": 66,
          "date": "2025-12-02",
          "date_display": "02/12/2025",
          "date_end": "2025-12-02",
          "whale_buy": 73.41,
          "retail_buy": 68.01,
          "whale_sell": 56.81,
          "retail_sell": 81.29,
          "whale_buyavg": 2979.35,
          "whale_sellavg": 2980.14,
          "retail_buyavg": 2977.4,
          "retail_sellavg": 2976.69,
          "whale_cum_buy": 11035.08,
          "retail_cum_buy": 14663.62,
          "whale_cum_sell": 10916.17,
          "retail_cum_sell": 15221.4,
          "whale_net": 16.6,
          "retail_net": -13.29,
          "whale_cum_net": 118.91,
          "retail_cum_net": -557.79,
          "whale_cum_buy_lot": 33497526,
          "whale_cum_sell_lot": 33061796,
          "retail_cum_buy_lot": 44838528,
          "retail_cum_sell_lot": 46636765,
          "whale_net_lot": 435730,
          "retail_net_lot": -1798237
        },
        {
          "day": 67,
          "date": "2025-12-03",
          "date_display": "03/12/2025",
          "date_end": "2025-12-03",
          "whale_buy": 67.83,
          "retail_buy": 55.63,
          "whale_sell": 46.0,
          "retail_sell": 76.52,
          "whale_buyavg": 2935.58,
          "whale_sellavg": 2935.96,
          "retail_buyavg": 2938.2,
          "retail_sellavg": 2936.89,
          "whale_cum_buy": 11102.91,
          "retail_cum_buy": 14719.25,
          "whale_cum_sell": 10962.17,
          "retail_cum_sell": 15297.92,
          "whale_net": 21.84,
          "retail_net": -20.89,
          "whale_cum_net": 140.75,
          "retail_cum_net": -578.67,
          "whale_cum_buy_lot": 33729418,
          "whale_cum_sell_lot": 33219990,
          "retail_cum_buy_lot": 45029638,
          "retail_cum_sell_lot": 46898859,
          "whale_net_lot": 509428,
          "retail_net_lot": -1869221
        },
        {
          "day": 68,
          "date": "2025-12-04",
          "date_display": "04/12/2025",
          "date_end": "2025-12-04",
          "whale_buy": 46.28,
          "retail_buy": 83.38,
          "whale_sell": 38.28,
          "retail_sell": 70.86,
          "whale_buyavg": 2912.27,
          "whale_sellavg": 2908.79,
          "retail_buyavg": 2911.75,
          "retail_sellavg": 2914.6,
          "whale_cum_buy": 11149.19,
          "retail_cum_buy": 14802.63,
          "whale_cum_sell": 11000.45,
          "retail_cum_sell": 15368.79,
          "whale_net": 8.0,
          "retail_net": 12.52,
          "whale_cum_net": 148.75,
          "retail_cum_net": -566.15,
          "whale_cum_buy_lot": 33888417,
          "whale_cum_sell_lot": 33352610,
          "retail_cum_buy_lot": 45311462,
          "retail_cum_sell_lot": 47142392,
          "whale_net_lot": 535807,
          "retail_net_lot": -1830930
        },
        {
          "day": 69,
          "date": "2025-12-05",
          "date_display": "05/12/2025",
          "date_end": "2025-12-05",
          "whale_buy": 40.21,
          "retail_buy": 74.9,
          "whale_sell": 39.76,
          "retail_sell": 61.99,
          "whale_buyavg": 2917.0,
          "whale_sellavg": 2918.74,
          "retail_buyavg": 2916.18,
          "retail_sellavg": 2916.01,
          "whale_cum_buy": 11189.41,
          "retail_cum_buy": 14877.54,
          "whale_cum_sell": 11040.2,
          "retail_cum_sell": 15430.78,
          "whale_net": 0.46,
          "retail_net": 12.91,
          "whale_cum_net": 149.2,
          "retail_cum_net": -553.24,
          "whale_cum_buy_lot": 34026267,
          "whale_cum_sell_lot": 33488749,
          "retail_cum_buy_lot": 45568328,
          "retail_cum_sell_lot": 47354871,
          "whale_net_lot": 537518,
          "retail_net_lot": -1786543
        },
        {
          "day": 70,
          "date": "2025-12-08",
          "date_display": "08/12/2025",
          "date_end": "2025-12-08",
          "whale_buy": 89.13,
          "retail_buy": 53.64,
          "whale_sell": 57.89,
          "retail_sell": 83.21,
          "whale_buyavg": 2953.71,
          "whale_sellavg": 2955.07,
          "retail_buyavg": 2960.05,
          "retail_sellavg": 2955.6,
          "whale_cum_buy": 11278.54,
          "retail_cum_buy": 14931.18,
          "whale_cum_sell": 11098.09,
          "retail_cum_sell": 15513.99,
          "whale_net": 31.24,
          "retail_net": -29.57,
          "whale_cum_net": 180.45,
          "retail_cum_net": -582.81,
          "whale_cum_buy_lot": 34327200,
          "whale_cum_sell_lot": 33683637,
          "retail_cum_buy_lot": 45748886,
          "retail_cum_sell_lot": 47635953,
          "whale_net_lot": 643563,
          "retail_net_lot": -1887067
        },
        {
          "day": 71,
          "date": "2025-12-09",
          "date_display": "09/12/2025",
          "date_end": "2025-12-09",
          "whale_buy": 42.29,
          "retail_buy": 59.65,
          "whale_sell": 52.17,
          "retail_sell": 34.14,
          "whale_buyavg": 2936.69,
          "whale_sellavg": 2934.24,
          "retail_buyavg": 2930.18,
          "retail_sellavg": 2932.37,
          "whale_cum_buy": 11320.83,
          "retail_cum_buy": 14990.83,
          "whale_cum_sell": 11150.26,
          "retail_cum_sell": 15548.13,
          "whale_net": -9.87,
          "retail_net": 25.51,
